affordable traffic lawyers austin tx|[https://www.austinareatraffictickets.com/]|10|15|5|UP|BNG
attorney driving ticket austin|[https://www.austinareatraffictickets.com/]|1|2|1|UP|BNG
attorney driving ticket austin tx|[https://www.austinareatraffictickets.com/]|1|3|2|UP|BNG
attorney for driving ticket austin|[https://www.austinareatraffictickets.com/]|1|2|1|UP|BNG
attorney for driving ticket austin tx|[https://www.austinareatraffictickets.com/]|1|4|3|UP|BNG
attorney for speeding ticket austin|[https://www.austinareatraffictickets.com/]|2|3|1|UP|BNG
attorney for speeding ticket austin tx|[https://www.austinareatraffictickets.com/]|2|5|3|UP|BNG
attorney for speeding tickets austin|[https://www.austinareatraffictickets.com/]|1|4|3|UP|BNG
attorney for traffic ticket austin|[https://www.austinareatraffictickets.com/]|2|2|0|EQ|BNG
attorney for traffic ticket austin tx|[https://www.austinareatraffictickets.com/]|2|3|1|UP|BNG
attorney for traffic tickets austin|[https://www.austinareatraffictickets.com/]|2|3|1|UP|BNG
attorney for traffic tickets austin tx|[https://www.austinareatraffictickets.com/]|2|3|1|UP|BNG
attorney for warrants austin|[https://www.austinareatraffictickets.com/about/traffic-warrants-lawyer-austin/]|4|2|-2|DOWN|BNG
attorney speeding ticket austin|[https://www.austinareatraffictickets.com/]|1|3|2|UP|BNG
attorney speeding ticket austin tx|[https://www.austinareatraffictickets.com/]|2|7|5|UP|BNG
attorney traffic ticket austin|[https://www.austinareatraffictickets.com/]|1|2|1|UP|BNG
attorney traffic ticket austin tx|[https://www.austinareatraffictickets.com/]|2|3|1|UP|BNG
attorney traffic tickets austin|[https://www.austinareatraffictickets.com/]|1|1|0|EQ|BNG
attorney traffic tickets austin tx|[https://www.austinareatraffictickets.com/]|1|2|1|UP|BNG
attorney warrants austin|[https://www.austinareatraffictickets.com/about/traffic-warrants-lawyer-austin/]|8|3|-5|DOWN|BNG
attorney warrants austin tx|[https://www.austinareatraffictickets.com/]|16|0|10|NEW|BNG
attorneys for traffic issues austin|[https://www.austinareatraffictickets.com/services/traffic-tickets/]|15|26|11|UP|BNG
attorneys for traffic tickets austin|[https://www.austinareatraffictickets.com/]|7|0|19|NEW|BNG
attorneys for traffic tickets austin tx|[https://www.austinareatraffictickets.com/]|12|9|-3|DOWN|BNG
attorneys traffic ticket austin|[https://www.austinareatraffictickets.com/]|2|9|7|UP|BNG
attorneys traffic ticket austin tx|[https://www.austinareatraffictickets.com/]|9|9|0|EQ|BNG
austin attorney class c violations|[https://www.austinareatraffictickets.com/services/class-c-violations/]|1|1|0|EQ|BNG
austin attorney for speeding ticket|[https://www.austinareatraffictickets.com/]|1|3|2|UP|BNG
austin attorney for speeding tickets|[https://www.austinareatraffictickets.com/]|1|3|2|UP|BNG
austin attorney for traffic ticket|[https://www.austinareatraffictickets.com/]|1|2|1|UP|BNG
austin attorney for traffic tickets|[https://www.austinareatraffictickets.com/]|2|1|-1|DOWN|BNG
austin attorney speeding ticket|[https://www.austinareatraffictickets.com/]|1|2|1|UP|BNG
austin attorney suspended driver license|[https://www.austinareatraffictickets.com/services/traffic-warrants/suspended-license-attorney-austin/]|1|1|0|EQ|BNG
austin attorney traffic laws|[https://www.austinareatraffictickets.com/services/traffic-tickets/]|4|5|1|UP|BNG
austin attorney traffic ticket|[https://www.austinareatraffictickets.com/]|1|1|0|EQ|BNG
austin attorney traffic tickets|[https://www.austinareatraffictickets.com/]|1|1|0|EQ|BNG
austin attorney traffic violation|[https://www.austinareatraffictickets.com/about/traffic-violation-lawyers-austin/]|2|2|0|EQ|BNG
austin attorneys for traffic tickets|[https://www.austinareatraffictickets.com/]|2|2|0|EQ|BNG
austin attorneys for traffic violations|[https://www.austinareatraffictickets.com/]|12|0|14|NEW|BNG
austin attorneys speeding tickets|[https://www.austinareatraffictickets.com/]|1|2|1|UP|BNG
austin attorneys traffic violations|[https://www.austinareatraffictickets.com/]|7|13|6|UP|BNG
austin business drivers license lawyers|[https://www.austinareatraffictickets.com/about/driver-license-attorney/]|11|1|-10|DOWN|BNG
austin cdl best lawyer|[https://www.austinareatraffictickets.com/services/austin-cdl-best-lawyer/]|1|1|0|EQ|BNG
austin cdl dot violation lawyers|[https://www.austinareatraffictickets.com/]|14|2|-12|DOWN|BNG
austin cdl traffic lawyers|[https://www.austinareatraffictickets.com/services/austin-cdl-best-lawyer/]|1|2|1|UP|BNG
austin cheap lawyer traffic ticket|[https://www.austinareatraffictickets.com/]|8|8|0|EQ|BNG
austin cheap speeding ticket lawyer|[https://www.austinareatraffictickets.com/]|3|4|1|UP|BNG
austin cheap traffic ticket lawyer|[https://www.austinareatraffictickets.com/]|4|6|2|UP|BNG
austin cheap traffic ticket lawyers|[https://www.austinareatraffictickets.com/]|5|6|1|UP|BNG
austin cheap traffic tickets lawyers|[https://www.austinareatraffictickets.com/services/traffic-tickets/]|8|4|-4|DOWN|BNG
austin class c violation lawyer|[https://www.austinareatraffictickets.com/what-are-class-c-violations/]|1|1|0|EQ|BNG
austin class c violations attorney|[https://www.austinareatraffictickets.com/services/class-c-violations/]|1|1|0|EQ|BNG
austin driver license lawyers|[https://www.austinareatraffictickets.com/]|5|6|1|UP|BNG
austin driver license reinstatement lawyer|[https://www.austinareatraffictickets.com/services/austin-drivers-license-reinstatement-attorney/]|3|1|-2|DOWN|BNG
austin drivers license attorney|[https://www.austinareatraffictickets.com/about/driver-license-attorney/]|3|2|-1|DOWN|BNG
austin drivers license lawyer|[https://www.austinareatraffictickets.com/about/driver-license-attorney/]|2|2|0|EQ|BNG
austin drivers license suspension lawyer|[https://www.austinareatraffictickets.com/services/driver-license-suspension-hearing-attorney/]|4|3|-1|DOWN|BNG
austin free traffic ticket lawyer|[https://www.austinareatraffictickets.com/]|4|3|-1|DOWN|BNG
austin habitual violator drivers license|[https://www.austinareatraffictickets.com/services/class-c-violations/habitual-violator-drivers-license-austin-tx/]|1|1|0|EQ|BNG
austin lawyer driving ticket|[https://www.austinareatraffictickets.com/]|1|2|1|UP|BNG
austin lawyer for parking ticket violations|[https://www.austinareatraffictickets.com/no-parking-no-stopping-and-no-standing-whats-the-difference/]|21|22|1|UP|BNG
austin lawyer for speeding ticket|[https://www.austinareatraffictickets.com/]|1|3|2|UP|BNG
austin lawyer for speeding tickets|[https://www.austinareatraffictickets.com/]|1|2|1|UP|BNG
austin lawyer for suspended license|[https://www.austinareatraffictickets.com/services/traffic-warrants/suspended-license-lawyer-austin-tx/]|3|2|-1|DOWN|BNG
austin lawyer for ticket violations|[https://www.austinareatraffictickets.com/]|2|10|8|UP|BNG
austin lawyer for traffic violation|[https://www.austinareatraffictickets.com/]|6|0|20|NEW|BNG
austin lawyer reckless driving charges|[https://www.austinareatraffictickets.com/services/traffic-tickets/]|14|8|-6|DOWN|BNG
austin lawyer reckless driving warrants|[https://www.austinareatraffictickets.com/services/]|1|1|0|EQ|BNG
austin lawyer speeding ticket|[https://www.austinareatraffictickets.com/]|1|3|2|UP|BNG
austin lawyer speeding warrants|[https://www.austinareatraffictickets.com/services/traffic-warrants/]|1|1|0|EQ|BNG
austin lawyer suspended drivers license|[https://www.austinareatraffictickets.com/services/austin-lawyer-suspended-drivers-license/]|2|2|0|EQ|BNG
austin lawyer traffic ticket dismissal|[https://www.austinareatraffictickets.com/]|1|1|0|EQ|BNG
austin lawyer traffic violation|[https://www.austinareatraffictickets.com/about/traffic-violation-lawyers-austin/]|2|3|1|UP|BNG
austin lawyers for tickets|[https://www.austinareatraffictickets.com/]|6|4|-2|DOWN|BNG
austin lawyers for traffic tickets|[https://www.austinareatraffictickets.com/]|4|6|2|UP|BNG
austin lawyers speeding tickets|[https://www.austinareatraffictickets.com/]|2|3|1|UP|BNG
austin lawyers that handle traffic tickets|[https://www.austinareatraffictickets.com/services/traffic-tickets/]|4|4|0|EQ|BNG
austin lawyers ticket|[https://www.austinareatraffictickets.com/]|2|3|1|UP|BNG
austin lawyers traffic ticket|[https://www.austinareatraffictickets.com/]|2|3|1|UP|BNG
austin lawyers traffic violations|[https://www.austinareatraffictickets.com/]|12|17|5|UP|BNG
austin occupational license attorney|[https://www.austinareatraffictickets.com/services/occupational-drivers-license/occupational-drivers-license-attorney-austin/]|3|3|0|EQ|BNG
austin occupational license lawyers|[https://www.austinareatraffictickets.com/services/occupational-drivers-license/occupational-drivers-license-attorney-austin/]|12|12|0|EQ|BNG
austin reckless driving charges lawyer|[https://www.austinareatraffictickets.com/services/traffic-tickets/]|11|5|-6|DOWN|BNG
austin reckless driving warrant lawyers|[https://www.austinareatraffictickets.com/services/]|1|1|0|EQ|BNG
austin reckless driving warrants|[https://www.austinareatraffictickets.com/services/]|5|4|-1|DOWN|BNG
austin revoked drivers license lawyer|[https://www.austinareatraffictickets.com/services/driver-license-suspension-hearing-attorney/]|3|2|-1|DOWN|BNG
austin revoked driver's license lawyer|[https://www.austinareatraffictickets.com/services/driver-license-suspension-hearing-attorney/]|2|3|1|UP|BNG
austin revoked license attorney|[https://www.austinareatraffictickets.com/services/austin-tx-suspended-license-attorneys/]|11|2|-9|DOWN|BNG
austin revoked license lawyers|[https://www.austinareatraffictickets.com/services/austin-lawyer-suspended-drivers-license/]|1|1|0|EQ|BNG
austin speeding ticket attoreny|[https://www.austinareatraffictickets.com/]|2|5|3|UP|BNG
austin speeding ticket attorney|[https://www.austinareatraffictickets.com/]|2|4|2|UP|BNG
austin speeding ticket attorneys|[https://www.austinareatraffictickets.com/]|4|4|0|EQ|BNG
austin speeding ticket lawyer|[https://www.austinareatraffictickets.com/]|1|3|2|UP|BNG
austin speeding ticket lawyers|[https://www.austinareatraffictickets.com/]|2|4|2|UP|BNG
austin speeding ticket violation lawyer|[https://www.austinareatraffictickets.com/services/traffic-tickets/]|4|5|1|UP|BNG
austin suspended license attorney|[https://www.austinareatraffictickets.com/services/traffic-warrants/suspended-license-attorney-austin/]|2|2|0|EQ|BNG
austin suspended license lawyer|[https://www.austinareatraffictickets.com/services/traffic-warrants/suspended-license-lawyer-austin-tx/]|4|2|-2|DOWN|BNG
austin texas traffic ticket|[https://www.austinareatraffictickets.com/services/traffic-tickets/]|9|3|-6|DOWN|BNG
austin texas traffic ticket attorney|[https://www.austinareatraffictickets.com/]|2|3|1|UP|BNG
austin texas traffic tickets|[https://www.austinareatraffictickets.com/services/traffic-tickets/]|9|3|-6|DOWN|BNG
austin texas traffic violation lawyers|[https://www.austinareatraffictickets.com/]|6|0|20|NEW|BNG
austin traffic attorney|[https://www.austinareatraffictickets.com/]|2|4|2|UP|BNG
austin traffic citation attorney|[https://www.austinareatraffictickets.com/]|3|5|2|UP|BNG
austin traffic citation lawyer|[https://www.austinareatraffictickets.com/]|7|5|-2|DOWN|BNG
austin traffic court attorneys|[https://www.austinareatraffictickets.com/]|5|4|-1|DOWN|BNG
austin traffic court lawyer|[https://www.austinareatraffictickets.com/]|2|2|0|EQ|BNG
austin traffic lawyer|[https://www.austinareatraffictickets.com/]|4|3|-1|DOWN|BNG
austin traffic lawyer class c misdemeanor|[https://www.austinareatraffictickets.com/]|1|1|0|EQ|BNG
austin traffic reinstatement lawyer|[https://www.austinareatraffictickets.com/services/austin-drivers-license-reinstatement-attorney/]|1|1|0|EQ|BNG
austin traffic ticket|[https://www.austinareatraffictickets.com/services/traffic-tickets/austin-traffic-ticket/]|6|6|0|EQ|BNG
austin traffic ticket attorney|[https://www.austinareatraffictickets.com/]|1|2|1|UP|BNG
austin traffic ticket attorneys|[https://www.austinareatraffictickets.com/]|2|3|1|UP|BNG
austin traffic ticket dismissal lawyer|[https://www.austinareatraffictickets.com/]|3|3|0|EQ|BNG
austin traffic ticket lawyer|[https://www.austinareatraffictickets.com/]|2|2|0|EQ|BNG
austin traffic ticket lawyer texas|[https://www.austinareatraffictickets.com/]|1|3|2|UP|BNG
austin traffic ticket lawyers|[https://www.austinareatraffictickets.com/]|2|3|1|UP|BNG
austin traffic tickets|[https://www.austinareatraffictickets.com/]|6|4|-2|DOWN|BNG
austin traffic tickets attorney|[https://www.austinareatraffictickets.com/]|1|2|1|UP|BNG
austin traffic tickets attorneys|[https://www.austinareatraffictickets.com/]|3|4|1|UP|BNG
austin traffic violation attorney|[https://www.austinareatraffictickets.com/]|7|6|-1|DOWN|BNG
austin traffic violation legal advice|[https://www.austinareatraffictickets.com/]|16|7|-9|DOWN|BNG
austin traffic violation legal services|[https://www.austinareatraffictickets.com/legal-services-for-traffic-warrants/]|1|1|0|EQ|BNG
austin traffic violations attorneys|[https://www.austinareatraffictickets.com/]|8|16|8|UP|BNG
austin traffic warrant lawyer|[https://www.austinareatraffictickets.com/services/traffic-warrants/]|1|1|0|EQ|BNG
austin traffick tickets|[https://www.austinareatraffictickets.com/]|5|7|2|UP|BNG
austin tx attorney for traffic ticket|[https://www.austinareatraffictickets.com/]|2|3|1|UP|BNG
austin tx attorneys for traffic violations|[https://www.austinareatraffictickets.com/]|11|14|3|UP|BNG
austin tx cdl dot violations attorneys|[https://www.austinareatraffictickets.com/]|12|18|6|UP|BNG
austin tx cdl lawyer|[https://www.austinareatraffictickets.com/about/]|3|1|-2|DOWN|BNG
austin tx cdl traffic ticket lawyer|[https://www.austinareatraffictickets.com/about/cdl-ticket-lawyer-austin/]|1|1|0|EQ|BNG
austin tx citation attorney|[https://www.austinareatraffictickets.com/]|2|16|14|UP|BNG
austin tx driver license lawyer|[https://www.austinareatraffictickets.com/services/austin-texas-drivers-license-attorney-near-me/]|12|5|-7|DOWN|BNG
austin tx drivers license lawyers|[https://www.austinareatraffictickets.com/]|9|4|-5|DOWN|BNG
austin tx lawyer for traffic tickets|[https://www.austinareatraffictickets.com/]|2|5|3|UP|BNG
austin tx lawyer speeding ticket|[https://www.austinareatraffictickets.com/]|2|3|1|UP|BNG
austin tx lawyers for traffic violations|[https://www.austinareatraffictickets.com/]|10|0|16|NEW|BNG
austin tx lawyers traffic violations|[https://www.austinareatraffictickets.com/]|10|23|13|UP|BNG
austin tx speeding ticket lawyer|[https://www.austinareatraffictickets.com/]|2|4|2|UP|BNG
austin tx speeding ticket lawyers|[https://www.austinareatraffictickets.com/]|3|4|1|UP|BNG
austin tx suspended license attorney|[https://www.austinareatraffictickets.com/services/traffic-warrants/suspended-license-attorney-austin/]|2|2|0|EQ|BNG
austin tx suspended license lawyer|[https://www.austinareatraffictickets.com/services/traffic-warrants/suspended-license-lawyer-austin-tx/]|3|2|-1|DOWN|BNG
austin tx ticket attorneys|[https://www.austinareatraffictickets.com/]|5|6|1|UP|BNG
austin tx traffic citation|[https://www.austinareatraffictickets.com/]|22|7|-15|DOWN|BNG
austin tx traffic citation attorney|[https://www.austinareatraffictickets.com/]|3|6|3|UP|BNG
austin tx traffic court attorney|[https://www.austinareatraffictickets.com/]|4|2|-2|DOWN|BNG
austin tx traffic court lawyer|[https://www.austinareatraffictickets.com/about/]|2|5|3|UP|BNG
austin tx traffic law attorney|[https://www.austinareatraffictickets.com/]|4|15|11|UP|BNG
austin tx traffic lawyers|[https://www.austinareatraffictickets.com/]|7|14|7|UP|BNG
austin tx traffic ticket lawyer|[https://www.austinareatraffictickets.com/]|2|3|1|UP|BNG
austin tx traffic ticket warrants attorney|[https://www.austinareatraffictickets.com/services/traffic-warrants/]|1|1|0|EQ|BNG
austin tx traffic tickets attorneys|[https://www.austinareatraffictickets.com/]|2|6|4|UP|BNG
austin tx traffic tickets lawyer|[https://www.austinareatraffictickets.com/]|2|4|2|UP|BNG
austin tx traffic tickets violation lawyer|[https://www.austinareatraffictickets.com/]|3|4|1|UP|BNG
austin tx traffic violation lawyer|[https://www.austinareatraffictickets.com/about/traffic-violation-attorneys/]|10|13|3|UP|BNG
austin tx traffic violations attorneys|[https://www.austinareatraffictickets.com/]|11|14|3|UP|BNG
austin txtraffic law attorneys|[https://www.austinareatraffictickets.com/]|25|0|1|NEW|BNG
autin tx attorney traffic ticket|[https://www.austinareatraffictickets.com/]|2|3|1|UP|BNG
autin tx lawyerticket dismissal|[https://www.austinareatraffictickets.com/services/traffic-tickets/]|17|6|-11|DOWN|BNG
autin tx traffic tickets attorneys|[https://www.austinareatraffictickets.com/]|6|6|0|EQ|BNG
best speeding ticket attorney austin|[https://www.austinareatraffictickets.com/]|4|4|0|EQ|BNG
best traffic attorney austin|[https://www.austinareatraffictickets.com/about/best-traffic-attorney-austin-tx/]|2|4|2|UP|BNG
best traffic attorney austin tx|[https://www.austinareatraffictickets.com/about/best-traffic-attorney-austin-tx/]|3|4|1|UP|BNG
best traffic ticket lawyer austin|[https://www.austinareatraffictickets.com/]|5|11|6|UP|BNG
best traffic ticket lawyer austin tx|[https://www.austinareatraffictickets.com/]|6|6|0|EQ|BNG
cdl attorney austin tx|[https://www.austinareatraffictickets.com/services/austin-cdl-best-lawyer/]|1|1|0|EQ|BNG
cdl lawyer austin tx|[https://www.austinareatraffictickets.com/services/austin-cdl-best-lawyer/]|1|1|0|EQ|BNG
cdl lawyers austin tx|[https://www.austinareatraffictickets.com/about/cdl-ticket-attorney-austin/]|7|2|-5|DOWN|BNG
cdl ticket attorney austin|[https://www.austinareatraffictickets.com/about/cdl-ticket-attorney-austin/]|1|1|0|EQ|BNG
cdl ticket attorney austin tx|[https://www.austinareatraffictickets.com/about/cdl-ticket-attorney-austin/]|1|1|0|EQ|BNG
cdl ticket lawyer austin|[https://www.austinareatraffictickets.com/about/cdl-ticket-lawyer-austin/]|1|1|0|EQ|BNG
cdl ticket lawyer austin tx|[https://www.austinareatraffictickets.com/about/cdl-ticket-lawyer-austin/]|1|1|0|EQ|BNG
cdl traffic attorney austin|[https://www.austinareatraffictickets.com/services/austin-cdl-best-lawyer/]|1|1|0|EQ|BNG
cdl traffic attorney austin tx|[https://www.austinareatraffictickets.com/about/cdl-ticket-attorney-austin/]|1|1|0|EQ|BNG
cdl traffic lawyer austin tx|[https://www.austinareatraffictickets.com/about/cdl-ticket-attorney-austin/]|1|2|1|UP|BNG
cdl traffic ticket lawyer austin|[https://www.austinareatraffictickets.com/about/cdl-ticket-lawyer-austin/]|1|1|0|EQ|BNG
cdl traffic ticket lawyer austin tx|[https://www.austinareatraffictickets.com/about/cdl-ticket-attorney-austin/]|1|1|0|EQ|BNG
cheap traffic attorney austin tx|[https://www.austinareatraffictickets.com/]|12|6|-6|DOWN|BNG
cheap traffic lawyers austin tx|[https://www.austinareatraffictickets.com/]|5|5|0|EQ|BNG
cheap traffic ticket attorney in austin|[https://www.austinareatraffictickets.com/]|4|5|1|UP|BNG
cheap traffic ticket attorney in austin tx|[https://www.austinareatraffictickets.com/]|7|8|1|UP|BNG
cheap traffic ticket lawyers austin tx|[https://www.austinareatraffictickets.com/]|9|0|17|NEW|BNG
cheap traffic tickets lawyers austin tx|[https://www.austinareatraffictickets.com/]|10|10|0|EQ|BNG
citation lawyer austin tx|[https://www.austinareatraffictickets.com/]|8|2|-6|DOWN|BNG
class c violation attorney austin|[https://www.austinareatraffictickets.com/services/class-c-violations/]|1|1|0|EQ|BNG
class c violation attorney austin tx|[https://www.austinareatraffictickets.com/services/class-c-violations/class-c-violations-license-texas/]|2|2|0|EQ|BNG
class c violation attorneys austin tx|[https://www.austinareatraffictickets.com/services/class-c-violations/class-c-violations-license-texas/]|1|2|1|UP|BNG
class c violation lawyer austin|[https://www.austinareatraffictickets.com/services/class-c-violations/]|1|1|0|EQ|BNG
class c violation lawyer austin tx|[https://www.austinareatraffictickets.com/]|2|2|0|EQ|BNG
class c violations attorney austin|[https://www.austinareatraffictickets.com/services/class-c-violations/]|1|1|0|EQ|BNG
class c violations lawyer austin tx|[https://www.austinareatraffictickets.com/]|1|1|0|EQ|BNG
contest a speeding ticket lawyer austin tx|[https://www.austinareatraffictickets.com/]|1|1|0|EQ|BNG
contest speeding ticket austin tx|[https://www.austinareatraffictickets.com/]|19|0|7|NEW|BNG
driver license attorney austin|[https://www.austinareatraffictickets.com/services/austin-tx-drivers-license-attorney/]|3|2|-1|DOWN|BNG
driver license lawyers in austin tx|[https://www.austinareatraffictickets.com/]|13|17|4|UP|BNG
drivers license attorney austin tx|[https://www.austinareatraffictickets.com/]|11|3|-8|DOWN|BNG
drivers license attorneys near austin|[https://www.austinareatraffictickets.com/]|7|7|0|EQ|BNG
drivers license lawyers austin tx|[https://www.austinareatraffictickets.com/services/austin-tx-drivers-license-attorney/]|13|6|-7|DOWN|BNG
drivers license suspension attorney austin|[https://www.austinareatraffictickets.com/about/driver-license-attorney/]|17|4|-13|DOWN|BNG
drivers license suspension lawyer austin|[https://www.austinareatraffictickets.com/services/driver-license-suspension-hearing-attorney/]|8|4|-4|DOWN|BNG
driving license invalid bastrop county tx|[https://www.austinareatraffictickets.com/services/traffic-warrants/driving-license-invalid-bastrop-county-tx/]|1|1|0|EQ|BNG
driving ticket attorney austin tx|[https://www.austinareatraffictickets.com/]|3|3|0|EQ|BNG
driving ticket attorney in austin|[https://www.austinareatraffictickets.com/]|3|4|1|UP|BNG
driving ticket attorney in austin tx|[https://www.austinareatraffictickets.com/]|3|6|3|UP|BNG
driving ticket lawyers in austin|[https://www.austinareatraffictickets.com/]|4|5|1|UP|BNG
driving ticket lawyers in austin tx|[https://www.austinareatraffictickets.com/]|2|3|1|UP|BNG
driving violation lawyer austin|[https://www.austinareatraffictickets.com/services/traffic-tickets/]|13|5|-8|DOWN|BNG
driving violation lawyer austin tx|[https://www.austinareatraffictickets.com/]|7|8|1|UP|BNG
driving violations lawyer austin tx|[https://www.austinareatraffictickets.com/]|6|0|20|NEW|BNG
driving while license invalid hays county|[https://www.austinareatraffictickets.com/services/traffic-warrants/driving-while-license-invalid-hays-county-tx/]|1|1|0|EQ|BNG
driving while license invalid kyle tx|[https://www.austinareatraffictickets.com/services/traffic-warrants/driving-while-license-invalid-kyle-tx/]|1|1|0|EQ|BNG
driving with invalid license hays county|[https://www.austinareatraffictickets.com/services/traffic-warrants/driving-while-license-invalid-hays-county-tx/]|1|1|0|EQ|BNG
dwli attorney austin|[https://www.austinareatraffictickets.com/dwli-attorney-austin/]|11|0|15|NEW|BNG
dwli lawyer austin|[https://www.austinareatraffictickets.com/dwli-attorney-austin/]|11|0|15|NEW|BNG
fight traffic ticket austin|[https://www.austinareatraffictickets.com/]|4|2|-2|DOWN|BNG
fight traffic ticket austin tx|[https://www.austinareatraffictickets.com/]|6|5|-1|DOWN|BNG
fight traffic tickets austin|[https://www.austinareatraffictickets.com/services/traffic-tickets/]|3|2|-1|DOWN|BNG
fight traffic tickets austin tx|[https://www.austinareatraffictickets.com/services/traffic-tickets/]|2|4|2|UP|BNG
habitual traffic violators travis county|[https://www.austinareatraffictickets.com/services/class-c-violations/habitual-violator-drivers-license-texas-travis-county/]|1|1|0|EQ|BNG
habitual violator driver lawyer austin|[https://www.austinareatraffictickets.com/services/class-c-violations/habitual-violator-drivers-license-austin-tx/]|2|1|-1|DOWN|BNG
habitual violator drivers license austin|[https://www.austinareatraffictickets.com/services/class-c-violations/habitual-violator-drivers-license-austin-tx/]|1|11|10|UP|BNG
habitual violator driver's license austin|[https://www.austinareatraffictickets.com/services/class-c-violations/habitual-violator-drivers-license-austin-tx/]|1|1|0|EQ|BNG
habitual violator drivers license kyle tx|[https://www.austinareatraffictickets.com/services/class-c-violations/habitual-violator-drivers-license-kyle-tx/]|1|1|0|EQ|BNG
lawyer for parking tickets austin|[https://www.austinareatraffictickets.com/]|9|5|-4|DOWN|BNG
lawyer for speeding ticket austin tx0]|[https://www.austinareatraffictickets.com/]|3|6|3|UP|BNG
lawyer for tickets near austin tx|[https://www.austinareatraffictickets.com/]|2|2|0|EQ|BNG
lawyer for traffic ticket austin|[https://www.austinareatraffictickets.com/]|2|6|4|UP|BNG
lawyer for traffic ticket austin tx|[https://www.austinareatraffictickets.com/]|6|12|6|UP|BNG
lawyer for traffic tickets austin|[https://www.austinareatraffictickets.com/]|4|4|0|EQ|BNG
lawyer for traffic tickets austin tx|[https://www.austinareatraffictickets.com/]|2|3|1|UP|BNG
lawyer for traffic violation austin tx|[https://www.austinareatraffictickets.com/]|10|12|2|UP|BNG
lawyer traffic ticket austin|[https://www.austinareatraffictickets.com/]|2|3|1|UP|BNG
lawyer traffic ticket austin tx|[https://www.austinareatraffictickets.com/]|2|0|24|NEW|BNG
lawyer traffic violation austin|[https://www.austinareatraffictickets.com/]|6|6|0|EQ|BNG
lawyer traffic violation austin tx|[https://www.austinareatraffictickets.com/]|5|14|9|UP|BNG
lawyers for speeding tickets austin|[https://www.austinareatraffictickets.com/]|3|4|1|UP|BNG
lawyers for speeding tickets austin tx|[https://www.austinareatraffictickets.com/]|6|5|-1|DOWN|BNG
lawyers for suspended license austin|[https://www.austinareatraffictickets.com/about/lawyers-for-suspended-license-austin/]|4|3|-1|DOWN|BNG
lawyers for traffic tickets austin|[https://www.austinareatraffictickets.com/]|4|0|22|NEW|BNG
lawyers that handle traffic tickets austin|[https://www.austinareatraffictickets.com/services/traffic-tickets/]|3|3|0|EQ|BNG
lawyers traffic tickets in austin|[https://www.austinareatraffictickets.com/]|6|6|0|EQ|BNG
lawyers traffic tickets in austin tx|[https://www.austinareatraffictickets.com/]|4|9|5|UP|BNG
