license lawyer in austin|[https://www.austinareatraffictickets.com/about/driver-license-attorney/]|8|4|-4|DOWN|BNG
license reinstatement lawyer austin|[https://www.austinareatraffictickets.com/services/austin-drivers-license-reinstatement-attorney/]|1|1|0|EQ|BNG
license suspended need lawyer austin|[https://www.austinareatraffictickets.com/about/license-suspended-need-lawyer-austin/]|2|2|0|EQ|BNG
licensed suspended need attorney austin|[https://www.austinareatraffictickets.com/about/license-suspended-need-lawyer-austin/]|1|1|0|EQ|BNG
moving violation lawyer austin tx|[https://www.austinareatraffictickets.com/about/traffic-lawyer-austin-tx/]|3|2|-1|DOWN|BNG
occupational drivers license austin|[https://www.austinareatraffictickets.com/services/occupational-drivers-license/occupational-drivers-license-austin/]|3|5|2|UP|BNG
occupational licenses attorney austin|[https://www.austinareatraffictickets.com/services/occupational-drivers-license/]|11|19|8|UP|BNG
parking ticket attorney austin|[https://www.austinareatraffictickets.com/]|8|15|7|UP|BNG
reckless driving attorney austin|[https://www.austinareatraffictickets.com/services/]|6|6|0|EQ|BNG
reckless driving lawyer austin|[https://www.austinareatraffictickets.com/services/]|5|5|0|EQ|BNG
reckless driving lawyer austin tx|[https://www.austinareatraffictickets.com/services/traffic-tickets/]|2|3|1|UP|BNG
reckless driving ticket lawyer austin|[https://www.austinareatraffictickets.com/services/traffic-tickets/]|1|1|0|EQ|BNG
reckless driving warrant attorney austin|[https://www.austinareatraffictickets.com/services/traffic-tickets/]|1|1|0|EQ|BNG
revoked drivers license attorney austin|[https://www.austinareatraffictickets.com/services/driver-license-suspension-hearing-attorney/]|2|2|0|EQ|BNG
revoked drivers license lawyer austin|[https://www.austinareatraffictickets.com/services/austin-drivers-license-reinstatement-attorney/]|2|1|-1|DOWN|BNG
revoked license lawyer austin tx|[https://www.austinareatraffictickets.com/services/traffic-warrants/suspended-license-lawyer-austin-tx/]|1|1|0|EQ|BNG
speed ticket lawyer austin tx|[https://www.austinareatraffictickets.com/]|2|3|1|UP|BNG
speeding ticket attorney austin|[https://www.austinareatraffictickets.com/]|3|4|1|UP|BNG
speeding ticket attorney austin tx|[https://www.austinareatraffictickets.com/]|3|4|1|UP|BNG
speeding ticket attorney austin, tx|[https://www.austinareatraffictickets.com/]|2|4|2|UP|BNG
speeding ticket attorneys austin|[https://www.austinareatraffictickets.com/]|4|5|1|UP|BNG
speeding ticket attorneys austin tx|[https://www.austinareatraffictickets.com/]|4|9|5|UP|BNG
speeding ticket austin lawyers|[https://www.austinareatraffictickets.com/]|3|4|1|UP|BNG
speeding ticket lawyer austin|[https://www.austinareatraffictickets.com/]|4|4|0|EQ|BNG
speeding ticket lawyer austin tx|[https://www.austinareatraffictickets.com/]|1|4|3|UP|BNG
speeding ticket lawyer austin, tx|[https://www.austinareatraffictickets.com/]|1|4|3|UP|BNG
speeding ticket lawyer near austin tx|[https://www.austinareatraffictickets.com/]|3|4|1|UP|BNG
speeding ticket lawyers austin tx|[https://www.austinareatraffictickets.com/]|3|4|1|UP|BNG
speeding tickets lawyers austin|[https://www.austinareatraffictickets.com/]|3|4|1|UP|BNG
suspended license attorney austin|[https://www.austinareatraffictickets.com/services/traffic-warrants/suspended-license-attorney-austin/]|3|2|-1|DOWN|BNG
suspended license austin tx attorney|[https://www.austinareatraffictickets.com/services/traffic-warrants/suspended-license-attorney-austin/]|7|2|-5|DOWN|BNG
suspended license burnet county|[https://www.austinareatraffictickets.com/services/traffic-warrants/suspended-license-burnet-county-tx/]|1|1|0|EQ|BNG
suspended license georgetown tx|[https://www.austinareatraffictickets.com/services/traffic-warrants/suspended-license-georgetown-tx/]|1|1|0|EQ|BNG
suspended license hays county|[https://www.austinareatraffictickets.com/services/traffic-warrants/suspended-license-hays-county-tx/]|1|1|0|EQ|BNG
suspended license kyle tx|[https://www.austinareatraffictickets.com/services/traffic-warrants/reinstating-a-suspended-license-in-kyle-tx/]|1|1|0|EQ|BNG
suspended license lawyer austin|[https://www.austinareatraffictickets.com/services/traffic-warrants/suspended-license-lawyer-austin-tx/]|3|2|-1|DOWN|BNG
suspended license lawyer austin tx|[https://www.austinareatraffictickets.com/services/traffic-warrants/suspended-license-lawyer-austin-tx/]|3|2|-1|DOWN|BNG
suspended license lawyer austin, tx|[https://www.austinareatraffictickets.com/services/traffic-warrants/suspended-license-lawyer-austin-tx/]|3|2|-1|DOWN|BNG
suspended license lawyer in austin tx|[https://www.austinareatraffictickets.com/services/traffic-warrants/suspended-license-lawyer-austin-tx/]|3|2|-1|DOWN|BNG
texas traffic ticket lawyers in austin|[https://www.austinareatraffictickets.com/]|8|0|18|NEW|BNG
ticket attorney in austin|[https://www.austinareatraffictickets.com/]|4|4|0|EQ|BNG
ticket attorney near austin tx|[https://www.austinareatraffictickets.com/]|5|6|1|UP|BNG
ticket attorneys austin tx|[https://www.austinareatraffictickets.com/]|7|0|19|NEW|BNG
ticket clinic austin tx|[https://www.austinareatraffictickets.com/]|4|6|2|UP|BNG
ticket dismissal attorney austin tx|[https://www.austinareatraffictickets.com/]|3|4|1|UP|BNG
ticket dismissal lawyer austin|[https://www.austinareatraffictickets.com/]|5|10|5|UP|BNG
ticket traffic austin|[https://www.austinareatraffictickets.com/]|10|10|0|EQ|BNG
ticket violations austin lawyer|[https://www.austinareatraffictickets.com/]|4|4|0|EQ|BNG
traffic attorney austin|[https://www.austinareatraffictickets.com/]|10|0|16|NEW|BNG
traffic attorney austin tx|[https://www.austinareatraffictickets.com/about/]|25|0|1|NEW|BNG
traffic citation attorney austin tx|[https://www.austinareatraffictickets.com/]|8|10|2|UP|BNG
traffic citation lawyer austin|[https://www.austinareatraffictickets.com/]|7|3|-4|DOWN|BNG
traffic citation lawyer near austin, tx|[https://www.austinareatraffictickets.com/]|13|8|-5|DOWN|BNG
traffic court attorneys austin|[https://www.austinareatraffictickets.com/]|4|9|5|UP|BNG
traffic court lawyer austin|[https://www.austinareatraffictickets.com/]|2|2|0|EQ|BNG
traffic law attorneys austin|[https://www.austinareatraffictickets.com/services/traffic-tickets/]|13|21|8|UP|BNG
traffic lawyer austin|[https://www.austinareatraffictickets.com/]|7|4|-3|DOWN|BNG
traffic lawyer austin tx|[https://www.austinareatraffictickets.com/]|2|4|2|UP|BNG
traffic lawyers austin|[https://www.austinareatraffictickets.com/services/traffic-warrants/]|18|0|8|NEW|BNG
traffic legal services austin|[https://www.austinareatraffictickets.com/contact/]|1|0|25|NEW|BNG
traffic misdemeanor attorney austin texas|[https://www.austinareatraffictickets.com/]|1|1|0|EQ|BNG
traffic reinstatement lawyer austin|[https://www.austinareatraffictickets.com/services/austin-drivers-license-reinstatement-attorney/]|1|1|0|EQ|BNG
traffic ticket attorney austin|[https://www.austinareatraffictickets.com/]|3|3|0|EQ|BNG
traffic ticket attorney austin tx|[https://www.austinareatraffictickets.com/]|2|3|1|UP|BNG
traffic ticket attorney near austin|[https://www.austinareatraffictickets.com/]|4|6|2|UP|BNG
traffic ticket attorneys austin|[https://www.austinareatraffictickets.com/]|4|6|2|UP|BNG
traffic ticket attorneys austin tx|[https://www.austinareatraffictickets.com/]|12|5|-7|DOWN|BNG
traffic ticket attorneys travis county tx|[https://www.austinareatraffictickets.com/]|18|0|8|NEW|BNG
traffic ticket austin|[https://www.austinareatraffictickets.com/]|6|6|0|EQ|BNG
traffic ticket dismissal lawyer austin|[https://www.austinareatraffictickets.com/]|2|13|11|UP|BNG
traffic ticket lawyer austin|[https://www.austinareatraffictickets.com/]|1|8|7|UP|BNG
traffic ticket lawyer austin tx|[https://www.austinareatraffictickets.com/]|1|4|3|UP|BNG
traffic ticket lawyer cost in austin tx|[https://www.austinareatraffictickets.com/]|3|2|-1|DOWN|BNG
traffic ticket lawyer near austin|[https://www.austinareatraffictickets.com/]|4|0|22|NEW|BNG
traffic ticket lawyer near austin tx|[https://www.austinareatraffictickets.com/]|5|10|5|UP|BNG
traffic ticket lawyers austin|[https://www.austinareatraffictickets.com/]|2|4|2|UP|BNG
traffic ticket lawyers near asutin|[https://www.austinareatraffictickets.com/]|7|5|-2|DOWN|BNG
traffic ticket lawyers near austin|[https://www.austinareatraffictickets.com/]|6|6|0|EQ|BNG
traffic ticket lawyers near austin tx|[https://www.austinareatraffictickets.com/]|7|9|2|UP|BNG
traffic ticket warrant lawyer austin|[https://www.austinareatraffictickets.com/services/traffic-warrants/]|1|1|0|EQ|BNG
traffic tickets attorney austin tx|[https://www.austinareatraffictickets.com/]|3|3|0|EQ|BNG
traffic tickets attorneys austin|[https://www.austinareatraffictickets.com/]|2|4|2|UP|BNG
traffic tickets attorneys austin tx|[https://www.austinareatraffictickets.com/]|3|4|1|UP|BNG
traffic tickets attorneys in austin tx|[https://www.austinareatraffictickets.com/]|10|0|16|NEW|BNG
traffic tickets austin law firm|[https://www.austinareatraffictickets.com/contact/]|6|9|3|UP|BNG
traffic tickets austin tx|[https://www.austinareatraffictickets.com/services/traffic-tickets/]|3|4|1|UP|BNG
traffic tickets austin tx lawyer|[https://www.austinareatraffictickets.com/]|1|3|2|UP|BNG
traffic tickets lawyer in austin|[https://www.austinareatraffictickets.com/]|3|3|0|EQ|BNG
traffic tickets lawyer in austin tx|[https://www.austinareatraffictickets.com/]|2|4|2|UP|BNG
traffic tickets lawyers austin|[https://www.austinareatraffictickets.com/]|2|4|2|UP|BNG
traffic violation attorney austin|[https://www.austinareatraffictickets.com/]|5|5|0|EQ|BNG
traffic violation attorney austin tx|[https://www.austinareatraffictickets.com/]|12|0|14|NEW|BNG
traffic violation attorney near austin|[https://www.austinareatraffictickets.com/about/traffic-violation-attorneys/]|4|2|-2|DOWN|BNG
traffic violation attorneys austin tx|[https://www.austinareatraffictickets.com/]|12|0|14|NEW|BNG
traffic violation lawyer austin tx|[https://www.austinareatraffictickets.com/]|8|8|0|EQ|BNG
traffic violation lawyer near austin|[https://www.austinareatraffictickets.com/]|12|0|14|NEW|BNG
traffic violation lawyers asutin tx|[https://www.austinareatraffictickets.com/about/]|24|5|-19|DOWN|BNG
traffic violation lawyers austin|[https://www.austinareatraffictickets.com/about/traffic-violation-lawyers-austin/]|4|6|2|UP|BNG
traffic violation lawyers austin tx|[https://www.austinareatraffictickets.com/about/traffic-violation-attorneys/header-1-jgp/]|24|0|2|NEW|BNG
traffic violation legal services austin|[https://www.austinareatraffictickets.com/legal-services-for-traffic-warrants/]|1|1|0|EQ|BNG
traffic violation ticket lawyer austin|[https://www.austinareatraffictickets.com/about/austin-traffic-ticket-attorney/]|11|14|3|UP|BNG
traffic violations attorneys austin|[https://www.austinareatraffictickets.com/]|9|8|-1|DOWN|BNG
traffic warrant attorney austin tx|[https://www.austinareatraffictickets.com/services/traffic-warrants/traffic-warrants-attorney-austin/]|1|1|0|EQ|BNG
traffic warrant attorneys austin|[https://www.austinareatraffictickets.com/services/traffic-warrants/]|1|1|0|EQ|BNG
traffic warrant attorneys austin tx|[https://www.austinareatraffictickets.com/services/traffic-warrants/]|1|1|0|EQ|BNG
traffic warrants attorney austin|[https://www.austinareatraffictickets.com/services/traffic-warrants/]|1|1|0|EQ|BNG
traffic warrants attorney austin tx|[https://www.austinareatraffictickets.com/services/traffic-warrants/traffic-warrants-attorney-austin/]|1|1|0|EQ|BNG
traffic warrants lawyer austin|[https://www.austinareatraffictickets.com/services/traffic-warrants/]|1|1|0|EQ|BNG
traffic warrants lawyer austin tx|[https://www.austinareatraffictickets.com/services/traffic-warrants/]|1|1|0|EQ|BNG
travis county speeding ticket lawyer|[https://www.austinareatraffictickets.com/]|17|17|0|EQ|BNG
travis county ticket violation lawyer|[https://www.austinareatraffictickets.com/services/class-c-violations/]|24|27|3|UP|BNG
travis county traffic ticket attorney|[https://www.austinareatraffictickets.com/]|24|26|2|UP|BNG
violation class c austin tx|[https://www.austinareatraffictickets.com/services/class-c-violations/class-c-violations-license-texas/]|1|1|0|EQ|BNG
warrant lawyers austin tx|[https://www.austinareatraffictickets.com/]|18|10|-8|DOWN|BNG
warrants attorney austin|[https://www.austinareatraffictickets.com/services/traffic-warrants/traffic-warrants-attorney-austin/]|4|1|-3|DOWN|BNG
warrants attorney austin tx|[https://www.austinareatraffictickets.com/services/traffic-warrants/traffic-warrants-attorney-austin/]|7|1|-6|DOWN|BNG
warrants lawyer austin|[https://www.austinareatraffictickets.com/about/traffic-warrants-lawyer-austin/]|4|2|-2|DOWN|BNG
warrants lawyer austin tx|[https://www.austinareatraffictickets.com/about/traffic-warrants-lawyer-austin/]|3|2|-1|DOWN|BNG
