24 hour furnace repairs in spring, tx|[https://goadmiral.com/commercial-hvac-services/]|6|0|20|NEW|YAH
24 hr furnace repair in spring, tx|[https://goadmiral.com/]|8|0|18|NEW|YAH
24 hr furnace repair near me spring texas|[https://goadmiral.com/]|4|4|0|EQ|YAH
24 hr furnace repair near me spring, texas|[https://goadmiral.com/]|5|5|0|EQ|YAH
24 hr furnace repair spring texas|[https://goadmiral.com/commercial-hvac-services/]|5|5|0|EQ|YAH
24 hr furnace repair spring tx|[http://goadmiral.com/[*YaB*]]|5|5|0|EQ|YAH
24 hr furnace repair spring, texas|[https://goadmiral.com/commercial-hvac-services/]|5|3|-2|DOWN|YAH
24 hr furnace repairs spring|[https://goadmiral.com/]|3|0|23|NEW|YAH
a c repairs spring texas|[https://goadmiral.com/]|9|0|17|NEW|YAH
ac and heating katy tx|[https://goadmiral.com/[*YaB*]]|2|0|24|NEW|YAH
ac check up in katy, tx|[https://goadmiral.com/[*YaB*]]|4|4|0|EQ|YAH
ac check up katy|[https://goadmiral.com/[*YaB*]]|2|2|0|EQ|YAH
ac check up katy texas|[https://goadmiral.com/[*YaB*]]|4|2|-2|DOWN|YAH
ac check up katy tx|[https://goadmiral.com/[*YaB*]]|5|4|-1|DOWN|YAH
ac check up katy, texas|[https://goadmiral.com/[*YaB*]]|5|2|-3|DOWN|YAH
ac check up katy, tx|[https://goadmiral.com/[*YaB*]]|5|5|0|EQ|YAH
ac check up spring texas|[https://goadmiral.com/]|4|9|5|UP|YAH
ac check up spring tx|[https://goadmiral.com/]|4|0|22|NEW|YAH
ac check up spring, texas|[https://goadmiral.com/]|4|3|-1|DOWN|YAH
ac check up spring, tx|[https://goadmiral.com/]|4|4|0|EQ|YAH
ac check-up katy|[https://goadmiral.com/[*YaB*]]|3|3|0|EQ|YAH
ac check-up katy texas|[https://goadmiral.com/[*YaB*]]|4|3|-1|DOWN|YAH
ac check-up katy tx|[https://goadmiral.com/location-katy-tx/ac-check-up-katy-tx/]|2|4|2|UP|YAH
ac check-up katy, texas|[https://goadmiral.com/[*YaB*]]|5|3|-2|DOWN|YAH
ac check-up katy, tx|[https://goadmiral.com/[*YaB*]]|5|4|-1|DOWN|YAH
ac cleaning service katy tx|[https://goadmiral.com/location-katy-tx/ac-cleaning-services-katy-tx/]|3|0|23|NEW|YAH
ac cleaning service katy, tx|[https://goadmiral.com/location-katy-tx/ac-cleaning-services-katy-tx/]|2|0|24|NEW|YAH
ac cleaning services in katy texas|[https://goadmiral.com/location-katy-tx/ac-cleaning-services-katy-tx/]|2|0|24|NEW|YAH
ac cleaning services in katy tx|[https://goadmiral.com/location-katy-tx/ac-cleaning-services-katy-tx/]|2|0|24|NEW|YAH
ac cleaning services in katy, texas|[https://goadmiral.com/location-katy-tx/ac-cleaning-services-katy-tx/]|2|0|24|NEW|YAH
ac cleaning services katy texas|[https://goadmiral.com/location-katy-tx/ac-cleaning-services-katy-tx/]|2|0|24|NEW|YAH
ac cleaning services katy tx|[https://goadmiral.com/location-katy-tx/ac-cleaning-services-katy-tx/]|2|0|24|NEW|YAH
ac cleaning services katy, texas|[https://goadmiral.com/location-katy-tx/ac-cleaning-services-katy-tx/]|2|0|24|NEW|YAH
ac companies near tomball that finance|[https://goadmiral.com/heating-and-cooling-financing/]|25|0|1|NEW|YAH
ac contactor hockley texas|[https://goadmiral.com/location-hockley-tx/hockley-ac-contactor/]|1|0|25|NEW|YAH
ac maintenance tomball tx|[https://goadmiral.com/location-tomball-tx/ac-maintenance-tomball-tx/]|22|21|-1|DOWN|YAH
ac tune up spring tx|[https://goadmiral.com/ac-tune-up-spring-tx/]|2|5|3|UP|YAH
ac tune-up katy texas|[https://goadmiral.com/location-katy-tx/ac-tune-up-katy-tx/]|6|0|20|NEW|YAH
ac tune-up spring texas|[https://goadmiral.com/ac-tune-up-spring-tx/]|2|4|2|UP|YAH
ac tune-up spring tx|[https://goadmiral.com/ac-tune-up-spring-tx/]|3|5|2|UP|YAH
admiral air conditioning conroe|[https://goadmiral.com/location-conroe-tx/conroe-air-conditioning-service/]|1|1|0|EQ|YAH
admiral air conditioning woodlands|[https://goadmiral.com/location-the-woodlands-tx/]|1|1|0|EQ|YAH
admiral air cooling and heating|[https://goadmiral.com/[*YaB*]]|1|6|5|UP|YAH
admiral commercial|[https://goadmiral.com/location-houston-tx/houston-tx-commercial-hvac-companies/]|4|0|22|NEW|YAH
admiral emergency number|[https://goadmiral.com/emergency-services/]|4|0|22|NEW|YAH
admiral heating & cooling|[https://goadmiral.com/]|2|0|24|NEW|YAH
admiral heating and cooling company|[https://goadmiral.com/]|2|0|24|NEW|YAH
admiral heating and cooling reviews|[https://goadmiral.com/reviews/]|4|0|22|NEW|YAH
air conditioner finance tomball tx|[https://goadmiral.com/location-tomball-tx/air-conditioner-financing-tomball-tx/]|2|0|24|NEW|YAH
air conditioner financing katy tx|[https://goadmiral.com/location-katy-tx/air-conditioner-financing-katy-tx/]|5|0|21|NEW|YAH
air conditioner financing tomball texas|[https://goadmiral.com/location-tomball-tx/air-conditioner-financing-tomball-tx/]|3|5|2|UP|YAH
air conditioner financing tomball tx|[http://goadmiral.com/[*YaB*]]|5|5|0|EQ|YAH
air conditioner unit repairs spring tx|[https://goadmiral.com/]|5|0|21|NEW|YAH
air conditioning admiral conroe|[https://goadmiral.com/location-conroe-tx/conroe-air-conditioning-service/]|1|1|0|EQ|YAH
air conditioning admiral conroe tx|[https://goadmiral.com/location-conroe-tx/conroe-air-conditioning-service/]|2|2|0|EQ|YAH
air conditioning admiral houston|[https://goadmiral.com/]|1|1|0|EQ|YAH
air conditioning admiral spring tx|[http://goadmiral.com/[*YaB*]]|1|1|0|EQ|YAH
air conditioning admiral woodlands|[http://goadmiral.com/[*YaB*]]|1|2|1|UP|YAH
air conditioning admiral woodlands tx|[http://goadmiral.com/[*YaB*]]|1|1|0|EQ|YAH
air conditioning repair katy texas|[https://goadmiral.com/[*YaB*]]|2|0|24|NEW|YAH
air conditioning repair katy tx|[https://goadmiral.com/[*YaB*]]|3|0|23|NEW|YAH
air conditioning repairs katy|[https://goadmiral.com/[*YaB*]]|3|0|23|NEW|YAH
air conditioning repairs katy tx|[https://goadmiral.com/[*YaB*]]|1|0|25|NEW|YAH
air cooling and heating admiral houston|[https://goadmiral.com/]|1|1|0|EQ|YAH
best furnace repairs company spring|[https://goadmiral.com/]|2|0|24|NEW|YAH
central air installation spring texas|[https://goadmiral.com/]|8|3|-5|DOWN|YAH
central air installation spring tx|[https://goadmiral.com/]|4|3|-1|DOWN|YAH
central heating and air spring tx|[https://goadmiral.com/]|7|0|19|NEW|YAH
central heating and cooling spring tx|[https://goadmiral.com/]|4|19|15|UP|YAH
commercial ac repair spring tx|[https://goadmiral.com/commercial-hvac-services/]|2|2|0|EQ|YAH
commercial hvac service spring tx|[https://goadmiral.com/commercial-hvac-services/]|2|2|0|EQ|YAH
commercial hvac spring tx|[https://goadmiral.com/commercial-hvac-services/]|2|2|0|EQ|YAH
conroe admiral air cooling and heating|[https://goadmiral.com/location-conroe-tx/conroe-heating-and-cooling-service/]|1|1|0|EQ|YAH
conroe air conditioner cleaning|[https://goadmiral.com/location-conroe-tx/conroe-air-conditioner-cleaning/]|2|0|24|NEW|YAH
conroe air conditioner tune up|[https://goadmiral.com/location-conroe-tx/conroe-air-conditioner-tune-up/]|2|0|24|NEW|YAH
conroe air cooling and heating admiral|[https://goadmiral.com/location-conroe-tx/conroe-heating-and-cooling-service/]|1|1|0|EQ|YAH
conroe duct fogging|[https://goadmiral.com/what-is-duct-fogging/]|6|3|-3|DOWN|YAH
conroe trane ac|[https://goadmiral.com/location-conroe-tx/conroe-trane-ac/]|4|4|0|EQ|YAH
conroe tx ac contactor|[https://goadmiral.com/location-conroe-tx/conroe-ac-contactor/]|2|0|24|NEW|YAH
conroe tx air cooling and heating admiral|[http://goadmiral.com/[*YaB*]]|4|3|-1|DOWN|YAH
cooling system installation spring tx|[https://goadmiral.com/residential-heating-and-cooling-services/]|5|0|21|NEW|YAH
cypress financing for air conditioning|[https://goadmiral.com/location-houston-tx/houston-tx-financing-for-air-conditioning/]|4|0|22|NEW|YAH
cypress heating repair near me|[https://goadmiral.com/]|21|0|5|NEW|YAH
cypress hvac maintenance contract|[https://goadmiral.com/service-contracts/]|2|0|24|NEW|YAH
cypress tx financing for air conditioning|[https://goadmiral.com/location-cypress-tx/cypress-financing-for-air-conditioning/]|3|3|0|EQ|YAH
cypress tx hvac contractor|[https://goadmiral.com/location-cypress-tx/cypress-tx-hvac-contractors/]|13|0|13|NEW|YAH
duct fogging|[https://goadmiral.com/what-is-duct-fogging/]|2|0|24|NEW|YAH
emergency furnace repair spring texas|[https://goadmiral.com/]|3|0|23|NEW|YAH
emergency furnace repairs in spring, tx|[https://goadmiral.com/]|7|0|19|NEW|YAH
emergency furnace repairs spring texas|[https://goadmiral.com/]|6|0|20|NEW|YAH
fast furnace repair in spring, texas|[https://goadmiral.com/]|8|5|-3|DOWN|YAH
fast furnace repair in spring, tx|[https://goadmiral.com/]|8|0|18|NEW|YAH
fast furnace repair service spring|[https://goadmiral.com/]|3|0|23|NEW|YAH
fast furnace repair spring|[https://goadmiral.com/]|4|0|22|NEW|YAH
fast furnace repair spring texas|[https://goadmiral.com/]|4|0|22|NEW|YAH
fast furnace repair spring, texas|[https://goadmiral.com/]|4|0|22|NEW|YAH
fast furnace repair spring, tx|[https://goadmiral.com/]|6|0|20|NEW|YAH
fast furnace repairs near me spring texas|[https://goadmiral.com/]|5|0|21|NEW|YAH
fast furnace repairs spring|[https://goadmiral.com/]|3|0|23|NEW|YAH
fast furnace repairs spring texas|[https://goadmiral.com/]|6|0|20|NEW|YAH
fast furnace repairs spring tx|[https://goadmiral.com/]|7|5|-2|DOWN|YAH
fast furnace repairs spring, texas|[https://goadmiral.com/]|5|0|21|NEW|YAH
free ac check spring tx|[https://goadmiral.com/]|2|0|24|NEW|YAH
free furnace check spring|[https://goadmiral.com/]|4|0|22|NEW|YAH
free furnace check spring texas|[https://goadmiral.com/]|2|0|24|NEW|YAH
free furnace check spring tx|[https://goadmiral.com/]|2|2|0|EQ|YAH
free furnace check spring, texas|[https://goadmiral.com/]|2|3|1|UP|YAH
free furnace check spring, tx|[https://goadmiral.com/]|2|2|0|EQ|YAH
free furnace checks spring texas|[https://goadmiral.com/]|3|4|1|UP|YAH
free furnace checks spring tx|[https://goadmiral.com/]|3|2|-1|DOWN|YAH
free furnace checks spring, texas|[https://goadmiral.com/]|2|2|0|EQ|YAH
free furnace checks spring, tx|[https://goadmiral.com/]|2|2|0|EQ|YAH
free home ac check spring tx|[https://goadmiral.com/location-spring-tx/free-ac-check-spring-tx/]|2|0|24|NEW|YAH
furnace and heating spring tx|[http://goadmiral.com[*YaB*]]|4|4|0|EQ|YAH
furnace and heating spring, tx|[http://goadmiral.com[*YaB*]]|4|4|0|EQ|YAH
furnace companies spring, tx|[https://goadmiral.com/]|7|14|7|UP|YAH
furnace company near me spring tx|[https://goadmiral.com/]|14|0|12|NEW|YAH
furnace company spring, tx|[https://goadmiral.com/]|7|0|19|NEW|YAH
furnace contrfurnacetor spring, texas|[http://goadmiral.com[*YaB*]]|1|1|0|EQ|YAH
furnace installation tomball tx|[https://goadmiral.com/furnace-installation-tomball-tx/]|5|0|21|NEW|YAH
furnace repairs company spring|[http://goadmiral.com/[*YaB*]]|3|7|4|UP|YAH
furnace repairs katy|[https://goadmiral.com/[*YaB*]]|1|0|25|NEW|YAH
furnace service spring|[https://goadmiral.com/]|2|0|24|NEW|YAH
furnace spring texas|[http://goadmiral.com[*YaB*]]|3|3|0|EQ|YAH
furnace system repair spring tx|[https://goadmiral.com/]|21|0|5|NEW|YAH
furnace system repair spring, texas|[http://goadmiral.com[*YaB*]]|2|2|0|EQ|YAH
furnace systems repair spring tx|[https://goadmiral.com/]|13|0|13|NEW|YAH
furnace tune up houston texas|[http://goadmiral.com[*YaB*]]|2|0|24|NEW|YAH
furnace tune up katy texas|[http://goadmiral.com[*YaB*]]|2|1|-1|DOWN|YAH
furnace tune up near me spring texas|[https://goadmiral.com/]|3|0|23|NEW|YAH
furnace tune up spring|[http://goadmiral.com[*YaB*]]|1|1|0|EQ|YAH
furnace tune up spring texas|[https://goadmiral.com/]|4|5|1|UP|YAH
furnace tune up spring tx|[https://goadmiral.com/]|4|4|0|EQ|YAH
furnace tune up spring, texas|[https://goadmiral.com/]|4|0|22|NEW|YAH
furnace tune up spring, tx|[https://goadmiral.com/]|3|5|2|UP|YAH
furnace tune-up katy texas|[http://goadmiral.com[*YaB*]]|1|1|0|EQ|YAH
furnace tune-up spring texas|[http://goadmiral.com[*YaB*]]|1|4|3|UP|YAH
furnace tune-up spring tx|[https://goadmiral.com/]|4|6|2|UP|YAH
furnace tune-up spring, tx|[https://goadmiral.com/]|7|0|19|NEW|YAH
furnace window unit repair spring, texas|[https://goadmiral.com/]|5|0|21|NEW|YAH
furnaces spring, texas|[http://goadmiral.com[*YaB*]]|3|4|1|UP|YAH
gas furnace tune up houston|[http://goadmiral.com/[*YaB*]]|3|0|23|NEW|YAH
heating and air hockley|[https://goadmiral.com/]|20|0|6|NEW|YAH
heating and cooling repair spring tx|[https://goadmiral.com/]|6|0|20|NEW|YAH
heating and cooling repairs spring texas|[https://goadmiral.com/]|4|17|13|UP|YAH
heating and cooling services spring|[https://goadmiral.com/]|5|0|21|NEW|YAH
heating cooling service spring tx|[https://goadmiral.com/]|5|7|2|UP|YAH
heating cooling services spring tx|[https://goadmiral.com/]|16|0|10|NEW|YAH
heating repairman katy, tx|[https://goadmiral.com/location-katy-tx/katy-tx-heating-repairman/]|18|0|8|NEW|YAH
heating repairs katy tx|[https://goadmiral.com/[*YaB*]]|3|0|23|NEW|YAH
heating repairs spring tx|[https://goadmiral.com/]|12|0|14|NEW|YAH
heating service hunters creek texas|[https://goadmiral.com/superior-ac-service-installation-hunters-creek-village-tx/]|20|0|6|NEW|YAH
hockley ac company|[https://goadmiral.com/location-hockley-tx/hockley-ac-service/]|2|0|24|NEW|YAH
hockley heating and air|[https://goadmiral.com/location-hockley-tx/hockley-heating-and-air/]|1|0|25|NEW|YAH
hockley heating service|[https://goadmiral.com/location-hockley-tx/hockley-heating-and-cooling-service/]|2|4|2|UP|YAH
hockley hvac companies|[https://goadmiral.com/location-hockley-tx/hockley-hvac-companies/]|2|4|2|UP|YAH
hockley hvac services|[https://goadmiral.com/location-hockley-tx/hockley-air-conditioning-service/]|3|15|12|UP|YAH
hockley tx ac contactor|[https://goadmiral.com/location-hockley-tx/hockley-ac-contactor/]|1|0|25|NEW|YAH
home ac service katy|[https://goadmiral.com/location-katy-tx/home-ac-service-katy/]|5|0|21|NEW|YAH
home ac spring tx|[https://goadmiral.com/]|5|0|21|NEW|YAH
home heating repair company katy|[https://goadmiral.com/location-katy-tx/home-heating-repair-company-katy/]|3|0|23|NEW|YAH
home heating repairs company katy|[https://goadmiral.com/location-katy-tx/home-heating-repair-company-katy/]|4|0|22|NEW|YAH
hour furnace repair near me spring tx|[https://goadmiral.com/]|2|0|24|NEW|YAH
hour furnace repair near me spring, tx|[https://goadmiral.com/]|2|0|24|NEW|YAH
hour furnace repair spring, tx|[https://goadmiral.com/]|5|14|9|UP|YAH
houston admiral air|[https://goadmiral.com/]|1|1|0|EQ|YAH
houston duct fogging|[http://goadmiral.com/[*YaB*]]|2|3|1|UP|YAH
houston gas furnace tune up|[http://goadmiral.com/[*YaB*]]|3|0|23|NEW|YAH
houston heating services spring tx|[https://goadmiral.com/about/]|3|7|4|UP|YAH
houston heating services spring, tx|[https://goadmiral.com/about/]|3|2|-1|DOWN|YAH
houston hvac lifetime|[http://goadmiral.com/[*YaB*]]|2|3|1|UP|YAH
Houston TX AC Companies Near Me|[https://goadmiral.com/]|23|0|3|NEW|YAH
Houston TX AC Shop Near Me|[https://goadmiral.com/]|10|0|16|NEW|YAH
Houston TX Central Air Not Cooling|[http://goadmiral.com/[*YaB*]]|1|2|1|UP|YAH
Houston TX HVAC Companies Near Me|[https://goadmiral.com/]|20|0|6|NEW|YAH
hr furnace repair in spring|[https://goadmiral.com/]|6|0|20|NEW|YAH
hr furnace repair spring|[http://goadmiral.com/[*YaB*]]|3|0|23|NEW|YAH
hvac inspections spring tx|[https://goadmiral.com/]|10|0|16|NEW|YAH
hvac repair hunters creek village|[https://goadmiral.com/location-houston-tx/hunters-creek-village-tx-air-conditioning-repair/]|21|0|5|NEW|YAH
hvac spring spring, tx|[https://goadmiral.com/]|23|0|3|NEW|YAH
hvac system spring tx|[http://goadmiral.com[*YaB*]]|1|1|0|EQ|YAH
hvac system spring, tx|[http://goadmiral.com[*YaB*]]|1|0|25|NEW|YAH
hvac systems repairs spring texas|[https://goadmiral.com/location-spring-tx/hvac-repair-spring-tx/]|4|0|22|NEW|YAH
hvac technicians spring tx|[http://goadmiral.com[*YaB*]]|3|4|1|UP|YAH
katy furnace repair company|[https://goadmiral.com/location-katy-tx/katy-tx-furnace-repair-company/]|4|0|22|NEW|YAH
katy heating & air conditioning service|[https://goadmiral.com/[*YaB*]]|1|0|25|NEW|YAH
katy heating and furnace repair|[https://goadmiral.com/location-katy-tx/katy-heating-and-furnace-repair/]|5|0|21|NEW|YAH
katy heating furnace repair|[https://goadmiral.com/location-katy-tx/katy-heating-and-furnace-repair/]|5|0|21|NEW|YAH
katy heating repair|[https://goadmiral.com/[*YaB*]]|4|0|22|NEW|YAH
katy heating repair service|[https://goadmiral.com/[*YaB*]]|4|0|22|NEW|YAH
katy heating repairman|[https://goadmiral.com/[*YaB*]]|2|0|24|NEW|YAH
katy texas ac tune up|[https://goadmiral.com/[*YaB*]]|1|0|25|NEW|YAH
katy texas ac tune-up|[https://goadmiral.com/location-katy-tx/ac-tune-up-katy-tx/]|5|4|-1|DOWN|YAH
katy texas furnace repair company|[https://goadmiral.com/[*YaB*]]|4|0|22|NEW|YAH
katy texas furnace repairs company|[https://goadmiral.com/location-katy-tx/katy-tx-furnace-repair-company/]|2|0|24|NEW|YAH
katy texas heating repairman|[https://goadmiral.com/[*YaB*]]|3|0|23|NEW|YAH
katy tx furnace repair|[https://goadmiral.com/[*YaB*]]|4|0|22|NEW|YAH
katy tx furnace repair company|[https://goadmiral.com/[*YaB*]]|4|0|22|NEW|YAH
katy tx furnace repairs company|[https://goadmiral.com/location-katy-tx/katy-tx-furnace-repair-company/]|2|0|24|NEW|YAH
katy tx heating repairman|[https://goadmiral.com/[*YaB*]]|1|0|25|NEW|YAH
katy tx hvac contractor|[https://goadmiral.com/[*YaB*]]|4|0|22|NEW|YAH
nate certification classes near me|[https://goadmiral.com/about/nate-certification-training-provider-spring-tx/]|2|0|24|NEW|YAH
nate training|[https://goadmiral.com/about/nate-certification-training-provider-spring-tx/]|6|0|20|NEW|YAH
near me 24 hour furnace repairs in spring tx|[https://goadmiral.com/]|4|3|-1|DOWN|YAH
near me 24 hour furnace repairs spring texas|[http://goadmiral.com/[*YaB*]]|2|2|0|EQ|YAH
spring ac tune-up katy tx|[https://goadmiral.com/location-spring-tx/spring-ac-tune-up-katy-tx/]|1|2|1|UP|YAH
spring emergency furnace repair|[http://goadmiral.com/[*YaB*]]|2|0|24|NEW|YAH
spring texas commercial hvac repair|[https://goadmiral.com/commercial-hvac-services/]|3|2|-1|DOWN|YAH
spring texas fast furnace repair|[http://goadmiral.com/[*YaB*]]|3|0|23|NEW|YAH
spring texas fast furnace repairs near me|[https://goadmiral.com/]|4|0|22|NEW|YAH
spring texas furnace repairs companies|[https://goadmiral.com/]|5|0|21|NEW|YAH
spring texas furnace repairs company|[https://goadmiral.com/]|5|0|21|NEW|YAH
spring tx 24 7 air conditioning repair|[https://goadmiral.com/service-contracts/]|5|4|-1|DOWN|YAH
spring tx 24 hour furnace repair|[https://goadmiral.com/]|5|0|21|NEW|YAH
Spring TX AC Repair Near Me|[https://goadmiral.com/]|4|4|0|EQ|YAH
Spring TX AC Service Near Me|[https://goadmiral.com/]|2|0|24|NEW|YAH
Spring TX AC Shop Near Me|[https://goadmiral.com/]|4|0|22|NEW|YAH
spring tx admiral air|[https://goadmiral.com/]|1|1|0|EQ|YAH
spring tx air cooling and heating admiral|[https://goadmiral.com/]|1|1|0|EQ|YAH
Spring TX Central Air Not Cooling|[http://goadmiral.com/[*YaB*]]|5|0|21|NEW|YAH
Spring TX Central Air Repair|[https://goadmiral.com/]|5|0|21|NEW|YAH
spring tx commercial hvac repair|[https://goadmiral.com/commercial-hvac-services/]|2|2|0|EQ|YAH
spring tx fast furnace repairs near me|[https://goadmiral.com/]|3|5|2|UP|YAH
spring tx heating repairs|[https://goadmiral.com/heating-services/]|14|0|12|NEW|YAH
Spring TX Home Air Conditioning Company|[https://goadmiral.com/location-spring-tx/spring-tx-home-air-conditioning-company/]|3|5|2|UP|YAH
spring tx hvac|[https://goadmiral.com/commercial-hvac-services/]|21|0|5|NEW|YAH
spring tx hvac financing|[https://goadmiral.com/heating-and-cooling-financing/]|6|5|-1|DOWN|YAH
spring, texas 24 hour furnace repairs|[http://goadmiral.com/[*YaB*]]|4|3|-1|DOWN|YAH
spring, texas furnace repairs company|[https://goadmiral.com/]|7|0|19|NEW|YAH
spring, tx hvac financing|[https://goadmiral.com/heating-and-cooling-financing/]|5|5|0|EQ|YAH
The Woodlands TX AC Companies Near Me|[https://goadmiral.com/location-the-woodlands-tx/the-woodlands-tx-air-conditioning-companies-near-me/]|5|4|-1|DOWN|YAH
The Woodlands TX AC Shop Near Me|[https://goadmiral.com/location-the-woodlands-tx/the-woodlands-tx-ac-shop-near-me/]|3|0|23|NEW|YAH
The Woodlands TX AC Tune Up|[https://goadmiral.com/location-the-woodlands-tx/the-woodlands-tx-ac-repairs/the-woodlands-tx-ac-tune-up/]|4|0|22|NEW|YAH
The Woodlands TX Central Air Not Cooling|[https://goadmiral.com/]|5|3|-2|DOWN|YAH
The Woodlands TX Central Air Repair|[http://goadmiral.com/[*YaB*]]|4|0|22|NEW|YAH
The Woodlands TX Home AC Repair|[https://goadmiral.com/location-the-woodlands-tx/the-woodlands-tx-home-ac-repair/]|3|3|0|EQ|YAH
The Woodlands TX HVAC Near Me|[https://goadmiral.com/location-the-woodlands-tx/the-woodlands-tx-hvac-near-me/]|4|2|-2|DOWN|YAH
woodlands admiral air|[https://goadmiral.com/location-the-woodlands-tx/]|1|1|0|EQ|YAH
woodlands admiral air cooling and heating|[http://goadmiral.com/[*YaB*]]|2|1|-1|DOWN|YAH
woodlands air cooling and heating admiral|[https://goadmiral.com/location-the-woodlands-tx/the-woodlands-tx-heating-and-air-conditioning/]|1|1|0|EQ|YAH
woodlands duct fogging|[https://goadmiral.com/what-is-duct-fogging/]|2|2|0|EQ|YAH
woodlands tx admiral air|[https://goadmiral.com/location-the-woodlands-tx/]|1|1|0|EQ|YAH
woodlands tx air cooling and heating admiral|[http://goadmiral.com/[*YaB*]]|3|4|1|UP|YAH
