100 credit dental financing houston tx|[https://marquettedentistry.com/financing/dental-financing-100-in-houston-tx/]|2|2|0|EQ|YAH
77074 cosmetic dentistry|[https://marquettedentistry.com/services/improve-your-smile/77074-houston-cosmetic-dentistry/]|2|1|-1|DOWN|YAH
77074 dental clinic|[https://marquettedentistry.com/services/improve-your-smile/77074-dental-clinic/]|2|2|0|EQ|YAH
77074 houston cosmetic dentistry|[https://marquettedentistry.com/services/improve-your-smile/77074-houston-cosmetic-dentistry/]|2|1|-1|DOWN|YAH
accepting ppo dental houston|[https://marquettedentistry.com/[*YaB*]]|1|1|0|EQ|YAH
affordable cosmetic dentistry houston|[https://marquettedentistry.com/[*YaB*]]|5|5|0|EQ|YAH
affordable cosmetic dentistry houston tx|[https://marquettedentistry.com/services/cosmetic-dentistry/affordable-cosmetic-dentistry-houston-tx/]|3|2|-1|DOWN|YAH
affordable dental veneers houston|[https://marquettedentistry.com/services/improve-your-smile/affordable-veneers-in-houston/]|21|23|2|UP|YAH
affordable family dentistry houston tx|[https://marquettedentistry.com/[*YaB*]]|4|1|-3|DOWN|YAH
affordable porcelain veneers houston|[https://marquettedentistry.com/services/improve-your-smile/affordable-porcelain-veneers-in-houston-2/]|8|0|18|NEW|YAH
affordable veneers houston|[https://marquettedentistry.com/services/improve-your-smile/affordable-veneers-in-houston/]|4|7|3|UP|YAH
affordable veneers in houston|[https://marquettedentistry.com/services/improve-your-smile/affordable-veneers-in-houston/]|6|6|0|EQ|YAH
bad credit dental financing houston|[https://marquettedentistry.com/financing/bad-credit-dental-financing-in-houston-tx/]|3|2|-1|DOWN|YAH
bad credit dental financing houston tx|[https://marquettedentistry.com/financing/bad-credit-dental-financing-in-houston-tx/]|2|2|0|EQ|YAH
bad credit dental financing in houston tx|[https://marquettedentistry.com/financing/bad-credit-dental-financing-in-houston-tx/]|2|2|0|EQ|YAH
bad credit dental financing in katy tx|[https://marquettedentistry.com/financing/bad-credit-dental-financing-in-katy-tx/]|2|2|0|EQ|YAH
bad credit dental financing in pearland tx|[https://marquettedentistry.com/financing/bad-credit-dental-financing-in-pearland-tx/]|2|1|-1|DOWN|YAH
bad credit dental financing in sugarland tx|[https://marquettedentistry.com/financing/bad-credit-dental-financing-in-sugarland-tx/]|1|1|0|EQ|YAH
bad credit dental financing katy tx|[https://marquettedentistry.com/financing/bad-credit-dental-financing-in-katy-tx/]|1|2|1|UP|YAH
best cosmetic dentist houston|[https://marquettedentistry.com/services/cosmetic-dentistry/best-cosmetic-dentist-in-houston/]|24|29|5|UP|YAH
best cosmetic dentist in houston|[https://marquettedentistry.com/services/cosmetic-dentistry/best-cosmetic-dentist-in-houston/]|17|30|13|UP|YAH
best kids dentist near me southwest houston tx|[https://marquettedentistry.com/services/pediatric-dentist-houston/best-kids-dentist-near-me-southwest-houston-tx/]|2|2|0|EQ|YAH
best porcelain veneers in houston|[https://marquettedentistry.com/services/improve-your-smile/best-porcelain-veneers-in-houston-2/]|7|7|0|EQ|YAH
best veneer dentist in houston|[https://marquettedentistry.com/services/improve-your-smile/best-veneers-in-houston-2/]|8|15|7|UP|YAH
best veneer in houston|[https://marquettedentistry.com/services/improve-your-smile/best-veneers-in-houston-2/]|5|5|0|EQ|YAH
best veneers houston|[https://marquettedentistry.com/services/improve-your-smile/best-veneers-in-houston-2/]|5|5|0|EQ|YAH
best veneers in houston|[https://marquettedentistry.com/services/improve-your-smile/best-veneers-in-houston-2/]|9|6|-3|DOWN|YAH
bridgework houston|[https://marquettedentistry.com/services/crowns-and-bridges/crown-and-bridgework-in-houston-tx/]|1|0|25|NEW|YAH
bridgework houston tx|[https://marquettedentistry.com/services/crowns-and-bridges/crown-and-bridgework-in-houston-tx/]|1|0|25|NEW|YAH
broken denture repair houston|[https://marquettedentistry.com/services/rehabilititative-treatment/denture-repair-houston/]|7|3|-4|DOWN|YAH
carecredit dental financing houston|[https://marquettedentistry.com/financing/carecredit-dental-financing-houston/]|3|4|1|UP|YAH
cavities need houston dentist|[https://marquettedentistry.com/cosmetic-dentistry-practice/cavities-need-houston-dentist/]|2|2|0|EQ|YAH
cheap veneer dentist houston|[https://marquettedentistry.com/services/improve-your-smile/affordable-veneers-in-houston/]|13|8|-5|DOWN|YAH
child care dentist houston|[https://marquettedentistry.com/services/pediatric-dentist-houston/child-care-dentist-houston/]|2|1|-1|DOWN|YAH
child care dentists houston|[https://marquettedentistry.com/services/pediatric-dentist-houston/child-care-dentist-houston/]|2|1|-1|DOWN|YAH
children and dentist houston|[https://marquettedentistry.com/services/pediatric-dentist-houston/children-and-dentist-houston-2/]|4|0|22|NEW|YAH
childrens dentist houston|[https://marquettedentistry.com/services/pediatric-dentist-houston/childrens-dentist-houston/]|23|0|3|NEW|YAH
chip dental houston|[https://marquettedentistry.com/services/pediatric-dentist-houston/chip-dental-houston-2/]|2|1|-1|DOWN|YAH
clear aligners houston|[https://marquettedentistry.com/services/crowns-and-bridges/invisalign-sugarland-tx/]|17|0|9|NEW|YAH
clear braces houston|[https://marquettedentistry.com/services/clear-correct/clear-braces-houston/]|21|18|-3|DOWN|YAH
clear correct houston|[https://marquettedentistry.com/clear-correct/]|20|29|9|UP|YAH
clearcorrect aligners in houston tx|[https://marquettedentistry.com/services/clear-correct/clearcorrect-aligners-in-houston-tx/]|3|3|0|EQ|YAH
clearcorrect aligners in katy tx|[https://marquettedentistry.com/services/clear-correct/clearcorrect-aligners-in-katy-tx/]|1|1|0|EQ|YAH
clearcorrect aligners in pearland tx|[https://marquettedentistry.com/services/clear-correct/clearcorrect-aligners-pearland-tx/]|2|2|0|EQ|YAH
clearcorrect aligners in sugarland tx|[https://marquettedentistry.com/services/clear-correct/clearcorrect-aligners-in-sugarland-tx/]|2|2|0|EQ|YAH
clearcorrect aligners katy|[https://marquettedentistry.com/services/clear-correct/clearcorrect-aligners-in-katy-tx/]|3|2|-1|DOWN|YAH
clearcorrect aligners pearland tx|[https://marquettedentistry.com/services/clear-correct/clearcorrect-aligners-in-pearland-tx/]|3|1|-2|DOWN|YAH
clearcorrect aligners sugarland tx|[https://marquettedentistry.com/services/clear-correct/clearcorrect-aligners-in-sugarland-tx/]|4|2|-2|DOWN|YAH
clearcorrect for the greater houston area|[https://marquettedentistry.com/services/clear-correct/clearcorrect-for-the-greater-houston-area/]|2|22|20|UP|YAH
clearcorrect greater houston|[https://marquettedentistry.com/services/clear-correct/clearcorrect-for-the-greater-houston-area/]|2|0|24|NEW|YAH
clearcorrect houston|[https://marquettedentistry.com/services/clear-correct/clearcorrect-for-the-greater-houston-area/]|14|18|4|UP|YAH
ClearCorrect in houston west university tx|[https://marquettedentistry.com/services/clear-correct/clearcorrect-aligners-in-west-university-tx/]|1|0|25|NEW|YAH
clearcorrect in missouri city|[https://marquettedentistry.com/services/clear-correct/clearcorrect-in-missouri-city-2/]|2|2|0|EQ|YAH
clearcorrect in sugarland tx|[https://marquettedentistry.com/services/clear-correct/clearcorrect-aligners-in-sugarland-tx/]|3|2|-1|DOWN|YAH
ClearCorrect in West University TX|[https://marquettedentistry.com/services/clear-correct/clearcorrect-aligners-in-west-university-tx/]|1|0|25|NEW|YAH
clearcorrect stafford tx|[https://marquettedentistry.com/services/clear-correct/clearcorrect-in-stafford-tx/]|1|1|0|EQ|YAH
clearcorrect west university tx|[https://marquettedentistry.com/services/clear-correct/clearcorrect-aligners-in-west-university-tx/]|1|1|0|EQ|YAH
Cosmetic and Restorative Dentistry houston tx|[https://marquettedentistry.com/services/cosmetic-dentistry/stafford-tx-cosmetic-and-restorative-dentistry/]|10|0|16|NEW|YAH
cosmetic bridgework houston|[https://marquettedentistry.com/services/crowns-and-bridges/crown-and-bridgework-in-houston-tx/]|6|16|10|UP|YAH
cosmetic dental clinic houston|[https://marquettedentistry.com/[*YaB*]]|4|0|22|NEW|YAH
cosmetic dental clinic houston tx|[https://marquettedentistry.com/[*YaB*]]|4|0|22|NEW|YAH
cosmetic dental clinic in houston tx|[https://marquettedentistry.com/]|24|0|2|NEW|YAH
cosmetic dental financing houston|[https://marquettedentistry.com/financing/]|12|12|0|EQ|YAH
cosmetic dental financing houston tx|[https://marquettedentistry.com/financing/]|11|10|-1|DOWN|YAH
cosmetic dental financing katy tx|[https://marquettedentistry.com/financing/bad-credit-dental-financing-in-katy-tx/]|3|5|2|UP|YAH
cosmetic dental office houston|[https://marquettedentistry.com/services/cosmetic-dentistry/cosmetic-dentist-office-houston-tx/]|8|6|-2|DOWN|YAH
cosmetic dentist of houston|[https://marquettedentistry.com/services/houston-dentistry/]|20|0|6|NEW|YAH
cosmetic dentistry finance bad credit|[https://marquettedentistry.com/financing/bad-credit-dental-financing-in-katy-tx/]|9|0|17|NEW|YAH
cosmetic dentistry finance with bad credit|[https://marquettedentistry.com/financing/bad-credit-dental-financing-in-pearland-tx/]|15|0|11|NEW|YAH
cosmetic dentistry financing bad credit|[https://marquettedentistry.com/financing/bad-credit-dental-financing-in-katy-tx/]|9|0|17|NEW|YAH
cosmetic dentistry financing houston|[https://marquettedentistry.com/financing/]|12|8|-4|DOWN|YAH
cosmetic dentistry for bad credit houston|[https://marquettedentistry.com/financing/bad-credit-dental-financing-in-houston-tx/]|3|2|-1|DOWN|YAH
cosmetic dentistry houston texas|[https://marquettedentistry.com/services/cosmetic-dentistry/stafford-tx-cosmetic-and-restorative-dentistry/]|23|0|3|NEW|YAH
cosmetic dentistry houston tx|[https://marquettedentistry.com/services/cosmetic-dentistry/stafford-tx-cosmetic-and-restorative-dentistry/]|17|0|9|NEW|YAH
cosmetic dentures houston|[https://marquettedentistry.com/[*YaB*]]|4|2|-2|DOWN|YAH
crown and bridgework houston|[https://marquettedentistry.com/services/crowns-and-bridges/crown-and-bridgework-in-houston-tx/]|1|7|6|UP|YAH
crown and bridgework houston tx|[https://marquettedentistry.com/services/crowns-and-bridges/crown-and-bridgework-in-houston-tx/]|1|5|4|UP|YAH
crown and bridgework in houston tx|[https://marquettedentistry.com/services/crowns-and-bridges/crown-and-bridgework-in-houston-tx/]|1|5|4|UP|YAH
crown and bridgework in pearland tx|[https://marquettedentistry.com/services/crowns-and-bridges/crown-and-bridgework-in-pearland-tx/]|3|1|-2|DOWN|YAH
crown and bridgework katy|[https://marquettedentistry.com/services/crowns-and-bridges/crown-and-bridgework-services-in-katy-tx/]|1|1|0|EQ|YAH
crown and bridgework pearland|[https://marquettedentistry.com/services/crowns-and-bridges/crown-and-bridgework-in-pearland-tx/]|6|1|-5|DOWN|YAH
crown and bridgework pearland tx|[https://marquettedentistry.com/services/crowns-and-bridges/crown-and-bridgework-in-pearland-tx/]|2|1|-1|DOWN|YAH
crown and bridgework services houston|[https://marquettedentistry.com/services/crowns-and-bridges/crown-and-bridgework-in-houston-tx/]|1|5|4|UP|YAH
crown and bridgework services in katy|[https://marquettedentistry.com/services/crowns-and-bridges/crown-and-bridgework-services-in-katy-tx/]|1|1|0|EQ|YAH
crown and bridgework services in katy tx|[https://marquettedentistry.com/services/crowns-and-bridges/crown-and-bridgework-services-in-katy-tx/]|1|1|0|EQ|YAH
crown and bridgework services katy tx|[https://marquettedentistry.com/services/crowns-and-bridges/crown-and-bridgework-services-in-katy-tx/]|1|1|0|EQ|YAH
crown and bridgework sugarland tx|[https://marquettedentistry.com/services/crowns-and-bridges/crown-and-bridgework-sugarland-tx/]|1|1|0|EQ|YAH
Dental Bonding Houston|[https://marquettedentistry.com/services/rehabilititative-treatment/dental-bonding-houston-2/]|9|13|4|UP|YAH
dental care loans bad credit houston|[https://marquettedentistry.com/financing/bad-credit-dental-financing-in-houston-tx/]|3|3|0|EQ|YAH
dental care loans bad credit pearland|[https://marquettedentistry.com/financing/bad-credit-dental-financing-in-pearland-tx/]|1|1|0|EQ|YAH
dental cosmetic financing houston|[https://marquettedentistry.com/services/cosmetic-dentistry/houston-dental-finance/]|3|9|6|UP|YAH
dental credit in houston texas|[https://marquettedentistry.com/financing/bad-credit-dental-financing-in-houston-tx/]|5|4|-1|DOWN|YAH
dental credit in houston tx|[https://marquettedentistry.com/financing/bad-credit-dental-financing-in-houston-tx/]|4|4|0|EQ|YAH
dental financing 100 in sugarland tx|[https://marquettedentistry.com/financing/dental-financing-100-in-sugarland-tx/]|2|2|0|EQ|YAH
dental financing 100 sugarland tx|[https://marquettedentistry.com/financing/dental-financing-100-in-sugarland-tx/]|1|2|1|UP|YAH
dental financing 100% in sugarland tx|[https://marquettedentistry.com/financing/dental-financing-100-in-sugarland-tx/]|1|1|0|EQ|YAH
dental financing bad credit houston|[https://marquettedentistry.com/financing/bad-credit-dental-financing-in-houston-tx/]|5|3|-2|DOWN|YAH
dental financing bad credit houston tx|[https://marquettedentistry.com/financing/bad-credit-dental-financing-in-houston-tx/]|1|2|1|UP|YAH
dental financing in katy tx|[https://marquettedentistry.com/financing/dental-financing-100-in-katy-tx/]|8|5|-3|DOWN|YAH
dental financing in pearland tx|[https://marquettedentistry.com/financing/bad-credit-dental-financing-in-pearland-tx/]|4|3|-1|DOWN|YAH
dental financing in sugarland tx|[https://marquettedentistry.com/financing/dental-financing-100-in-sugarland-tx/]|3|3|0|EQ|YAH
dental financing katy|[https://marquettedentistry.com/financing/dental-financing-100-in-katy-tx/]|11|7|-4|DOWN|YAH
dental financing no credit check houston|[https://marquettedentistry.com/financing/bad-credit-dental-financing-in-houston-tx/]|5|11|6|UP|YAH
dental financing pearland|[https://marquettedentistry.com/financing/bad-credit-dental-financing-in-pearland-tx/]|5|5|0|EQ|YAH
dental financing plans bad credit houston|[https://marquettedentistry.com/financing/bad-credit-dental-financing-in-houston-tx/]|3|2|-1|DOWN|YAH
dental financing sugarland|[https://marquettedentistry.com/financing/dental-financing-100-in-sugarland-tx/]|3|0|23|NEW|YAH
dental financing sugarland tx|[https://marquettedentistry.com/financing/dental-financing-100-in-sugarland-tx/]|2|2|0|EQ|YAH
dental financing with bad credit houston|[https://marquettedentistry.com/financing/bad-credit-dental-financing-in-houston-tx/]|5|2|-3|DOWN|YAH
dental loan for bad credit sugarland tx|[https://marquettedentistry.com/financing/bad-credit-dental-financing-in-sugarland-tx/]|3|1|-2|DOWN|YAH
dental loans for bad credit pearland tx|[https://marquettedentistry.com/financing/bad-credit-dental-financing-in-pearland-tx/]|2|1|-1|DOWN|YAH
dental office houston|[https://marquettedentistry.com/services/cosmetic-dentistry/dental-office-houston/]|18|0|8|NEW|YAH
dental office open on sundays houston|[https://marquettedentistry.com/office/sunday-dentist-office-houston/]|19|20|1|UP|YAH
dental services for bad credit houston|[https://marquettedentistry.com/financing/bad-credit-dental-financing-in-houston-tx/]|2|2|0|EQ|YAH
dental work financing bad credit houston|[https://marquettedentistry.com/financing/bad-credit-dental-financing-in-houston-tx/]|3|2|-1|DOWN|YAH
dental work financing for bad credit houston|[https://marquettedentistry.com/financing/bad-credit-dental-financing-in-houston-tx/]|3|4|1|UP|YAH
dentist bad credit payment plans houston|[https://marquettedentistry.com/financing/bad-credit-dental-financing-in-houston-tx/]|2|1|-1|DOWN|YAH
dentist financing bad credit houston|[https://marquettedentistry.com/financing/bad-credit-dental-financing-in-houston-tx/]|3|2|-1|DOWN|YAH
dentist for toddlers houston|[https://marquettedentistry.com/services/pediatric-dentist-houston/dentist-toddlers-houston-2/]|1|1|0|EQ|YAH
Dentist Houston|[https://marquettedentistry.com/office/dentist-houston/]|9|0|17|NEW|YAH
dentist offering financing houston|[https://marquettedentistry.com/financing/dental-financing-100-in-houston-tx/]|9|6|-3|DOWN|YAH
dentist office open sunday houston|[https://marquettedentistry.com/office/sunday-dentist-office-houston/]|5|4|-1|DOWN|YAH
dentist ppo houston|[https://marquettedentistry.com/financing/dentist-ppo-houston/]|4|4|0|EQ|YAH
dentist southwest houston texas|[https://marquettedentistry.com/[*YaB*]]|5|1|-4|DOWN|YAH
dentist that finance houston|[https://marquettedentistry.com/financing/carecredit-dental-financing-houston/]|18|0|8|NEW|YAH
dentist toddlers houston|[https://marquettedentistry.com/services/pediatric-dentist-houston/dentist-toddlers-houston-2/]|2|1|-1|DOWN|YAH
dentist with financing pearland|[https://marquettedentistry.com/financing/bad-credit-dental-financing-in-pearland-tx/]|3|5|2|UP|YAH
dentists southwest houston texas|[https://marquettedentistry.com/office/southwest-dentist-houston-tx/]|9|7|-2|DOWN|YAH
denture repair houston|[https://marquettedentistry.com/services/rehabilititative-treatment/denture-repair-houston/]|18|14|-4|DOWN|YAH
emergency dental care houston|[https://marquettedentistry.com/office/emergency-dental-care-houston/]|24|0|2|NEW|YAH
extended hours dental houston|[https://marquettedentistry.com/office/extended-hours-dental-houston/]|2|1|-1|DOWN|YAH
finance dental work for bad credit houston|[https://marquettedentistry.com/financing/bad-credit-dental-financing-in-houston-tx/]|3|15|12|UP|YAH
financiamento dental en houston tx|[https://marquettedentistry.com/financing/financiamineto-dental-en-houston-tx/]|1|1|0|EQ|YAH
financing braces with bad credit houston|[https://marquettedentistry.com/financing/bad-credit-dental-financing-in-houston-tx/]|13|12|-1|DOWN|YAH
financing dental work with bad credit houston|[https://marquettedentistry.com/financing/bad-credit-dental-financing-in-houston-tx/]|4|4|0|EQ|YAH
financing for cosmetic dentistry houston|[https://marquettedentistry.com/services/cosmetic-dentistry/cosmetic-dentist-in-houston/]|7|11|4|UP|YAH
houston affordable veneers|[https://marquettedentistry.com/services/improve-your-smile/affordable-veneers-in-houston/]|6|10|4|UP|YAH
houston bad credit dental financing|[https://marquettedentistry.com/financing/bad-credit-dental-financing-in-houston-tx/]|1|1|0|EQ|YAH
houston carillas dentales econA3micas|[https://marquettedentistry.com/[*YaB*]]|1|3|2|UP|YAH
houston clearcorrect|[https://marquettedentistry.com/services/clear-correct/]|13|8|-5|DOWN|YAH
houston clearcorrect aligners|[https://marquettedentistry.com/services/clear-correct/clearcorrect-for-the-greater-houston-area/]|17|24|7|UP|YAH
houston cosmetic dental clinic|[https://marquettedentistry.com/]|13|0|13|NEW|YAH
houston cosmetic dental financing|[https://marquettedentistry.com/financing/]|7|12|5|UP|YAH
houston cosmetic dental office|[https://marquettedentistry.com/services/houston-dentistry/]|15|0|11|NEW|YAH
houston cosmetic dentist|[https://marquettedentistry.com/services/houston-dentistry/]|21|0|5|NEW|YAH
houston cosmetic dentistry for bad credit|[https://marquettedentistry.com/financing/bad-credit-dental-financing-in-houston-tx/]|3|2|-1|DOWN|YAH
houston dental care financing bad credit|[https://marquettedentistry.com/financing/bad-credit-dental-financing-in-houston-tx/]|3|1|-2|DOWN|YAH
houston dental care loans bad credit|[https://marquettedentistry.com/financing/bad-credit-dental-financing-in-houston-tx/]|2|2|0|EQ|YAH
houston dental financing|[https://marquettedentistry.com/services/cosmetic-dentistry/houston-dental-finance/]|25|26|1|UP|YAH
houston dental financing plans bad credit|[https://marquettedentistry.com/financing/bad-credit-dental-financing-in-houston-tx/]|4|1|-3|DOWN|YAH
houston dental financing with bad credit|[https://marquettedentistry.com/financing/bad-credit-dental-financing-in-houston-tx/]|2|2|0|EQ|YAH
houston dental loans patients with bad credit|[https://marquettedentistry.com/financing/bad-credit-dental-financing-in-houston-tx/]|3|2|-1|DOWN|YAH
houston dental work bad credit financing|[https://marquettedentistry.com/financing/bad-credit-dental-financing-in-houston-tx/]|2|2|0|EQ|YAH
houston dentist for kids|[https://marquettedentistry.com/services/pediatric-dentist-houston/houston-dentist-for-kids/]|8|0|18|NEW|YAH
houston dentist office open sunday|[https://marquettedentistry.com/office/sunday-dentist-office-houston/]|7|7|0|EQ|YAH
houston dentist on sunday|[https://marquettedentistry.com/office/sunday-dentist-office-houston/]|9|10|1|UP|YAH
houston dentist open on sunday|[https://marquettedentistry.com/office/sunday-dentist-office-houston/]|20|20|0|EQ|YAH
houston dentist with financing|[https://marquettedentistry.com/]|18|26|8|UP|YAH
houston dentistry financing help|[https://marquettedentistry.com/financing/dental-financing-100-in-houston-tx/]|9|16|7|UP|YAH
Houston Dentures|[https://marquettedentistry.com/services/rehabilititative-treatment/houston-dentures/]|16|0|10|NEW|YAH
houston family and cosmetic dentistry|[https://marquettedentistry.com/services/houston-dentistry/]|22|0|4|NEW|YAH
houston financing for cosmetic dentistry|[https://marquettedentistry.com/services/cosmetic-dentistry/cosmetic-dentist-in-houston/]|9|12|3|UP|YAH
houston financing for dental work|[https://marquettedentistry.com/financing/dental-financing-100-in-houston-tx/]|9|29|20|UP|YAH
houston in house cosmetic dental financing|[https://marquettedentistry.com/financing/dental-financing-100-in-houston-tx/]|22|23|1|UP|YAH
houston natural looking dentures|[https://marquettedentistry.com/[*YaB*]]|1|3|2|UP|YAH
houston sunday dentist office|[https://marquettedentistry.com/office/sunday-dentist-office-houston/]|3|1|-2|DOWN|YAH
houston texas children's dental|[https://marquettedentistry.com/services/pediatric-dentist-houston/houston-texas-childrens-dental/]|10|5|-5|DOWN|YAH
houston texas children's dental office|[https://marquettedentistry.com/services/pediatric-dentist-houston/houston-texas-childrens-dental-office/]|5|5|0|EQ|YAH
houston tx cheap cosmetic dentistry|[https://marquettedentistry.com/services/houston-dentistry/]|14|0|12|NEW|YAH
houston tx cosmetic dental clinic|[https://marquettedentistry.com/services/houston-dentistry/]|15|0|11|NEW|YAH
houston tx cosmetic dentures|[https://marquettedentistry.com/services/cosmetic-dentistry/cosmetic-dentures-houston/]|3|0|23|NEW|YAH
houston tx emergency pediatric dentist|[https://marquettedentistry.com/services/pediatric-dentist-houston/houston-tx-emergency-pediatric-dentist/]|5|0|21|NEW|YAH
houston tx family dental clinic|[https://marquettedentistry.com/cosmetic-dentistry-practice/houston-tx-family-dental-clinic/]|2|0|24|NEW|YAH
houston tx natural looking dentures|[https://marquettedentistry.com/[*YaB*]]|5|2|-3|DOWN|YAH
houston weekend dental clinics|[https://marquettedentistry.com/our-mission/weekend-dental-care-houston/]|2|1|-1|DOWN|YAH
houston weekend dentist|[https://marquettedentistry.com/our-mission/weekend-dentist-houston/]|2|2|0|EQ|YAH
in house financing dentist pearland tx|[https://marquettedentistry.com/financing/bad-credit-dental-financing-in-pearland-tx/]|4|0|22|NEW|YAH
katy cosmetic dental financing|[https://marquettedentistry.com/financing/bad-credit-dental-financing-in-katy-tx/]|17|0|9|NEW|YAH
katy crown and bridgework|[https://marquettedentistry.com/services/crowns-and-bridges/crown-and-bridgework-services-in-katy-tx/]|1|1|0|EQ|YAH
kids dental office houston tx|[https://marquettedentistry.com/services/pediatric-dentist-houston/kids-dental-office-houston-tx/]|4|1|-3|DOWN|YAH
kids dentistry houston|[https://marquettedentistry.com/services/pediatric-dentist-houston/kids-dentistry-houston-2/]|11|16|5|UP|YAH
loans for dental work pearland|[https://marquettedentistry.com/financing/bad-credit-dental-financing-in-pearland-tx/]|5|0|21|NEW|YAH
lumineers in katy tx|[https://marquettedentistry.com/services/lumineers-in-katy-tx/]|6|5|-1|DOWN|YAH
lumineers in pearland tx|[https://marquettedentistry.com/services/lumineers-in-pearland-tx/]|2|3|1|UP|YAH
lumineers in sugarland tx|[https://marquettedentistry.com/services/lumineers-in-sugarland-tx/]|4|3|-1|DOWN|YAH
lumineers sugar land texas|[https://marquettedentistry.com/services/lumineers-in-sugarland-tx/]|4|3|-1|DOWN|YAH
lumineers sugarland tx|[https://marquettedentistry.com/services/lumineers-in-sugarland-tx/]|4|4|0|EQ|YAH
marquette dental clinic|[https://marquettedentistry.com/]|4|10|6|UP|YAH
marquette dentistry|[https://marquettedentistry.com/]|2|2|0|EQ|YAH
marquette tx dentistry|[https://marquettedentistry.com/]|1|1|0|EQ|YAH
marquettedentistry.com|[https://marquettedentistry.com/]|1|1|0|EQ|YAH
missouri city porcelain veneers|[https://marquettedentistry.com/services/improve-your-smile/missouri-city-porcelain-veneers-2/]|5|6|1|UP|YAH
natural look dentures pearland|[https://marquettedentistry.com/services/rehabilititative-treatment/natural-look-dentures-pearland-tx/]|1|1|0|EQ|YAH
natural look dentures pearland tx|[https://marquettedentistry.com/services/rehabilititative-treatment/natural-look-dentures-pearland-tx/]|1|1|0|EQ|YAH
natural looking dentures houston tx|[https://marquettedentistry.com/[*YaB*]]|1|3|2|UP|YAH
natural looking dentures houston, tx|[https://marquettedentistry.com/[*YaB*]]|1|1|0|EQ|YAH
natural looking dentures in houston tx|[https://marquettedentistry.com/[*YaB*]]|4|4|0|EQ|YAH
natural looking dentures in katy tx|[https://marquettedentistry.com/services/rehabilititative-treatment/natural-looking-dentures-in-katy-tx/]|2|1|-1|DOWN|YAH
Natural Looking Dentures In Katy, TX|[https://marquettedentistry.com/services/rehabilititative-treatment/natural-looking-dentures-in-katy-tx/]|4|1|-3|DOWN|YAH
natural looking dentures in pearland tx|[https://marquettedentistry.com/services/rehabilititative-treatment/natural-look-dentures-pearland-tx/]|2|1|-1|DOWN|YAH
natural looking dentures katy|[https://marquettedentistry.com/services/rehabilititative-treatment/natural-looking-dentures-in-katy-tx/]|4|1|-3|DOWN|YAH
natural looking dentures pearland|[https://marquettedentistry.com/services/rehabilititative-treatment/natural-look-dentures-pearland-tx/]|1|2|1|UP|YAH
