100 credit dental financing houston tx|[https://marquettedentistry.com/financing/dental-financing-100-in-houston-tx/]|2|2|0|EQ|BNG
77074 cosmetic dentistry|[https://marquettedentistry.com/[*BiB*]]|1|1|0|EQ|BNG
77074 dental clinic|[https://marquettedentistry.com/[*BiB*]]|2|2|0|EQ|BNG
77074 houston cosmetic dentistry|[https://marquettedentistry.com/[*BiB*]]|1|1|0|EQ|BNG
accepting ppo dental houston|[https://marquettedentistry.com/[*BiB*]]|1|1|0|EQ|BNG
affordable cosmetic dentistry houston|[https://marquettedentistry.com/[*BiB*]]|5|5|0|EQ|BNG
affordable cosmetic dentistry houston tx|[https://marquettedentistry.com/best-dentist-in-houston[*BiB*]]|3|2|-1|DOWN|BNG
affordable dental veneers houston|[https://marquettedentistry.com/services/improve-your-smile/affordable-veneers-in-houston/]|21|23|2|UP|BNG
affordable family dentistry houston tx|[https://marquettedentistry.com/[*BiB*]]|4|1|-3|DOWN|BNG
affordable porcelain veneers houston|[https://marquettedentistry.com/services/improve-your-smile/affordable-porcelain-veneers-in-houston-2/]|8|0|18|NEW|BNG
affordable veneers houston|[https://marquettedentistry.com/services/improve-your-smile/affordable-veneers-in-houston/]|8|17|9|UP|BNG
affordable veneers in houston|[https://marquettedentistry.com/services/improve-your-smile/affordable-veneers-in-houston/]|9|6|-3|DOWN|BNG
bad credit dental financing houston|[https://marquettedentistry.com/financing/bad-credit-dental-financing-in-houston-tx/]|3|2|-1|DOWN|BNG
bad credit dental financing houston tx|[https://marquettedentistry.com/financing/bad-credit-dental-financing-in-houston-tx/]|2|2|0|EQ|BNG
bad credit dental financing in houston tx|[https://marquettedentistry.com/financing/bad-credit-dental-financing-in-houston-tx/]|2|2|0|EQ|BNG
bad credit dental financing in katy tx|[https://marquettedentistry.com/financing/bad-credit-dental-financing-in-katy-tx/]|2|2|0|EQ|BNG
bad credit dental financing in pearland tx|[https://marquettedentistry.com/financing/bad-credit-dental-financing-in-pearland-tx/]|2|2|0|EQ|BNG
bad credit dental financing in sugarland tx|[https://marquettedentistry.com/financing/bad-credit-dental-financing-in-sugarland-tx/]|1|1|0|EQ|BNG
bad credit dental financing katy tx|[https://marquettedentistry.com/financing/bad-credit-dental-financing-in-katy-tx/]|2|2|0|EQ|BNG
best cosmetic dentist houston|[https://marquettedentistry.com/services/cosmetic-dentistry/best-cosmetic-dentist-in-houston/]|24|29|5|UP|BNG
best cosmetic dentist in houston|[https://marquettedentistry.com/services/cosmetic-dentistry/best-cosmetic-dentist-in-houston/]|14|30|16|UP|BNG
best kids dentist near me southwest houston tx|[https://marquettedentistry.com/services/pediatric-dentist-houston/best-kids-dentist-near-me-southwest-houston-tx/]|2|2|0|EQ|BNG
best veneer dentist in houston|[https://marquettedentistry.com/services/improve-your-smile/best-veneers-in-houston-2/]|8|15|7|UP|BNG
best veneer in houston|[https://marquettedentistry.com/services/improve-your-smile/best-veneers-in-houston-2/]|5|5|0|EQ|BNG
best veneers houston|[https://marquettedentistry.com/services/improve-your-smile/best-veneers-in-houston-2/]|5|5|0|EQ|BNG
best veneers in houston|[https://marquettedentistry.com/services/improve-your-smile/best-veneers-in-houston-2/]|9|6|-3|DOWN|BNG
bridgework houston|[https://marquettedentistry.com/services/crowns-and-bridges/crown-and-bridgework-in-houston-tx/]|1|0|25|NEW|BNG
bridgework houston tx|[https://marquettedentistry.com/services/crowns-and-bridges/crown-and-bridgework-in-houston-tx/]|1|0|25|NEW|BNG
broken denture repair houston|[https://marquettedentistry.com/services/rehabilititative-treatment/denture-repair-houston/]|7|3|-4|DOWN|BNG
carecredit dental financing houston|[https://marquettedentistry.com/financing/carecredit-dental-financing-houston/]|4|4|0|EQ|BNG
cavities need houston dentist|[https://marquettedentistry.com/cosmetic-dentistry-practice/cavities-need-houston-dentist/]|2|2|0|EQ|BNG
child care dentist houston|[https://marquettedentistry.com/services/pediatric-dentist-houston/child-care-dentist-houston/]|2|1|-1|DOWN|BNG
child care dentists houston|[https://marquettedentistry.com/services/pediatric-dentist-houston/child-care-dentist-houston/]|2|1|-1|DOWN|BNG
children and dentist houston|[https://marquettedentistry.com/services/pediatric-dentist-houston/children-and-dentist-houston-2/]|4|0|22|NEW|BNG
childrens dentist houston|[https://marquettedentistry.com/services/pediatric-dentist-houston/childrens-dentist-houston/]|23|0|3|NEW|BNG
chip dental houston|[https://marquettedentistry.com/services/pediatric-dentist-houston/chip-dental-houston-2/]|1|1|0|EQ|BNG
clear aligners houston|[https://marquettedentistry.com/services/crowns-and-bridges/invisalign-sugarland-tx/]|17|0|9|NEW|BNG
clearcorrect aligners in katy tx|[https://marquettedentistry.com/services/clear-correct/clearcorrect-aligners-in-katy-tx/]|1|1|0|EQ|BNG
clearcorrect aligners in pearland tx|[https://marquettedentistry.com/services/clear-correct/clearcorrect-aligners-pearland-tx/]|3|2|-1|DOWN|BNG
clearcorrect aligners in sugarland tx|[https://marquettedentistry.com/services/clear-correct/clearcorrect-aligners-in-sugarland-tx/]|2|2|0|EQ|BNG
clearcorrect aligners katy|[https://marquettedentistry.com/services/clear-correct/clearcorrect-aligners-in-katy-tx/]|3|2|-1|DOWN|BNG
clearcorrect aligners pearland tx|[https://marquettedentistry.com/services/clear-correct/clearcorrect-aligners-in-pearland-tx/]|3|1|-2|DOWN|BNG
clearcorrect aligners sugarland tx|[https://marquettedentistry.com/services/clear-correct/clearcorrect-aligners-in-sugarland-tx/]|4|2|-2|DOWN|BNG
clearcorrect for the greater houston area|[https://marquettedentistry.com/services/clear-correct/clearcorrect-for-the-greater-houston-area/]|2|22|20|UP|BNG
clearcorrect greater houston|[https://marquettedentistry.com/services/clear-correct/clearcorrect-for-the-greater-houston-area/]|2|0|24|NEW|BNG
clearcorrect houston|[https://marquettedentistry.com/services/clear-correct/clearcorrect-for-the-greater-houston-area/]|14|0|12|NEW|BNG
ClearCorrect in houston west university tx|[https://marquettedentistry.com/services/clear-correct/clearcorrect-aligners-in-west-university-tx/]|1|0|25|NEW|BNG
clearcorrect in missouri city|[https://marquettedentistry.com/services/clear-correct/clearcorrect-in-missouri-city-2/]|2|2|0|EQ|BNG
clearcorrect in sugarland tx|[https://marquettedentistry.com/services/clear-correct/clearcorrect-aligners-in-sugarland-tx/]|3|2|-1|DOWN|BNG
ClearCorrect in West University TX|[https://marquettedentistry.com/services/clear-correct/clearcorrect-aligners-in-west-university-tx/]|1|0|25|NEW|BNG
clearcorrect stafford tx|[https://marquettedentistry.com/[*BiB*]]|2|1|-1|DOWN|BNG
clearcorrect west university tx|[https://marquettedentistry.com/services/clear-correct/clearcorrect-aligners-in-west-university-tx/]|1|1|0|EQ|BNG
Cosmetic and Restorative Dentistry houston tx|[https://marquettedentistry.com/services/cosmetic-dentistry/stafford-tx-cosmetic-and-restorative-dentistry/]|16|0|10|NEW|BNG
cosmetic bridgework houston|[https://marquettedentistry.com/services/crowns-and-bridges/crown-and-bridgework-in-houston-tx/]|2|16|14|UP|BNG
cosmetic dental clinic houston|[https://marquettedentistry.com/[*BiB*]]|4|0|22|NEW|BNG
cosmetic dental clinic houston tx|[https://marquettedentistry.com/[*BiB*]]|4|0|22|NEW|BNG
cosmetic dental clinic in houston tx|[https://marquettedentistry.com/services/houston-dentistry/]|20|0|6|NEW|BNG
cosmetic dental financing houston|[https://marquettedentistry.com/services/cosmetic-dentistry/houston-dental-finance/]|9|12|3|UP|BNG
cosmetic dental financing katy tx|[https://marquettedentistry.com/financing/bad-credit-dental-financing-in-katy-tx/]|5|5|0|EQ|BNG
cosmetic dental office houston|[https://marquettedentistry.com/services/cosmetic-dentistry/cosmetic-dentist-office-houston-tx/]|8|6|-2|DOWN|BNG
cosmetic dentist of houston|[https://marquettedentistry.com/services/houston-dentistry/]|20|0|6|NEW|BNG
cosmetic dentistry clinic houston|[https://marquettedentistry.com/services/cosmetic-dentistry/stafford-tx-cosmetic-and-restorative-dentistry/]|24|0|2|NEW|BNG
cosmetic dentistry finance bad credit|[https://marquettedentistry.com/financing/bad-credit-dental-financing-in-katy-tx/]|9|0|17|NEW|BNG
cosmetic dentistry finance with bad credit|[https://marquettedentistry.com/financing/bad-credit-dental-financing-in-pearland-tx/]|15|0|11|NEW|BNG
cosmetic dentistry financing bad credit|[https://marquettedentistry.com/financing/bad-credit-dental-financing-in-katy-tx/]|9|0|17|NEW|BNG
cosmetic dentistry financing houston|[https://marquettedentistry.com/financing/]|12|8|-4|DOWN|BNG
cosmetic dentistry for bad credit houston|[https://marquettedentistry.com/financing/bad-credit-dental-financing-in-houston-tx/]|3|2|-1|DOWN|BNG
cosmetic dentistry houston texas|[https://marquettedentistry.com/services/cosmetic-dentistry/stafford-tx-cosmetic-and-restorative-dentistry/]|23|0|3|NEW|BNG
cosmetic dentistry houston tx|[https://marquettedentistry.com/services/cosmetic-dentistry/stafford-tx-cosmetic-and-restorative-dentistry/]|17|0|9|NEW|BNG
cosmetic dentures houston|[https://marquettedentistry.com/[*BiB*]]|4|2|-2|DOWN|BNG
crown and bridgework houston|[https://marquettedentistry.com/services/crowns-and-bridges/crown-and-bridgework-in-houston-tx/]|1|7|6|UP|BNG
crown and bridgework houston tx|[https://marquettedentistry.com/services/crowns-and-bridges/crown-and-bridgework-in-houston-tx/]|1|5|4|UP|BNG
crown and bridgework in houston tx|[https://marquettedentistry.com/services/crowns-and-bridges/crown-and-bridgework-in-houston-tx/]|1|5|4|UP|BNG
crown and bridgework in pearland tx|[https://marquettedentistry.com/services/crowns-and-bridges/crown-and-bridgework-in-pearland-tx/]|2|1|-1|DOWN|BNG
crown and bridgework katy|[https://marquettedentistry.com/services/crowns-and-bridges/crown-and-bridgework-services-in-katy-tx/]|1|1|0|EQ|BNG
crown and bridgework pearland|[https://marquettedentistry.com/services/crowns-and-bridges/crown-and-bridgework-in-pearland-tx/]|3|1|-2|DOWN|BNG
crown and bridgework pearland tx|[https://marquettedentistry.com/services/crowns-and-bridges/crown-and-bridgework-in-pearland-tx/]|2|1|-1|DOWN|BNG
crown and bridgework services houston|[https://marquettedentistry.com/services/crowns-and-bridges/crown-and-bridgework-in-houston-tx/]|1|5|4|UP|BNG
crown and bridgework services in katy|[https://marquettedentistry.com/services/crowns-and-bridges/crown-and-bridgework-services-in-katy-tx/]|1|1|0|EQ|BNG
crown and bridgework services in katy tx|[https://marquettedentistry.com/services/crowns-and-bridges/crown-and-bridgework-services-in-katy-tx/]|1|1|0|EQ|BNG
crown and bridgework services katy tx|[https://marquettedentistry.com/services/crowns-and-bridges/crown-and-bridgework-services-in-katy-tx/]|1|1|0|EQ|BNG
crown and bridgework sugarland tx|[https://marquettedentistry.com/services/crowns-and-bridges/crown-and-bridgework-sugarland-tx/]|1|1|0|EQ|BNG
Dental Bonding Houston|[https://marquettedentistry.com/services/rehabilititative-treatment/dental-bonding-houston-2/]|9|13|4|UP|BNG
dental care loans bad credit houston|[https://marquettedentistry.com/financing/bad-credit-dental-financing-in-houston-tx/]|3|3|0|EQ|BNG
dental care loans bad credit pearland|[https://marquettedentistry.com/financing/bad-credit-dental-financing-in-pearland-tx/]|1|2|1|UP|BNG
dental cosmetic financing houston|[https://marquettedentistry.com/services/cosmetic-dentistry/houston-dental-finance/]|7|9|2|UP|BNG
dental credit in houston tx|[https://marquettedentistry.com/financing/bad-credit-dental-financing-in-houston-tx/]|4|4|0|EQ|BNG
dental financing 100 in sugarland tx|[https://marquettedentistry.com/financing/dental-financing-100-in-sugarland-tx/]|2|2|0|EQ|BNG
dental financing 100 sugarland tx|[https://marquettedentistry.com/financing/dental-financing-100-in-sugarland-tx/]|1|2|1|UP|BNG
dental financing 100% in sugarland tx|[https://marquettedentistry.com/financing/dental-financing-100-in-sugarland-tx/]|2|1|-1|DOWN|BNG
dental financing bad credit houston|[https://marquettedentistry.com/financing/bad-credit-dental-financing-in-houston-tx/]|5|3|-2|DOWN|BNG
dental financing bad credit houston tx|[https://marquettedentistry.com/financing/bad-credit-dental-financing-in-houston-tx/]|4|2|-2|DOWN|BNG
dental financing in pearland tx|[https://marquettedentistry.com/financing/bad-credit-dental-financing-in-pearland-tx/]|4|3|-1|DOWN|BNG
dental financing in sugarland tx|[https://marquettedentistry.com/financing/dental-financing-100-in-sugarland-tx/]|3|3|0|EQ|BNG
dental financing katy|[https://marquettedentistry.com/financing/dental-financing-100-in-katy-tx/]|12|7|-5|DOWN|BNG
dental financing pearland|[https://marquettedentistry.com/financing/bad-credit-dental-financing-in-pearland-tx/]|5|4|-1|DOWN|BNG
dental financing plans bad credit houston|[https://marquettedentistry.com/financing/bad-credit-dental-financing-in-houston-tx/]|4|2|-2|DOWN|BNG
dental financing sugarland|[https://marquettedentistry.com/financing/dental-financing-100-in-sugarland-tx/]|3|0|23|NEW|BNG
dental financing sugarland tx|[https://marquettedentistry.com/financing/dental-financing-100-in-sugarland-tx/]|3|2|-1|DOWN|BNG
dental financing with bad credit houston|[https://marquettedentistry.com/financing/bad-credit-dental-financing-in-houston-tx/]|5|3|-2|DOWN|BNG
dental loan for bad credit sugarland tx|[https://marquettedentistry.com/financing/bad-credit-dental-financing-in-sugarland-tx/]|3|1|-2|DOWN|BNG
dental loans for bad credit pearland tx|[https://marquettedentistry.com/financing/bad-credit-dental-financing-in-pearland-tx/]|2|2|0|EQ|BNG
dental office houston|[https://marquettedentistry.com/services/cosmetic-dentistry/dental-office-houston/]|18|0|8|NEW|BNG
dental services for bad credit houston|[https://marquettedentistry.com/financing/bad-credit-dental-financing-in-houston-tx/]|2|2|0|EQ|BNG
dental work financing bad credit houston|[https://marquettedentistry.com/financing/bad-credit-dental-financing-in-houston-tx/]|2|2|0|EQ|BNG
dental work financing for bad credit houston|[https://marquettedentistry.com/financing/bad-credit-dental-financing-in-houston-tx/]|3|4|1|UP|BNG
dentist bad credit payment plans houston|[https://marquettedentistry.com/financing/bad-credit-dental-financing-in-houston-tx/]|3|1|-2|DOWN|BNG
dentist financing bad credit houston|[https://marquettedentistry.com/financing/bad-credit-dental-financing-in-houston-tx/]|3|2|-1|DOWN|BNG
dentist for toddlers houston|[https://marquettedentistry.com/services/pediatric-dentist-houston/dentist-toddlers-houston-2/]|2|1|-1|DOWN|BNG
Dentist Houston|[https://marquettedentistry.com/office/dentist-houston/]|9|0|17|NEW|BNG
dentist offering financing houston|[https://marquettedentistry.com/financing/dental-financing-100-in-houston-tx/]|9|6|-3|DOWN|BNG
dentist ppo houston|[https://marquettedentistry.com/financing/dentist-ppo-houston/]|8|4|-4|DOWN|BNG
dentist southwest houston texas|[https://marquettedentistry.com/[*BiB*]]|5|1|-4|DOWN|BNG
dentist that finance houston|[https://marquettedentistry.com/financing/carecredit-dental-financing-houston/]|18|0|8|NEW|BNG
dentist toddlers houston|[https://marquettedentistry.com/services/pediatric-dentist-houston/dentist-toddlers-houston-2/]|2|1|-1|DOWN|BNG
dentist with financing pearland|[https://marquettedentistry.com/financing/bad-credit-dental-financing-in-pearland-tx/]|3|3|0|EQ|BNG
dentists southwest houston texas|[https://marquettedentistry.com/office/southwest-dentist-houston-tx/]|9|7|-2|DOWN|BNG
denture repair houston|[https://marquettedentistry.com/services/rehabilititative-treatment/denture-repair-houston/]|18|19|1|UP|BNG
emergency dental care houston|[https://marquettedentistry.com/office/emergency-dental-care-houston/]|24|0|2|NEW|BNG
extended hours dental houston|[https://marquettedentistry.com/office/extended-hours-dental-houston/]|2|1|-1|DOWN|BNG
finance dental work for bad credit houston|[https://marquettedentistry.com/financing/bad-credit-dental-financing-in-houston-tx/]|3|15|12|UP|BNG
financiamento dental en houston tx|[https://marquettedentistry.com/financing/financiamineto-dental-en-houston-tx/]|1|1|0|EQ|BNG
financing dental work with bad credit houston|[https://marquettedentistry.com/financing/bad-credit-dental-financing-in-houston-tx/]|4|3|-1|DOWN|BNG
financing for cosmetic dentistry houston|[https://marquettedentistry.com/services/cosmetic-dentistry/cosmetic-dentist-in-houston/]|7|11|4|UP|BNG
houston affordable veneers|[https://marquettedentistry.com/services/improve-your-smile/affordable-veneers-in-houston/]|8|10|2|UP|BNG
houston bad credit dental financing|[https://marquettedentistry.com/financing/bad-credit-dental-financing-in-houston-tx/]|1|1|0|EQ|BNG
houston carillas dentales econA3micas|[https://marquettedentistry.com/[*BiB*]]|1|3|2|UP|BNG
houston clearcorrect|[https://marquettedentistry.com/services/clear-correct/clearcorrect-for-the-greater-houston-area/]|10|8|-2|DOWN|BNG
houston clearcorrect aligners|[https://marquettedentistry.com/services/clear-correct/clearcorrect-for-the-greater-houston-area/]|17|24|7|UP|BNG
houston cosmetic dental clinic|[https://marquettedentistry.com/]|12|0|14|NEW|BNG
houston cosmetic dental financing|[https://marquettedentistry.com/financing/]|7|12|5|UP|BNG
houston cosmetic dental office|[https://marquettedentistry.com/services/houston-dentistry/]|15|0|11|NEW|BNG
houston cosmetic dentist|[https://marquettedentistry.com/services/houston-dentistry/]|21|0|5|NEW|BNG
houston cosmetic dentistry for bad credit|[https://marquettedentistry.com/financing/bad-credit-dental-financing-in-houston-tx/]|3|2|-1|DOWN|BNG
houston dental care financing bad credit|[https://marquettedentistry.com/financing/bad-credit-dental-financing-in-houston-tx/]|3|1|-2|DOWN|BNG
houston dental care loans bad credit|[https://marquettedentistry.com/financing/bad-credit-dental-financing-in-houston-tx/]|3|2|-1|DOWN|BNG
houston dental financing|[https://marquettedentistry.com/services/cosmetic-dentistry/houston-dental-finance/]|25|26|1|UP|BNG
houston dental financing plans bad credit|[https://marquettedentistry.com/financing/bad-credit-dental-financing-in-houston-tx/]|4|1|-3|DOWN|BNG
houston dental financing with bad credit|[https://marquettedentistry.com/financing/bad-credit-dental-financing-in-houston-tx/]|2|2|0|EQ|BNG
houston dental loans patients with bad credit|[https://marquettedentistry.com/financing/bad-credit-dental-financing-in-houston-tx/]|3|2|-1|DOWN|BNG
houston dental work bad credit financing|[https://marquettedentistry.com/financing/bad-credit-dental-financing-in-houston-tx/]|2|2|0|EQ|BNG
houston dentist for kids|[https://marquettedentistry.com/services/pediatric-dentist-houston/houston-dentist-for-kids/]|8|0|18|NEW|BNG
houston dentist office open sunday|[https://marquettedentistry.com/office/sunday-dentist-office-houston/]|9|7|-2|DOWN|BNG
houston dentist on a sunday|[https://marquettedentistry.com/office/sunday-dentist-office-houston/]|20|20|0|EQ|BNG
houston dentist on sunday|[https://marquettedentistry.com/office/sunday-dentist-office-houston/]|12|10|-2|DOWN|BNG
houston dentist with financing|[https://marquettedentistry.com/]|18|26|8|UP|BNG
houston dentistry financing help|[https://marquettedentistry.com/[*BiB*]]|1|16|15|UP|BNG
Houston Dentures|[https://marquettedentistry.com/services/rehabilititative-treatment/houston-dentures/]|16|0|10|NEW|BNG
houston family and cosmetic dentistry|[https://marquettedentistry.com/services/houston-dentistry/]|22|0|4|NEW|BNG
houston financing for cosmetic dentistry|[https://marquettedentistry.com/services/cosmetic-dentistry/cosmetic-dentist-in-houston/]|9|12|3|UP|BNG
houston in house cosmetic dental financing|[https://marquettedentistry.com/services/cosmetic-dentistry/houston-dental-finance/]|4|0|22|NEW|BNG
houston natural looking dentures|[https://marquettedentistry.com/[*BiB*]]|1|3|2|UP|BNG
houston sunday dentist office|[https://marquettedentistry.com/office/sunday-dentist-office-houston/]|4|1|-3|DOWN|BNG
houston texas children's dental|[https://marquettedentistry.com/services/pediatric-dentist-houston/houston-texas-childrens-dental/]|10|5|-5|DOWN|BNG
houston texas children's dental office|[https://marquettedentistry.com/services/pediatric-dentist-houston/houston-texas-childrens-dental-office/]|5|4|-1|DOWN|BNG
houston tx cheap cosmetic dentistry|[https://marquettedentistry.com/services/houston-dentistry/]|14|0|12|NEW|BNG
houston tx cosmetic dental clinic|[https://marquettedentistry.com/services/houston-dentistry/]|15|0|11|NEW|BNG
houston tx cosmetic dentures|[https://marquettedentistry.com/services/cosmetic-dentistry/cosmetic-dentures-houston/]|3|0|23|NEW|BNG
houston tx emergency pediatric dentist|[https://marquettedentistry.com/services/pediatric-dentist-houston/houston-tx-emergency-pediatric-dentist/]|5|0|21|NEW|BNG
houston tx family dental clinic|[https://marquettedentistry.com/cosmetic-dentistry-practice/houston-tx-family-dental-clinic/]|2|0|24|NEW|BNG
houston tx natural looking dentures|[https://marquettedentistry.com/[*BiB*]]|5|2|-3|DOWN|BNG
houston weekend dental clinics|[https://marquettedentistry.com/our-mission/weekend-dental-care-houston/]|2|1|-1|DOWN|BNG
houston weekend dentist|[https://marquettedentistry.com/our-mission/weekend-dentist-houston/]|2|2|0|EQ|BNG
in house financing dentist pearland tx|[https://marquettedentistry.com/financing/bad-credit-dental-financing-in-pearland-tx/]|4|0|22|NEW|BNG
invisalign sugarland tx|[https://marquettedentistry.com/services/crowns-and-bridges/invisalign-sugarland-tx/]|11|13|2|UP|BNG
katy cosmetic dental financing|[https://marquettedentistry.com/financing/bad-credit-dental-financing-in-katy-tx/]|17|0|9|NEW|BNG
katy crown and bridgework|[https://marquettedentistry.com/services/crowns-and-bridges/crown-and-bridgework-services-in-katy-tx/]|1|1|0|EQ|BNG
kids dental office houston tx|[https://marquettedentistry.com/services/pediatric-dentist-houston/kids-dental-office-houston-tx/]|4|1|-3|DOWN|BNG
kids dentistry houston|[https://marquettedentistry.com/services/pediatric-dentist-houston/kids-dentistry-houston-2/]|11|16|5|UP|BNG
loans for dental work pearland|[https://marquettedentistry.com/financing/bad-credit-dental-financing-in-pearland-tx/]|5|0|21|NEW|BNG
lumineers in katy tx|[https://marquettedentistry.com/services/lumineers-in-katy-tx/]|7|5|-2|DOWN|BNG
lumineers in pearland tx|[https://marquettedentistry.com/services/lumineers-in-pearland-tx/]|2|2|0|EQ|BNG
lumineers in sugarland tx|[https://marquettedentistry.com/services/lumineers-in-sugarland-tx/]|4|3|-1|DOWN|BNG
lumineers sugar land texas|[https://marquettedentistry.com/services/lumineers-in-sugarland-tx/]|4|3|-1|DOWN|BNG
lumineers sugarland tx|[https://marquettedentistry.com/services/lumineers-in-sugarland-tx/]|4|4|0|EQ|BNG
marquette dental clinic|[https://marquettedentistry.com/]|7|10|3|UP|BNG
marquette dentistry|[https://marquettedentistry.com/]|2|2|0|EQ|BNG
marquette tx dentistry|[https://marquettedentistry.com/]|1|1|0|EQ|BNG
marquettedentistry.com|[https://marquettedentistry.com/]|1|1|0|EQ|BNG
natural look dentures pearland|[https://marquettedentistry.com/services/rehabilititative-treatment/natural-look-dentures-pearland-tx/]|2|1|-1|DOWN|BNG
natural look dentures pearland tx|[https://marquettedentistry.com/services/rehabilititative-treatment/natural-look-dentures-pearland-tx/]|1|1|0|EQ|BNG
natural looking dentures houston tx|[https://marquettedentistry.com/[*BiB*]]|1|3|2|UP|BNG
natural looking dentures houston, tx|[https://marquettedentistry.com/[*BiB*]]|1|1|0|EQ|BNG
natural looking dentures in houston tx|[https://marquettedentistry.com/[*BiB*]]|4|4|0|EQ|BNG
natural looking dentures in katy tx|[https://marquettedentistry.com/services/rehabilititative-treatment/natural-looking-dentures-in-katy-tx/]|5|1|-4|DOWN|BNG
Natural Looking Dentures In Katy, TX|[https://marquettedentistry.com/services/rehabilititative-treatment/natural-looking-dentures-in-katy-tx/]|4|1|-3|DOWN|BNG
natural looking dentures in pearland tx|[https://marquettedentistry.com/services/rehabilititative-treatment/natural-look-dentures-pearland-tx/]|2|1|-1|DOWN|BNG
natural looking dentures katy|[https://marquettedentistry.com/services/rehabilititative-treatment/natural-looking-dentures-in-katy-tx/]|4|1|-3|DOWN|BNG
natural looking dentures pearland|[https://marquettedentistry.com/services/rehabilititative-treatment/natural-look-dentures-pearland-tx/]|3|2|-1|DOWN|BNG
natural looking dentures pearland texas|[https://marquettedentistry.com/services/rehabilititative-treatment/natural-look-dentures-pearland-tx/]|2|3|1|UP|BNG
natural looking dentures pearland tx|[https://marquettedentistry.com/services/rehabilititative-treatment/natural-look-dentures-pearland-tx/]|2|1|-1|DOWN|BNG
natural looking dentures sugarland tx|[https://marquettedentistry.com/services/rehabilititative-treatment/natural-looking-dentures-in-sugarland-tx/]|3|2|-1|DOWN|BNG
no credit check dental financing houston|[https://marquettedentistry.com/financing/bad-credit-dental-financing-in-houston-tx/]|14|20|6|UP|BNG
one day denture repair houston|[https://marquettedentistry.com/[*BiB*]]|5|0|21|NEW|BNG
one hour denture repair houston|[https://marquettedentistry.com/services/rehabilititative-treatment/denture-repair-houston/]|18|0|8|NEW|BNG
pearland clearcorrect aligners|[https://marquettedentistry.com/services/clear-correct/clearcorrect-aligners-in-pearland-tx/]|2|2|0|EQ|BNG
pearland dental financing|[https://marquettedentistry.com/financing/bad-credit-dental-financing-in-pearland-tx/]|16|18|2|UP|BNG
pearland in house financing dentist|[https://marquettedentistry.com/financing/bad-credit-dental-financing-in-pearland-tx/]|10|8|-2|DOWN|BNG
pearland lumineers|[https://marquettedentistry.com/services/lumineers-in-pearland-tx/]|2|0|24|NEW|BNG
pearland tx clearcorrect aligners|[https://marquettedentistry.com/services/clear-correct/clearcorrect-aligners-in-pearland-tx/]|2|2|0|EQ|BNG
porcelain fillings houston|[https://marquettedentistry.com/services/improve-your-smile/porcelain-fillings-houston/]|4|3|-1|DOWN|BNG
