blepharoplasty complications photos|[https://plasticeyesurgery.com/before-after-photos/lower-blepharoplasty-photos/]|10|13|3|UP|BNG
cosmetic eye surgery harris county|[http://www.plasticeyesurgery.com/[*BiB*]]|5|1|-4|DOWN|BNG
cosmetic eye surgery specialist woodlands|[http://www.plasticeyesurgery.com/[*BiB*]]|1|0|25|NEW|BNG
cosmetic eye surgery woodlands|[http://www.plasticeyesurgery.com/[*BiB*]]|1|1|0|EQ|BNG
destin fl best plastic surgeon|[https://plasticeyesurgery.com/cosmetic-procedures/destin-fl-best-plastic-surgeon/]|12|12|0|EQ|BNG
destin fl blepharoplasty|[http://www.plasticeyesurgery.com/[*BiB*]]|1|3|2|UP|BNG
destin fl botox injection|[https://plasticeyesurgery.com/cosmetic-procedures/destin-fl-botox-injection/]|2|4|2|UP|BNG
destin fl cosmetic eye surgery|[http://www.plasticeyesurgery.com/[*BiB*]]|1|1|0|EQ|BNG
destin fl cosmetic surgery near me|[http://www.plasticeyesurgery.com/[*BiB*]]|4|4|0|EQ|BNG
destin fl eye plastic surgery|[http://www.plasticeyesurgery.com/[*BiB*]]|2|2|0|EQ|BNG
destin fl oculoplastic surgeon|[https://plasticeyesurgery.com/cosmetic-procedures/destin-fl-oculoplastic-surgeon/]|1|1|0|EQ|BNG
destin florida droopy eyelid surgery|[http://www.plasticeyesurgery.com/[*BiB*]]|1|1|0|EQ|BNG
destin florida eye bag removal|[https://plasticeyesurgery.com/cosmetic-procedures/destin-florida-eye-bag-removal/]|2|2|0|EQ|BNG
destin florida eye bag surgery|[https://plasticeyesurgery.com/cosmetic-procedures/destin-florida-eye-bag-surgery/]|2|1|-1|DOWN|BNG
destin florida eye lift|[https://plasticeyesurgery.com/cosmetic-procedures/destin-florida-eye-bag-surgery/]|2|2|0|EQ|BNG
destin florida eyelid surgery|[http://www.plasticeyesurgery.com/[*BiB*]]|1|1|0|EQ|BNG
destin florida oculoplastic|[http://www.plasticeyesurgery.com/[*BiB*]]|1|1|0|EQ|BNG
destin florida oculoplastic surgeon near me|[http://www.plasticeyesurgery.com/[*BiB*]]|1|1|0|EQ|BNG
destin florida ptosis surgery|[http://www.plasticeyesurgery.com/[*BiB*]]|1|2|1|UP|BNG
destin florida under eye filler|[https://plasticeyesurgery.com/cosmetic-procedures/destin-florida-under-eye-filler/]|1|2|1|UP|BNG
eye lift the woodlands tx|[http://www.plasticeyesurgery.com/[*BiB*]]|2|7|5|UP|BNG
eye plastic surgery woodlands texas|[http://www.plasticeyesurgery.com/[*BiB*]]|1|1|0|EQ|BNG
eyelid droop repair miami|[https://plasticeyesurgery.com/cosmetic-procedures/droopy-eyelid/]|19|0|7|NEW|BNG
eyelid surgery destin florida|[http://www.plasticeyesurgery.com/[*BiB*]]|1|1|0|EQ|BNG
eyelid surgery houston|[http://www.plasticeyesurgery.com/[*BiB*]]|1|5|4|UP|BNG
eyelid surgery pensacola fl|[http://www.plasticeyesurgery.com/[*BiB*]]|4|2|-2|DOWN|BNG
eyelid surgery sugar land tx|[https://plasticeyesurgery.com/cosmetic-procedures/lower-eyelid-lift/sugar-land-tx-eyelid-surgery/]|5|3|-2|DOWN|BNG
florida oculoplastic surgeon|[http://plasticeyesurgery.com[*BiB*]]|5|12|7|UP|BNG
florida ptosis surgery|[https://plasticeyesurgery.com/cosmetic-procedures/destin-florida-ptosis-surgery/]|9|4|-5|DOWN|BNG
florida ptosis surgery specialist|[https://plasticeyesurgery.com/cosmetic-procedures/destin-florida-ptosis-surgery/]|6|0|20|NEW|BNG
florida specialist oculoplastic surgeon|[https://plasticeyesurgery.com/about-us/pensacola-florida-oculoplastic-surgeon/]|15|0|11|NEW|BNG
houston graves disease eyes surgeon|[https://plasticeyesurgery.com/cosmetic-procedures/houston-texas-graves-disease-eyes/]|1|1|0|EQ|BNG
houston texas botox injection|[https://plasticeyesurgery.com/cosmetic-procedures/houston-texas-botox-injection/]|10|0|16|NEW|BNG
houston texas cosmetic surgery near me|[https://plasticeyesurgery.com/cosmetic-procedures/houston-texas-cosmetic-surgery-near-me/]|5|0|21|NEW|BNG
houston texas droopy eyelid surgery|[http://www.plasticeyesurgery.com/[*BiB*]]|2|3|1|UP|BNG
houston texas eyelid surgery|[http://www.plasticeyesurgery.com/[*BiB*]]|1|1|0|EQ|BNG
houston texas graves disease eyes|[https://plasticeyesurgery.com/cosmetic-procedures/houston-texas-graves-disease-eyes/]|1|2|1|UP|BNG
houston texas oculoplastic surgeon near me|[http://www.plasticeyesurgery.com/[*BiB*]]|2|2|0|EQ|BNG
houston texas ptosis surgery|[https://plasticeyesurgery.com/cosmetic-procedures/houston-texas-ptosis-surgery/]|6|7|1|UP|BNG
houston thyroid eye disease treatment|[http://www.plasticeyesurgery.com/[*BiB*]]|2|3|1|UP|BNG
houston tx blepharoplasty|[https://plasticeyesurgery.com/cosmetic-procedures/blepharoplasty/]|25|0|1|NEW|BNG
houston tx cosmetic eye surgery|[http://www.plasticeyesurgery.com/[*BiB*]]|1|1|0|EQ|BNG
houston tx eye bag removal|[https://plasticeyesurgery.com/cosmetic-procedures/blepharoplasty/]|13|0|13|NEW|BNG
houston tx eye bag surgery|[http://www.plasticeyesurgery.com/[*BiB*]]|4|2|-2|DOWN|BNG
houston tx eye lift|[https://plasticeyesurgery.com/locations/houston/]|15|0|11|NEW|BNG
houston tx eye plastic surgery|[http://www.plasticeyesurgery.com/[*BiB*]]|1|1|0|EQ|BNG
houston tx oculoplastic|[http://www.plasticeyesurgery.com/[*BiB*]]|2|3|1|UP|BNG
houston tx oculoplastic surgeon|[http://www.plasticeyesurgery.com/[*BiB*]]|2|2|0|EQ|BNG
Houston TX Thyroid Eye Disease Treatment|[http://plasticeyesurgery.com[*BiB*]]|1|3|2|UP|BNG
houston tx under eye filler|[http://www.plasticeyesurgery.com/[*BiB*]]|2|4|2|UP|BNG
male blepharoplasty|[https://plasticeyesurgery.com/before-after-photos/male-blepharoplasty-before-and-after/]|19|28|9|UP|BNG
oculoplastic harris county|[http://www.plasticeyesurgery.com/[*BiB*]]|2|0|24|NEW|BNG
oculoplastic surgeon harris county|[http://www.plasticeyesurgery.com/[*BiB*]]|2|3|1|UP|BNG
oculoplastic surgeon near me harris county|[http://www.plasticeyesurgery.com/[*BiB*]]|3|3|0|EQ|BNG
oculoplastic surgeon specialist texas|[http://www.plasticeyesurgery.com/[*BiB*]]|3|0|23|NEW|BNG
oculoplastic surgeon texas|[https://plasticeyesurgery.com/reconstructive-procedures/the-woodlands-tx-oculoplastic-surgeon/]|21|17|-4|DOWN|BNG
ophthalmic plastic surgeon houston tx|[http://www.plasticeyesurgery.com/[*BiB*]]|2|2|0|EQ|BNG
pensacola eye bag removal|[https://plasticeyesurgery.com/cosmetic-procedures/pensacola-fl-eye-bag-removal/]|1|1|0|EQ|BNG
pensacola fl best plastic surgeon|[https://plasticeyesurgery.com/about-us/pensacola-fl-best-plastic-surgeon/]|12|7|-5|DOWN|BNG
pensacola fl droopy eyelid surgery|[http://www.plasticeyesurgery.com/[*BiB*]]|1|1|0|EQ|BNG
pensacola fl eye bag removal|[http://www.plasticeyesurgery.com/[*BiB*]]|1|1|0|EQ|BNG
pensacola fl eye bag surgery|[https://plasticeyesurgery.com/cosmetic-procedures/pensacola-fl-eye-bag-removal/]|1|1|0|EQ|BNG
pensacola fl eye lift|[http://www.plasticeyesurgery.com/[*BiB*]]|1|1|0|EQ|BNG
pensacola fl eyelid surgery|[http://www.plasticeyesurgery.com/[*BiB*]]|1|1|0|EQ|BNG
pensacola fl ptosis surgery|[http://www.plasticeyesurgery.com/[*BiB*]]|1|2|1|UP|BNG
pensacola fl under eye filler|[https://plasticeyesurgery.com/injectables/pensacola-fl-under-eye-filler/]|1|3|2|UP|BNG
pensacola florida blepharoplasty|[https://plasticeyesurgery.com/cosmetic-procedures/blepharoplasty/pensacola-florida-blepharoplasty/]|4|3|-1|DOWN|BNG
pensacola florida botox injection|[https://plasticeyesurgery.com/cosmetic-procedures/pensacola-florida-botox-injection/]|10|7|-3|DOWN|BNG
pensacola florida cosmetic eye surgery|[http://www.plasticeyesurgery.com/[*BiB*]]|3|4|1|UP|BNG
pensacola florida eye bag removal|[http://www.plasticeyesurgery.com/[*BiB*]]|1|0|25|NEW|BNG
pensacola florida eye bag removal surgeon|[http://www.plasticeyesurgery.com/[*BiB*]]|1|0|25|NEW|BNG
pensacola florida eye plastic surgery|[http://www.plasticeyesurgery.com/[*BiB*]]|3|1|-2|DOWN|BNG
pensacola florida oculoplastic|[https://plasticeyesurgery.com/about-us/pensacola-florida-oculoplastic-surgeon/]|1|3|2|UP|BNG
pensacola florida oculoplastic surgeon|[https://plasticeyesurgery.com/about-us/pensacola-florida-oculoplastic-surgeon/]|1|1|0|EQ|BNG
pensacola florida oculoplastic surgeon near me|[https://plasticeyesurgery.com/about-us/pensacola-florida-oculoplastic-surgeon-near-me/]|1|1|0|EQ|BNG
spring texas oculoplastic|[https://plasticeyesurgery.com/locations/houston/]|12|17|5|UP|BNG
sugar land texas best plastic surgeon|[http://plasticeyesurgery.com[*BiB*]]|3|2|-1|DOWN|BNG
sugar land texas cosmetic eye surgery|[https://plasticeyesurgery.com/about-us/sugar-land-texas-best-plastic-surgeon/]|3|2|-1|DOWN|BNG
sugar land texas eye bag surgery|[https://plasticeyesurgery.com/cosmetic-procedures/sugar-land-texas-eye-bag-surgery/]|2|2|0|EQ|BNG
sugar land texas eye lift|[http://www.plasticeyesurgery.com/[*BiB*]]|3|2|-1|DOWN|BNG
sugar land texas eye plastic surgery|[https://plasticeyesurgery.com/about-us/sugar-land-texas-best-plastic-surgeon/]|2|2|0|EQ|BNG
sugar land texas oculoplastic|[https://plasticeyesurgery.com/contact-us/sugar-land-texas-oculoplastic/]|1|1|0|EQ|BNG
sugar land texas oculoplastic surgeon|[https://plasticeyesurgery.com/cosmetic-procedures/sugar-land-texas-oculoplastic-surgeon/]|1|1|0|EQ|BNG
sugar land texas oculoplastic surgeon near me|[https://plasticeyesurgery.com/cosmetic-procedures/upper-eyelid-lift/sugar-land-texas-eye-lift/]|2|2|0|EQ|BNG
sugar land thyroid eye disease treatment|[https://plasticeyesurgery.com/cosmetic-procedures/blepharoplasty/sugar-land-tx-graves-disease-eyes/]|3|1|-2|DOWN|BNG
sugar land tx blepharoplasty|[http://www.plasticeyesurgery.com/[*BiB*]]|1|16|15|UP|BNG
sugar land tx botox injection|[https://plasticeyesurgery.com/injectables/botox/sugar-land-tx-botox-injection/]|3|0|23|NEW|BNG
sugar land tx cosmetic surgery near me|[https://plasticeyesurgery.com/cosmetic-procedures/sugar-land-tx-cosmetic-surgery-near-me/]|4|2|-2|DOWN|BNG
sugar land tx droopy eyelid surgery|[https://plasticeyesurgery.com/cosmetic-procedures/droopy-eyelid/sugar-land-tx-ptosis-surgery/]|1|2|1|UP|BNG
sugar land tx eye bag removal|[https://plasticeyesurgery.com/cosmetic-procedures/sugar-land-tx-eye-bag-removal/]|1|1|0|EQ|BNG
sugar land tx eyelid surgery|[http://plasticeyesurgery.com[*BiB*]]|1|2|1|UP|BNG
sugar land tx graves disease eyes|[https://plasticeyesurgery.com/cosmetic-procedures/blepharoplasty/sugar-land-tx-graves-disease-eyes/]|1|1|0|EQ|BNG
sugar land tx ptosis surgery|[https://plasticeyesurgery.com/cosmetic-procedures/droopy-eyelid/sugar-land-tx-ptosis-surgery/]|2|2|0|EQ|BNG
Sugar Land TX Thyroid Eye Disease Treatment|[https://plasticeyesurgery.com/cosmetic-procedures/blepharoplasty/sugar-land-tx-graves-disease-eyes/]|2|2|0|EQ|BNG
sugar land tx under eye filler|[https://plasticeyesurgery.com/cosmetic-procedures/sugar-land-tx-under-eye-filler/]|2|4|2|UP|BNG
texas graves disease eyes|[https://plasticeyesurgery.com/cosmetic-procedures/houston-texas-graves-disease-eyes/]|1|1|0|EQ|BNG
the woodlands texas best plastic surgeon|[https://plasticeyesurgery.com/cosmetic-procedures/the-woodlands-texas-best-plastic-surgeon/]|4|4|0|EQ|BNG
the woodlands texas cosmetic surgery near me|[https://plasticeyesurgery.com/about-us/the-woodlands-texas-cosmetic-surgery-near-me/]|3|5|2|UP|BNG
the woodlands texas droopy eyelid surgery|[https://plasticeyesurgery.com/cosmetic-procedures/droopy-eyelid/the-woodlands-texas-droopy-eyelid-surgery/]|3|1|-2|DOWN|BNG
the woodlands texas eye bag removal|[https://plasticeyesurgery.com/cosmetic-procedures/the-woodlands-texas-eye-bag-removal/]|1|6|5|UP|BNG
the woodlands texas eyelid surgery|[http://www.plasticeyesurgery.com/[*BiB*]]|1|1|0|EQ|BNG
the woodlands texas ptosis surgery|[http://www.plasticeyesurgery.com/[*BiB*]]|1|1|0|EQ|BNG
the woodlands thyroid eye disease treatment|[https://plasticeyesurgery.com/houston-tx-thyroid-eye-disease-treatment/]|1|1|0|EQ|BNG
the woodlands tx blepharoplasty|[http://www.plasticeyesurgery.com/[*BiB*]]|3|4|1|UP|BNG
the woodlands tx botox injection|[https://plasticeyesurgery.com/cosmetic-procedures/the-woodlands-tx-botox-injection/]|3|8|5|UP|BNG
the woodlands tx cosmetic eye surgery|[http://www.plasticeyesurgery.com/[*BiB*]]|1|1|0|EQ|BNG
the woodlands tx eye bag surgery|[http://www.plasticeyesurgery.com/[*BiB*]]|4|10|6|UP|BNG
the woodlands tx eye lift|[http://www.plasticeyesurgery.com/[*BiB*]]|3|2|-1|DOWN|BNG
the woodlands tx eye plastic surgery|[http://www.plasticeyesurgery.com/[*BiB*]]|1|1|0|EQ|BNG
the woodlands tx graves disease eyes|[https://plasticeyesurgery.com/cosmetic-procedures/the-woodlands-tx-graves-disease-eyes/]|1|1|0|EQ|BNG
the woodlands tx oculoplastic|[http://www.plasticeyesurgery.com/[*BiB*]]|1|1|0|EQ|BNG
the woodlands tx oculoplastic surgeon|[http://www.plasticeyesurgery.com/[*BiB*]]|1|1|0|EQ|BNG
the woodlands tx oculoplastic surgeon near me|[http://www.plasticeyesurgery.com/[*BiB*]]|1|1|0|EQ|BNG
the woodlands tx specialist eye plastic surgery|[http://www.plasticeyesurgery.com/[*BiB*]]|1|0|25|NEW|BNG
The Woodlands TX Thyroid Eye Disease Treatment|[https://plasticeyesurgery.com/cosmetic-procedures/the-woodlands-tx-graves-disease-eyes/]|1|1|0|EQ|BNG
the woodlands tx under eye filler|[https://plasticeyesurgery.com/cosmetic-procedures/the-woodlands-tx-under-eye-filler/]|2|1|-1|DOWN|BNG
Thyroid Eye Disease Treatment Houston TX|[http://plasticeyesurgery.com[*BiB*]]|1|2|1|UP|BNG
Thyroid Eye Disease Treatment Sugar Land TX|[https://plasticeyesurgery.com/cosmetic-procedures/blepharoplasty/sugar-land-tx-graves-disease-eyes/]|2|1|-1|DOWN|BNG
Thyroid Eye Disease Treatment Woodlands TX|[http://plasticeyesurgery.com[*BiB*]]|1|1|0|EQ|BNG
woodlands eye bag surgery|[https://plasticeyesurgery.com/cosmetic-procedures/the-woodlands-texas-eye-bag-removal/]|1|3|2|UP|BNG
woodlands ptosis surgeon specialist|[https://plasticeyesurgery.com/cosmetic-procedures/the-woodlands-texas-ptosis-surgery/]|1|0|25|NEW|BNG
woodlands texas eye bag removal|[https://plasticeyesurgery.com/cosmetic-procedures/the-woodlands-texas-eye-bag-removal/]|1|0|25|NEW|BNG
woodlands texas eye lift|[https://plasticeyesurgery.com/cosmetic-procedures/upper-eyelid-lift/the-woodlands-tx-eye-lift/]|2|1|-1|DOWN|BNG
woodlands texas eye plastic surgery|[http://www.plasticeyesurgery.com/[*BiB*]]|1|1|0|EQ|BNG
woodlands tx eye bag removal|[http://www.plasticeyesurgery.com/[*BiB*]]|1|10|9|UP|BNG
woodlands tx eye bag surgery|[https://plasticeyesurgery.com/cosmetic-procedures/blepharoplasty/the-woodlands-tx-blepharoplasty/]|6|4|-2|DOWN|BNG
woodlands tx eye lift|[http://www.plasticeyesurgery.com/[*BiB*]]|2|1|-1|DOWN|BNG
