5 star kennel maplewood south|[https://www.fondren5starpetresort.com/]|1|1|0|EQ|GOM
5 star kennels maplewood south|[https://www.fondren5starpetresort.com/dog-boarding/maplewood-south-dog-boarding/]|1|1|0|EQ|GOM
5 star pet grooming stafford tx|[https://www.fondren5starpetresort.com/stafford-tx-cat-boarding-near-me/]|3|1|-2|DOWN|GOM
all star pet resort houston|[https://www.fondren5starpetresort.com/]|1|1|0|EQ|GOM
animal charities in houston|[https://www.fondren5starpetresort.com/houstons-top-pet-charities/]|3|3|0|EQ|GOM
animal daycare near sugar land|[https://www.fondren5starpetresort.com/dog-daycare/sugarland-doggy-day-care-near-me/[*GMB*]]|6|5|-1|DOWN|GOM
bandade animal rescue|[https://www.fondren5starpetresort.com/houstons-top-pet-charities/]|22|19|-3|DOWN|GOM
benefit dog training stafford|[https://www.fondren5starpetresort.com/dog-training/stafford-dog-training-near-me/]|4|4|0|EQ|GOM
benefits dog training stafford|[https://www.fondren5starpetresort.com/dog-training/stafford-dog-training-near-me/]|4|5|1|UP|GOM
bird boarding houston|[https://www.fondren5starpetresort.com/avian-pocket-pets/]|6|5|-1|DOWN|GOM
cat boarding houston|[https://www.fondren5starpetresort.com/cat-boarding/]|10|11|1|UP|GOM
cat boarding houston tx|[https://www.fondren5starpetresort.com/cat-boarding/]|13|11|-2|DOWN|GOM
cat boarding in pearland tx|[https://www.fondren5starpetresort.com/pearland-tx-animal-hotel/[*GMB*]]|5|6|1|UP|GOM
cat boarding sugar land|[https://www.fondren5starpetresort.com/cat-boarding/]|5|5|0|EQ|GOM
cat daycare houston|[https://www.fondren5starpetresort.com/cat-boarding/]|10|10|0|EQ|GOM
cat hotel houston|[https://www.fondren5starpetresort.com/cat-boarding/]|10|10|0|EQ|GOM
cat lodging houston tx|[https://www.fondren5starpetresort.com/cat-boarding/]|14|14|0|EQ|GOM
cat lodging houston, tx|[https://www.fondren5starpetresort.com/cat-boarding/]|14|13|-1|DOWN|GOM
cat lodging pearland tx|[https://www.fondren5starpetresort.com/pet-grooming/pearland-tx-animal-boarding/[*GMB*]]|7|9|2|UP|GOM
cheap cat boarding houston|[https://www.fondren5starpetresort.com/cat-boarding/]|13|12|-1|DOWN|GOM
dog barn hunt training sugar land tx|[https://www.fondren5starpetresort.com/barn-hunt-the-new-dog-sport/]|25|0|1|NEW|GOM
dog boarding missouri city|[https://www.fondren5starpetresort.com/[*GMB*]]|2|3|1|UP|GOM
dog boarding missouri city tx|[https://www.fondren5starpetresort.com/[*GMB*]]|2|2|0|EQ|GOM
dog boarding prices missouri city tx|[https://www.fondren5starpetresort.com/[*GMB*]]|2|3|1|UP|GOM
dog boarding ranch sienna plantation|[https://www.fondren5starpetresort.com/dog-boarding/sienna-plantation-dog-boarding/]|12|11|-1|DOWN|GOM
dog boarding sugar land|[https://www.fondren5starpetresort.com/dog-boarding/]|8|8|0|EQ|GOM
dog boarding sugar land tx|[https://www.fondren5starpetresort.com/dog-boarding/]|8|9|1|UP|GOM
dog day care pearland|[https://www.fondren5starpetresort.com/dog-daycare/pearland-doggy-day-care/]|17|14|-3|DOWN|GOM
dog daycare sugar land|[https://www.fondren5starpetresort.com/dog-boarding/]|12|14|2|UP|GOM
dog friendly places near sugar land tx|[https://www.fondren5starpetresort.com/dog-friendly-eateries-in-sw-houston-sugar-land/]|9|10|1|UP|GOM
dog friendly restaurants sugar land|[https://www.fondren5starpetresort.com/dog-friendly-eateries-in-sw-houston-sugar-land/]|9|8|-1|DOWN|GOM
dog groomer near stafford tx|[https://www.fondren5starpetresort.com/dog-boarding/stafford-tx-dog-boarding-kennels-near-me/]|24|0|2|NEW|GOM
dog groomers near missouri city|[https://www.fondren5starpetresort.com/pet-grooming/]|24|18|-6|DOWN|GOM
dog grooming missouri city|[https://www.fondren5starpetresort.com/pet-grooming/]|22|19|-3|DOWN|GOM
dog grooming questions and answers tx|[https://www.fondren5starpetresort.com/5-pet-grooming-questions/]|21|3|-18|DOWN|GOM
dog grooming questions pearland|[https://www.fondren5starpetresort.com/5-pet-grooming-questions/]|9|10|1|UP|GOM
dog grooming sienna plantation tx|[https://www.fondren5starpetresort.com/location/sienna-plantation-tx-pet-boarding/]|20|20|0|EQ|GOM
dog hotels sugar land|[https://www.fondren5starpetresort.com/dog-boarding/]|14|14|0|EQ|GOM
dog kennel pearland tx|[https://www.fondren5starpetresort.com/pet-grooming/pearland-tx-animal-boarding/]|25|24|-1|DOWN|GOM
dog kennels and boarding pearland|[https://www.fondren5starpetresort.com/dog-daycare/pearland-dog-kennels-near-me/]|15|16|1|UP|GOM
dog kennels sugar land tx|[https://www.fondren5starpetresort.com/location/sugar-land-tx-pet-boarding/sugar-land-tx-animal-boarding/[*GMB*]]|2|1|-1|DOWN|GOM
dog nail trimming services houston|[https://www.fondren5starpetresort.com/pet-grooming/]|19|27|8|UP|GOM
dog resort houston|[https://www.fondren5starpetresort.com/]|14|16|2|UP|GOM
dog sitting sugar land|[https://www.fondren5starpetresort.com/dog-boarding/]|22|23|1|UP|GOM
dog training in sugar land tx|[https://www.fondren5starpetresort.com/dog-training/]|17|16|-1|DOWN|GOM
dog training near stafford tx|[https://www.fondren5starpetresort.com/location/stafford-tx-pet-boarding/stafford-tx-animal-boarding/]|15|13|-2|DOWN|GOM
dog training pearland|[https://www.fondren5starpetresort.com/dog-training/pearland-dog-training-near-me/]|18|17|-1|DOWN|GOM
dog training stafford|[https://www.fondren5starpetresort.com/dog-training/stafford-dog-training-near-me/]|14|6|-8|DOWN|GOM
dog training sugar land|[https://www.fondren5starpetresort.com/dog-training/]|17|17|0|EQ|GOM
dog training sugar land texas|[https://www.fondren5starpetresort.com/dog-training/]|16|15|-1|DOWN|GOM
dog training sugar land tx|[https://www.fondren5starpetresort.com/dog-training/]|17|15|-2|DOWN|GOM
doggie boarding southwest houston|[https://www.fondren5starpetresort.com/[*GMB*]]|1|1|0|EQ|GOM
doggie boarding sw houston|[https://www.fondren5starpetresort.com/[*GMB*]]|1|1|0|EQ|GOM
doggie hotels stafford tx|[https://www.fondren5starpetresort.com/dog-boarding/stafford-tx-dog-boarding-kennels-near-me/]|14|9|-5|DOWN|GOM
doggie hotels sugar land tx|[https://www.fondren5starpetresort.com/dog-boarding/]|9|8|-1|DOWN|GOM
doggy day care pearland|[https://www.fondren5starpetresort.com/dog-daycare/pearland-doggy-day-care/]|19|12|-7|DOWN|GOM
doggy day care sugar land|[https://www.fondren5starpetresort.com/dog-daycare/sugar-land-doggy-day-care/]|13|11|-2|DOWN|GOM
doggy daycare sienna plantation|[https://www.fondren5starpetresort.com/dog-daycare/sienna-plantation-doggy-day-care/]|5|7|2|UP|GOM
exceptional pet boarding sugar land|[https://www.fondren5starpetresort.com/dog-boarding/]|3|1|-2|DOWN|GOM
five star boarding kennels|[https://www.fondren5starpetresort.com/]|6|2|-4|DOWN|GOM
five star boarding kennels sugar land|[https://www.fondren5starpetresort.com/[*GMB*]]|2|1|-1|DOWN|GOM
five star boarding missouri city tx|[https://www.fondren5starpetresort.com/]|1|1|0|EQ|GOM
five star boarding sugar land|[https://www.fondren5starpetresort.com/[*GMB*]]|2|2|0|EQ|GOM
five star dog grooming houston|[https://www.fondren5starpetresort.com/]|1|2|1|UP|GOM
five star dog kennels houston|[https://www.fondren5starpetresort.com/[*GMB*]]|1|1|0|EQ|GOM
five star dog resort houston|[https://www.fondren5starpetresort.com/]|1|1|0|EQ|GOM
five star dog resort sugar land|[https://www.fondren5starpetresort.com/dog-boarding/]|1|1|0|EQ|GOM
five star pet boarding houston|[https://www.fondren5starpetresort.com/[*GMB*]]|1|1|0|EQ|GOM
five star pet boarding meyerland tx|[https://www.fondren5starpetresort.com/[*GMB*]]|1|1|0|EQ|GOM
five star pet boarding missouri city tx|[https://www.fondren5starpetresort.com/[*GMB*]]|1|1|0|EQ|GOM
five star pet boarding stafford tx|[https://www.fondren5starpetresort.com/[*GMB*]]|1|1|0|EQ|GOM
five star pet grooming houston|[https://www.fondren5starpetresort.com/pet-grooming/]|1|3|2|UP|GOM
five star pet grooming sugar land|[https://www.fondren5starpetresort.com/pet-grooming/]|4|4|0|EQ|GOM
five star pet resort sugar land|[https://www.fondren5starpetresort.com/dog-boarding/]|1|1|0|EQ|GOM
fondren5starpetresort.com|[https://www.fondren5starpetresort.com/]|1|1|0|EQ|GOM
gold star pet resort houston|[https://www.fondren5starpetresort.com/]|5|4|-1|DOWN|GOM
gold star pet resort sugar land|[https://www.fondren5starpetresort.com/]|4|3|-1|DOWN|GOM
grooming and boarding southwest houston|[https://www.fondren5starpetresort.com/[*GMB*]]|1|1|0|EQ|GOM
guinea pig boarding pearland|[https://www.fondren5starpetresort.com/avian-pocket-pets/]|5|6|1|UP|GOM
hamster boarding near houston|[https://www.fondren5starpetresort.com/avian-pocket-pets/]|3|3|0|EQ|GOM
home boarding for dogs southwest houston|[https://www.fondren5starpetresort.com/[*GMB*]]|1|1|0|EQ|GOM
houston angel eyes grooming|[https://www.fondren5starpetresort.com/blog/page/10/]|12|13|1|UP|GOM
houston animal organizations|[https://www.fondren5starpetresort.com/houstons-top-pet-charities/]|11|0|15|NEW|GOM
houston cat boarding|[https://www.fondren5starpetresort.com/cat-boarding/]|10|0|16|NEW|GOM
houston fishing dog breeds|[https://www.fondren5starpetresort.com/top-ten-popular-dog-breeds/]|1|1|0|EQ|GOM
houston five star kennels|[https://www.fondren5starpetresort.com/]|1|1|0|EQ|GOM
houston five star pet boarding|[https://www.fondren5starpetresort.com/]|1|1|0|EQ|GOM
houston five star pet resort|[https://www.fondren5starpetresort.com/]|1|1|0|EQ|GOM
houston hamster boarding|[https://www.fondren5starpetresort.com/avian-pocket-pets/]|3|3|0|EQ|GOM
houston luxury pet hotels|[https://www.fondren5starpetresort.com/]|17|23|6|UP|GOM
houston pet resort|[https://www.fondren5starpetresort.com/]|18|16|-2|DOWN|GOM
houston star kennels|[https://www.fondren5starpetresort.com/[*GMB*]]|1|1|0|EQ|GOM
houston star pet grooming|[https://www.fondren5starpetresort.com/pet-grooming/]|3|3|0|EQ|GOM
kennel near missouri city|[https://www.fondren5starpetresort.com/[*GMB*]]|2|2|0|EQ|GOM
kennels for dog stafford tx|[https://www.fondren5starpetresort.com/dog-boarding/stafford-tx-dog-boarding-kennels-near-me/]|2|3|1|UP|GOM
kennels for dogs stafford tx|[https://www.fondren5starpetresort.com/dog-boarding/stafford-tx-dog-boarding-kennels-near-me/[*GMB*]]|1|2|1|UP|GOM
kennels in pearland|[https://www.fondren5starpetresort.com/dog-daycare/pearland-dog-kennels-near-me/]|15|13|-2|DOWN|GOM
kitty daycare missouri city|[https://www.fondren5starpetresort.com/]|8|3|-5|DOWN|GOM
lodge and learn dog training houston|[https://www.fondren5starpetresort.com/dog-training/]|13|17|4|UP|GOM
luxury dog boarding missouri city|[https://www.fondren5starpetresort.com/[*GMB*]]|2|2|0|EQ|GOM
luxury pet hotel pearland|[https://www.fondren5starpetresort.com/pet-grooming/pearland-tx-animal-boarding/[*GMB*]]|7|13|6|UP|GOM
luxury pet resort pearland tx|[https://www.fondren5starpetresort.com/[*GMB*]]|2|2|0|EQ|GOM
maplewood south dog nail grooming|[https://www.fondren5starpetresort.com/]|6|5|-1|DOWN|GOM
maplewood south pet resort|[https://www.fondren5starpetresort.com/[*GMB*]]|2|1|-1|DOWN|GOM
meyerland cat boarding|[https://www.fondren5starpetresort.com/pet-grooming/meyerland-pet-grooming-near-me/]|21|12|-9|DOWN|GOM
meyerland pet resort|[https://www.fondren5starpetresort.com/dog-daycare/meyerland-doggy-day-care/]|11|3|-8|DOWN|GOM
missouri city cheap pet grooming|[https://www.fondren5starpetresort.com/pet-grooming/]|21|16|-5|DOWN|GOM
missouri city luxury dog daycare|[https://www.fondren5starpetresort.com/[*GMB*]]|1|1|0|EQ|GOM
most biddable dog breeds|[https://www.fondren5starpetresort.com/top-ten-popular-dog-breeds/]|24|21|-3|DOWN|GOM
pearland dog kennel|[https://www.fondren5starpetresort.com/dog-daycare/pearland-dog-kennels-near-me/]|23|24|1|UP|GOM
pearland pet resort|[https://www.fondren5starpetresort.com/location/pearland-tx-pet-boarding/pearland-pet-hotel/]|14|14|0|EQ|GOM
pearland tx pet resort|[https://www.fondren5starpetresort.com/pet-grooming/pearland-tx-animal-boarding/]|12|11|-1|DOWN|GOM
pet boarding missouri city|[https://www.fondren5starpetresort.com/[*GMB*]]|1|2|1|UP|GOM
pet boarding missouri city tx|[https://www.fondren5starpetresort.com/[*GMB*]]|1|3|2|UP|GOM
pet boarding sienna plantation|[https://www.fondren5starpetresort.com/dog-boarding/sienna-plantation-dog-boarding/]|6|5|-1|DOWN|GOM
pet boarding stafford tx|[https://www.fondren5starpetresort.com/dog-boarding/stafford-tx-dog-boarding-kennels-near-me/]|5|4|-1|DOWN|GOM
pet boarding sugar land|[https://www.fondren5starpetresort.com/dog-boarding/]|6|8|2|UP|GOM
pet boarding westbury tx|[https://www.fondren5starpetresort.com/westbury-tx-kennels-near-me/]|5|6|1|UP|GOM
pet care essentials missouri city|[https://www.fondren5starpetresort.com/best-choices-pet-care-essentials/]|8|7|-1|DOWN|GOM
pet cat boarding near meyerland tx|[https://www.fondren5starpetresort.com/cat-boarding/]|15|0|11|NEW|GOM
pet cat boarding southwest houston|[https://www.fondren5starpetresort.com/south-west-houston-cat-boarding/]|2|2|0|EQ|GOM
pet daycare maplewood south|[https://www.fondren5starpetresort.com/[*GMB*]]|1|2|1|UP|GOM
pet daycare meyerland tx|[https://www.fondren5starpetresort.com/dog-daycare/meyerland-doggy-day-care/]|6|9|3|UP|GOM
pet friendly places near missouri city tx|[https://www.fondren5starpetresort.com/[*GMB*]]|2|0|24|NEW|GOM
pet grooming & boarding missouri city|[https://www.fondren5starpetresort.com/]|10|9|-1|DOWN|GOM
pet grooming southwest houston|[https://www.fondren5starpetresort.com/pet-grooming/south-west-houston-pet-grooming-near-me/]|11|10|-1|DOWN|GOM
pet grooming westbury tx|[https://www.fondren5starpetresort.com/westbury-tx-kennels-near-me/]|11|7|-4|DOWN|GOM
pet hotel maplewood south|[https://www.fondren5starpetresort.com/location/maplewood-south-tx-pet-boarding/maplewood-south-pet-hotel/]|1|1|0|EQ|GOM
pet hotel missouri city|[https://www.fondren5starpetresort.com/[*GMB*]]|1|2|1|UP|GOM
pet hotel sugar land|[https://www.fondren5starpetresort.com/sugar-land-pet-hotel/[*GMB*]]|5|10|5|UP|GOM
pet hotel sugar land tx|[https://www.fondren5starpetresort.com/dog-boarding/]|8|8|0|EQ|GOM
pet lodge near sienna plantation|[https://www.fondren5starpetresort.com/location/sienna-plantation-tx-pet-boarding/]|6|6|0|EQ|GOM
pet lodging houston|[https://www.fondren5starpetresort.com/]|19|18|-1|DOWN|GOM
pet resort houston|[https://www.fondren5starpetresort.com/]|17|19|2|UP|GOM
pet resort houston tx|[https://www.fondren5starpetresort.com/]|17|22|5|UP|GOM
pet resort maplewood south|[https://www.fondren5starpetresort.com/[*GMB*]]|2|2|0|EQ|GOM
pet resorts houston|[https://www.fondren5starpetresort.com/]|16|16|0|EQ|GOM
pet resorts near sugar land tx|[https://www.fondren5starpetresort.com/dog-boarding/]|5|5|0|EQ|GOM
pocket pet boarding houston|[https://www.fondren5starpetresort.com/[*GMB*]]|2|2|0|EQ|GOM
puppies daycare meyerland tx|[https://www.fondren5starpetresort.com/dog-daycare/meyerland-doggy-day-care/]|7|7|0|EQ|GOM
puppy group classes missouri city|[https://www.fondren5starpetresort.com/dog-training/]|5|4|-1|DOWN|GOM
sienna plantation exceptional pet boarding|[https://www.fondren5starpetresort.com/dog-boarding/sienna-plantation-boarding-kennels/]|7|7|0|EQ|GOM
sienna plantation small animal boarding|[https://www.fondren5starpetresort.com/location/sienna-plantation-tx-pet-boarding/]|6|17|11|UP|GOM
small animal boarding stafford tx|[https://www.fondren5starpetresort.com/location/sienna-plantation-tx-pet-boarding/]|25|4|-21|DOWN|GOM
small animal boarding westbury tx|[https://www.fondren5starpetresort.com/location/westbury-tx-pet-boarding/westbury-pet-hotel/]|4|4|0|EQ|GOM
southwest houston dog kennels|[https://www.fondren5starpetresort.com/[*GMB*]]|1|1|0|EQ|GOM
southwest houston pet boarding|[https://www.fondren5starpetresort.com/[*GMB*]]|1|1|0|EQ|GOM
southwest houston pet resort|[https://www.fondren5starpetresort.com/[*GMB*]]|1|1|0|EQ|GOM
southwest houston service dog training|[https://www.fondren5starpetresort.com/dog-training/]|5|6|1|UP|GOM
stafford luxury dog daycare|[https://www.fondren5starpetresort.com/[*GMB*]]|1|2|1|UP|GOM
stafford tx dog daycare and boarding|[https://www.fondren5starpetresort.com/dog-boarding/stafford-tx-dog-boarding-kennels-near-me/]|9|3|-6|DOWN|GOM
stafford tx dog grooming|[https://www.fondren5starpetresort.com/dog-boarding/stafford-tx-dog-boarding-kennels-near-me/]|15|16|1|UP|GOM
stafford tx pet resort|[https://www.fondren5starpetresort.com/[*GMB*]]|2|2|0|EQ|GOM
stafford tx pet resorts|[https://www.fondren5starpetresort.com/[*GMB*]]|2|1|-1|DOWN|GOM
star dog boarding houston|[https://www.fondren5starpetresort.com/[*GMB*]]|1|1|0|EQ|GOM
star kennels houston|[https://www.fondren5starpetresort.com/[*GMB*]]|1|1|0|EQ|GOM
star pet hotel sugar land|[https://www.fondren5starpetresort.com/cat-boarding/]|3|4|1|UP|GOM
sugar land boarding|[https://www.fondren5starpetresort.com/dog-boarding/]|7|9|2|UP|GOM
sugar land cheap pet grooming|[https://www.fondren5starpetresort.com/pet-grooming/]|23|16|-7|DOWN|GOM
sugar land five star kennel|[https://www.fondren5starpetresort.com/[*GMB*]]|1|1|0|EQ|GOM
sugar land grooming and boarding|[https://www.fondren5starpetresort.com/dog-boarding/]|9|14|5|UP|GOM
sugar land guinea pig hotel|[https://www.fondren5starpetresort.com/sugar-land-tx-resort/]|5|3|-2|DOWN|GOM
sugar land pet hotel for dogs|[https://www.fondren5starpetresort.com/dog-boarding/]|5|5|0|EQ|GOM
sugar land puppy land grooming|[https://www.fondren5starpetresort.com/pet-grooming/]|25|19|-6|DOWN|GOM
sugarland kennels|[https://www.fondren5starpetresort.com/dog-daycare/sugar-land-kennels-near-me/]|12|9|-3|DOWN|GOM
westbury pet grooming|[https://www.fondren5starpetresort.com/pet-grooming/westbury-pet-grooming-near-me/]|11|22|11|UP|GOM
westbury tx pet boarding|[https://www.fondren5starpetresort.com/[*GMB*]]|2|2|0|EQ|GOM
westbury tx pet hotel|[https://www.fondren5starpetresort.com/[*GMB*]]|2|2|0|EQ|GOM
