5 star kennel maplewood south|[https://www.fondren5starpetresort.com/dog-boarding/maplewood-south-dog-boarding/]|1|1|0|EQ|BNG
5 star kennels maplewood south|[https://www.fondren5starpetresort.com/]|8|1|-7|DOWN|BNG
5 star pet grooming stafford tx|[https://www.fondren5starpetresort.com/location/stafford-tx-pet-boarding/]|1|1|0|EQ|BNG
bandade animal rescue|[https://www.fondren5starpetresort.com/houstons-top-pet-charities/]|13|13|0|EQ|BNG
bird boarding houston|[https://www.fondren5starpetresort.com/avian-pocket-pets/]|13|14|1|UP|BNG
cat boarding houston|[https://www.fondren5starpetresort.com/cat-boarding/]|6|9|3|UP|BNG
cat boarding houston tx|[https://www.fondren5starpetresort.com/cat-boarding/]|18|0|8|NEW|BNG
cat boarding in pearland tx|[https://www.fondren5starpetresort.com/cat-boarding/pearland-cat-boarding-near-me/]|7|3|-4|DOWN|BNG
cat boarding sugar land|[https://www.fondren5starpetresort.com/cat-boarding/]|1|1|0|EQ|BNG
cat lodging houston, tx|[https://www.fondren5starpetresort.com/cat-boarding/]|11|11|0|EQ|BNG
cat lodging pearland tx|[https://www.fondren5starpetresort.com/pearland-pet-hotel/]|4|4|0|EQ|BNG
dog boarding missouri city|[https://www.fondren5starpetresort.com/]|9|23|14|UP|BNG
dog boarding missouri city tx|[https://www.fondren5starpetresort.com/]|17|9|-8|DOWN|BNG
dog boarding ranch sienna plantation|[https://www.fondren5starpetresort.com/location/sienna-plantation-tx-pet-boarding/]|1|1|0|EQ|BNG
dog boarding ranch sugar land|[https://www.fondren5starpetresort.com/dog-boarding/]|7|12|5|UP|BNG
dog boarding sugar land|[https://www.fondren5starpetresort.com/dog-boarding/]|4|8|4|UP|BNG
dog boarding sugar land tx|[https://www.fondren5starpetresort.com/dog-boarding/]|2|18|16|UP|BNG
dog day care pearland|[https://www.fondren5starpetresort.com/dog-daycare/pearland-doggy-day-care/]|4|4|0|EQ|BNG
dog daycare sugar land|[https://www.fondren5starpetresort.com/dog-daycare/]|6|17|11|UP|BNG
dog friendly places near sugar land tx|[https://www.fondren5starpetresort.com/dog-friendly-eateries-in-sw-houston-sugar-land/]|18|24|6|UP|BNG
dog friendly restaurants sugar land|[https://www.fondren5starpetresort.com/dog-friendly-eateries-in-sw-houston-sugar-land/]|7|0|19|NEW|BNG
dog grooming missouri city|[https://www.fondren5starpetresort.com/pet-grooming/]|17|22|5|UP|BNG
dog grooming missouri city tx|[https://www.fondren5starpetresort.com/]|16|20|4|UP|BNG
dog grooming near meyerland tx|[https://www.fondren5starpetresort.com/location/meyerland-tx-pet-boarding/]|14|13|-1|DOWN|BNG
dog grooming sienna plantation tx|[https://www.fondren5starpetresort.com/pet-grooming/sienna-plantation-pet-hotel/]|12|12|0|EQ|BNG
dog hotels sugar land|[https://www.fondren5starpetresort.com/dog-boarding/]|14|14|0|EQ|BNG
dog kennels sugar land tx|[https://www.fondren5starpetresort.com/dog-boarding/]|6|4|-2|DOWN|BNG
dog resort houston|[https://www.fondren5starpetresort.com/]|8|13|5|UP|BNG
dog training near stafford tx|[https://www.fondren5starpetresort.com/dog-training/stafford-dog-training-near-me/]|3|4|1|UP|BNG
dog training sugar land|[https://www.fondren5starpetresort.com/dog-training/sugar-land-dog-training-near-me/]|12|19|7|UP|BNG
doggie boarding southwest houston|[https://www.fondren5starpetresort.com/location/south-west-houston-pet-boarding/southwest-houston-dog-hotel/]|8|3|-5|DOWN|BNG
doggie boarding sw houston|[https://www.fondren5starpetresort.com/location/south-west-houston-pet-boarding/southwest-houston-dog-hotel/]|8|4|-4|DOWN|BNG
doggie hotels stafford tx|[https://www.fondren5starpetresort.com/stafford-tx-dog-hotel/]|4|4|0|EQ|BNG
doggie hotels sugar land tx|[https://www.fondren5starpetresort.com/dog-boarding/]|12|12|0|EQ|BNG
doggy day care pearland|[https://www.fondren5starpetresort.com/dog-daycare/pearland-doggy-day-care/]|2|5|3|UP|BNG
doggy day care sugar land|[https://www.fondren5starpetresort.com/dog-daycare/sugar-land-doggy-day-care/]|6|6|0|EQ|BNG
doggy daycare sienna plantation|[https://www.fondren5starpetresort.com/dog-daycare/sienna-plantation-doggy-day-care/]|1|1|0|EQ|BNG
exceptional pet boarding sugar land|[https://www.fondren5starpetresort.com/sugar-land-dog-boarding/]|3|4|1|UP|BNG
five star boarding kennels|[https://www.fondren5starpetresort.com/]|3|2|-1|DOWN|BNG
five star boarding kennels sugar land|[https://www.fondren5starpetresort.com/]|1|1|0|EQ|BNG
five star boarding missouri city tx|[https://www.fondren5starpetresort.com/]|1|1|0|EQ|BNG
five star boarding sugar land|[https://www.fondren5starpetresort.com/location/sugar-land-tx-pet-boarding/sugar-land-tx-animal-boarding/]|1|1|0|EQ|BNG
five star dog grooming houston|[https://www.fondren5starpetresort.com/]|1|1|0|EQ|BNG
five star dog kennels houston|[https://www.fondren5starpetresort.com/]|1|1|0|EQ|BNG
five star dog resort houston|[https://www.fondren5starpetresort.com/]|1|1|0|EQ|BNG
five star dog resort sugar land|[https://www.fondren5starpetresort.com/location/sugar-land-tx-pet-boarding/]|2|1|-1|DOWN|BNG
five star pet boarding houston|[https://www.fondren5starpetresort.com/]|1|1|0|EQ|BNG
five star pet boarding meyerland tx|[https://www.fondren5starpetresort.com/location/meyerland-tx-pet-boarding/]|1|1|0|EQ|BNG
five star pet boarding missouri city tx|[https://www.fondren5starpetresort.com/]|1|1|0|EQ|BNG
five star pet boarding stafford tx|[https://www.fondren5starpetresort.com/location/stafford-tx-pet-boarding/]|1|1|0|EQ|BNG
five star pet grooming houston|[https://www.fondren5starpetresort.com/]|1|1|0|EQ|BNG
five star pet grooming sugar land|[https://www.fondren5starpetresort.com/pet-grooming/]|1|1|0|EQ|BNG
five star pet resort sugar land|[https://www.fondren5starpetresort.com/]|1|1|0|EQ|BNG
fondren5starpetresort.com|[https://www.fondren5starpetresort.com/]|1|1|0|EQ|BNG
gold star pet resort houston|[https://www.fondren5starpetresort.com/]|9|9|0|EQ|BNG
gold star pet resort sugar land|[https://www.fondren5starpetresort.com/about-us/]|6|7|1|UP|BNG
grooming and boarding southwest houston|[https://www.fondren5starpetresort.com/]|10|5|-5|DOWN|BNG
guinea pig boarding pearland|[https://www.fondren5starpetresort.com/avian-pocket-pets/]|4|2|-2|DOWN|BNG
hamster boarding near houston|[https://www.fondren5starpetresort.com/avian-pocket-pets/]|2|0|24|NEW|BNG
home boarding for dogs southwest houston|[https://www.fondren5starpetresort.com/]|11|7|-4|DOWN|BNG
houston animal organizations|[https://www.fondren5starpetresort.com/houstons-top-pet-charities/]|4|4|0|EQ|BNG
houston cat boarding|[https://www.fondren5starpetresort.com/cat-boarding/]|6|25|19|UP|BNG
houston dog kennel|[https://www.fondren5starpetresort.com/]|13|22|9|UP|BNG
houston five star kennels|[https://www.fondren5starpetresort.com/]|1|1|0|EQ|BNG
houston five star pet boarding|[https://www.fondren5starpetresort.com/]|1|1|0|EQ|BNG
houston five star pet resort|[https://www.fondren5starpetresort.com/]|1|1|0|EQ|BNG
houston pet grooming and boarding|[https://www.fondren5starpetresort.com/]|18|9|-9|DOWN|BNG
houston pet resort|[https://www.fondren5starpetresort.com/]|8|13|5|UP|BNG
houston star kennels|[https://www.fondren5starpetresort.com/]|7|1|-6|DOWN|BNG
houston star pet grooming|[https://www.fondren5starpetresort.com/]|1|1|0|EQ|BNG
kennel near missouri city|[https://www.fondren5starpetresort.com/]|8|4|-4|DOWN|BNG
kennels for dog stafford tx|[https://www.fondren5starpetresort.com/stafford-tx-kennels-near-me/]|2|2|0|EQ|BNG
kennels for dogs stafford tx|[https://www.fondren5starpetresort.com/stafford-tx-kennels-near-me/]|2|2|0|EQ|BNG
kennels in houston|[https://www.fondren5starpetresort.com/]|20|0|6|NEW|BNG
kennels in pearland|[https://www.fondren5starpetresort.com/pearland-dog-kennels-near-me/]|14|10|-4|DOWN|BNG
lone star pet resort|[https://www.fondren5starpetresort.com/]|20|19|-1|DOWN|BNG
luxury dog boarding missouri city|[https://www.fondren5starpetresort.com/dog-boarding/]|3|3|0|EQ|BNG
luxury pet resort pearland tx|[https://www.fondren5starpetresort.com/pearland-tx-animal-boarding/]|4|3|-1|DOWN|BNG
maplewood south dog nail grooming|[https://www.fondren5starpetresort.com/maplewood-south-pet-grooming-near-me/]|1|1|0|EQ|BNG
maplewood south pet resort|[https://www.fondren5starpetresort.com/location/maplewood-south-tx-pet-boarding/maplewood-south-pet-hotel/]|1|1|0|EQ|BNG
meyerland cat boarding|[https://www.fondren5starpetresort.com/location/meyerland-tx-pet-boarding/]|1|1|0|EQ|BNG
meyerland pet resort|[https://www.fondren5starpetresort.com/location/meyerland-tx-pet-boarding/meyerland-pet-hotel/]|1|1|0|EQ|BNG
missouri city cheap pet grooming|[https://www.fondren5starpetresort.com/missouri-city-pet-grooming-near-me/]|10|18|8|UP|BNG
missouri city luxury dog daycare|[https://www.fondren5starpetresort.com/dog-boarding/]|2|1|-1|DOWN|BNG
pearland dog kennel|[https://www.fondren5starpetresort.com/pearland-dog-kennels-near-me/]|8|4|-4|DOWN|BNG
pearland pet resort|[https://www.fondren5starpetresort.com/pearland-pet-hotel/]|5|4|-1|DOWN|BNG
pearland tx pet resort|[https://www.fondren5starpetresort.com/pearland-tx-kennels-near-me/]|4|8|4|UP|BNG
pet boarding missouri city|[https://www.fondren5starpetresort.com/]|12|13|1|UP|BNG
pet boarding missouri city tx|[https://www.fondren5starpetresort.com/]|8|0|18|NEW|BNG
pet boarding sienna plantation|[https://www.fondren5starpetresort.com/location/sienna-plantation-tx-pet-boarding/]|2|1|-1|DOWN|BNG
pet boarding stafford tx|[https://www.fondren5starpetresort.com/location/stafford-tx-pet-boarding/]|1|4|3|UP|BNG
pet boarding sugar land|[https://www.fondren5starpetresort.com/dog-boarding/]|12|13|1|UP|BNG
pet boarding westbury tx|[https://www.fondren5starpetresort.com/location/westbury-tx-pet-boarding/]|1|1|0|EQ|BNG
pet cat boarding near meyerland tx|[https://www.fondren5starpetresort.com/location/meyerland-tx-pet-boarding/]|2|2|0|EQ|BNG
pet cat boarding southwest houston|[https://www.fondren5starpetresort.com/cat-boarding/south-west-houston-cat-boarding/]|1|1|0|EQ|BNG
pet daycare maplewood south|[https://www.fondren5starpetresort.com/maplewood-south-doggy-day-care/]|2|2|0|EQ|BNG
pet daycare meyerland tx|[https://www.fondren5starpetresort.com/location/meyerland-tx-pet-boarding/]|5|4|-1|DOWN|BNG
pet grooming & boarding missouri city|[https://www.fondren5starpetresort.com/]|6|6|0|EQ|BNG
pet grooming southwest houston|[https://www.fondren5starpetresort.com/]|6|4|-2|DOWN|BNG
pet grooming westbury tx|[https://www.fondren5starpetresort.com/westbury-pet-grooming-near-me/]|4|4|0|EQ|BNG
pet hotel maplewood south|[https://www.fondren5starpetresort.com/location/maplewood-south-tx-pet-boarding/maplewood-south-pet-hotel/]|1|1|0|EQ|BNG
pet hotel missouri city|[https://www.fondren5starpetresort.com/location/missouri-city-texas-pet-boarding/missouri-city-pet-hotel/]|5|17|12|UP|BNG
pet hotel sugar land|[https://www.fondren5starpetresort.com/dog-boarding/]|16|0|10|NEW|BNG
pet hotel sugar land tx|[https://www.fondren5starpetresort.com/location/sugar-land-tx-pet-boarding/sugar-land-pet-hotel/]|10|11|1|UP|BNG
pet kennels houston|[https://www.fondren5starpetresort.com/]|13|13|0|EQ|BNG
pet lodge near sienna plantation|[https://www.fondren5starpetresort.com/pet-grooming/sienna-plantation-pet-grooming-near-me/]|2|1|-1|DOWN|BNG
pet resort houston|[https://www.fondren5starpetresort.com/]|10|12|2|UP|BNG
pet resort houston tx|[https://www.fondren5starpetresort.com/]|12|13|1|UP|BNG
pet resort maplewood south|[https://www.fondren5starpetresort.com/maplewood-south-dog-boarding/]|2|1|-1|DOWN|BNG
pet resorts houston|[https://www.fondren5starpetresort.com/]|11|12|1|UP|BNG
pet resorts near sugar land tx|[https://www.fondren5starpetresort.com/dog-boarding/]|10|10|0|EQ|BNG
pets resort near meyerland tx|[https://www.fondren5starpetresort.com/location/meyerland-tx-pet-boarding/]|1|2|1|UP|BNG
pocket pet boarding houston|[https://www.fondren5starpetresort.com/avian-pocket-pets/]|1|1|0|EQ|BNG
puppies daycare meyerland tx|[https://www.fondren5starpetresort.com/dog-daycare/meyerland-doggy-day-care/]|2|1|-1|DOWN|BNG
puppy southwest houston|[https://www.fondren5starpetresort.com/]|9|0|17|NEW|BNG
sienna plantation exceptional pet boarding|[https://www.fondren5starpetresort.com/sienna-plantation-tx-pet-boarding/]|1|1|0|EQ|BNG
sienna plantation obedience training|[https://www.fondren5starpetresort.com/dog-training/sienna-plantation-tx-dog-training-near-me/]|2|2|0|EQ|BNG
sienna plantation small animal boarding|[https://www.fondren5starpetresort.com/location/sienna-plantation-tx-pet-boarding/]|1|4|3|UP|BNG
small animal boarding stafford tx|[https://www.fondren5starpetresort.com/stafford-tx-kennels-near-me/]|7|2|-5|DOWN|BNG
southwest houston pet boarding|[https://www.fondren5starpetresort.com/location/south-west-houston-pet-boarding/southwest-houston-dog-hotel/]|5|3|-2|DOWN|BNG
southwest houston pet resort|[https://www.fondren5starpetresort.com/]|1|1|0|EQ|BNG
stafford luxury dog daycare|[https://www.fondren5starpetresort.com/dog-boarding/stafford-dog-boarding/]|21|24|3|UP|BNG
stafford tx dog daycare and boarding|[https://www.fondren5starpetresort.com/location/stafford-tx-pet-boarding/]|6|4|-2|DOWN|BNG
stafford tx dog grooming|[https://www.fondren5starpetresort.com/location/stafford-tx-pet-boarding/]|14|10|-4|DOWN|BNG
stafford tx pet resort|[https://www.fondren5starpetresort.com/location/stafford-tx-pet-boarding/]|1|1|0|EQ|BNG
stafford tx pet resorts|[https://www.fondren5starpetresort.com/location/stafford-tx-pet-boarding/]|1|2|1|UP|BNG
star dog boarding houston|[https://www.fondren5starpetresort.com/dog-daycare/]|2|2|0|EQ|BNG
star kennels houston|[https://www.fondren5starpetresort.com/]|6|0|20|NEW|BNG
star pet hotel sugar land|[https://www.fondren5starpetresort.com/location/sugar-land-tx-pet-boarding/sugar-land-pet-hotel/]|1|1|0|EQ|BNG
sugar land cheap pet grooming|[https://www.fondren5starpetresort.com/pet-grooming/sugar-land-pet-grooming-near-me/]|22|11|-11|DOWN|BNG
sugar land five star kennel|[https://www.fondren5starpetresort.com/dog-boarding/]|1|1|0|EQ|BNG
sugar land guinea pig hotel|[https://www.fondren5starpetresort.com/dog-boarding/]|1|2|1|UP|BNG
sugarland kennels|[https://www.fondren5starpetresort.com/dog-boarding/]|16|20|4|UP|BNG
westbury pet grooming|[https://www.fondren5starpetresort.com/westbury-pet-grooming-near-me/]|8|5|-3|DOWN|BNG
westbury tx pet boarding|[https://www.fondren5starpetresort.com/location/westbury-tx-pet-boarding/]|1|1|0|EQ|BNG
westbury tx pet hotel|[https://www.fondren5starpetresort.com/location/westbury-tx-pet-boarding/westbury-pet-hotel/]|1|1|0|EQ|BNG
