Katy TX housing lawyers|https://realestatelawyerhouston.com/housing-lawyers-near-me-katy-tx/|10|11|1|UP
Katy TX mortgage lawyer|https://realestatelawyerhouston.com/fantastic-katy-tx-mortgage-lawyer/|9|7|2|DOWN
real estate transaction attorney Katy, TX|https://realestatelawyerhouston.com/real-estate-transaction-attorney-katy-tx/|10|9|1|DOWN
Houston TX land use attorney near me|https://realestatelawyerhouston.com/houston-tx-land-attorney-near-me/|10|10|0|EQ
Katy TX best real estate lawyer near me|https://realestatelawyerhouston.com/katy-tx-best-real-estate-lawyer-near-me/|10|9|1|DOWN
property lawyers near me Richmond TX|https://realestatelawyerhouston.com/property-lawyers-near-me-richmond-tx/|10|10|0|EQ
Houston TX Housing Lawyers|https://realestatelawyerhouston.com/houston-tx-housing-lawyers-near-me/|7|14|7|UP
housing lawyers near me Katy TX|https://realestatelawyerhouston.com/housing-lawyers-near-me-katy-tx/|10|10|0|EQ
landlord and tenant lawyer Richmond TX|https://realestatelawyerhouston.com/landlord-tenant-attorney-near-me-richmond-tx/|10|7|3|DOWN
real estate lawyers in my area Fulshear, TX|https://realestatelawyerhouston.com/fulshear-tx-real-estate-lawyer/|10|10|0|EQ
realty lawyers near me Richmond, TX|https://realestatelawyerhouston.com/realty-lawyers-near-me-richmond-tx/|11|10|1|DOWN
Houston TX lawyer for landlord tenants dispute|https://realestatelawyerhouston.com/houston-tx-landlord-tenant-law-attorney/|11|11|0|EQ
litigation lawyer Richmond TX|https://realestatelawyerhouston.com/civil-litigation-lawyer-richmond-tx/|11|12|1|UP
Katy TX real estate lawyer near me|https://realestatelawyerhouston.com/katy-tx-real-estate-attorney-fees-for-closing/|12|11|1|DOWN
Houston TX Rental Attorney|https://realestatelawyerhouston.com/houston-tx-landlord-tenant-law-attorney/|11|13|2|UP
Richmond TX real estate lawyer near me|https://realestatelawyerhouston.com/richmond-tx-real-estate-lawyer/|11|11|0|EQ
best real estate lawyer Richmond, TX|https://realestatelawyerhouston.com/best-real-estate-lawyer-richmond-tx/|11|30|30|NEW
housing lawyers Richmond TX|https://realestatelawyerhouston.com/housing-lawyers-richmond-tx/|11|11|0|EQ
attorney real estate near me Richmond, TX|https://realestatelawyerhouston.com/real-estate-litigation-attorney-near-me-richmond-tx/|11|30|30|NEW
attorney real estate near me Katy, TX|https://realestatelawyerhouston.com/attorney-real-estate-near-me-katy-tx/|11|30|30|NEW
real estate litigation attorney near me Katy, TX|https://realestatelawyerhouston.com/real-estate-litigation-attorney-near-me-katy-tx/|11|11|0|EQ
Houston TX landlord and tenant attorney|https://realestatelawyerhouston.com/houston-tx-landlord-tenant-law-attorney/|9|22|13|UP
Houston TX attorney for landlord tenant issues|https://realestatelawyerhouston.com/houston-tx-landlord-tenant-law-attorney/|12|11|1|DOWN
Katy TX Real Estate Attorney|https://realestatelawyerhouston.com/katy-tx-real-estate-lawyer/|12|15|3|UP
Katy TX real estate litigation attorney|https://realestatelawyerhouston.com/katy-tx-real-estate-lawyer/|12|12|0|EQ
Richmond TX real estate attorney near me|https://realestatelawyerhouston.com/property-lawyers-near-me-richmond-tx/|12|12|0|EQ
Houston TX mortgage attorney near me|https://realestatelawyerhouston.com/houston-tx-mortgage-attorney-near-me/|4|18|14|UP
Houston TX lease lawyers near me|https://realestatelawyerhouston.com/houston-tx-landlord-tenant-law-attorney/|11|14|3|UP
Katy TX residential real estate lawyer|https://realestatelawyerhouston.com/katy-tx-best-real-estate-lawyer-near-me/|13|11|2|DOWN
Richmond TX real estate lawyer|https://realestatelawyerhouston.com/richmond-tx-real-estate-lawyer/|13|14|1|UP
Houston TX rental property attorney|https://realestatelawyerhouston.com/houston-tx-landlord-tenant-law-attorney/|13|13|0|EQ
Houston TX tenant rights lawyer near me|https://realestatelawyerhouston.com/houston-tx-landlord-tenant-law-attorney/|13|30|17|NEW
Houston TX Rental Lawyers Near Me|https://realestatelawyerhouston.com/houston-tx-housing-lawyers-near-me/|13|13|0|EQ
Katy TX residential lawyer|https://realestatelawyerhouston.com/katy-tx-real-estate-lawyer/|13|11|2|DOWN
Houston TX foreclosure lawyers near me|https://realestatelawyerhouston.com/houston-tx-foreclosure-lawyers-near-me/|13|13|0|EQ
Katy TX land attorney near me|https://realestatelawyerhouston.com/katy-tx-landlord-tenant-attorney/|13|11|2|DOWN
real estate attorneys in my area Fulshear, TX|https://realestatelawyerhouston.com/fulshear-tx-real-estate-lawyer/|13|13|0|EQ
Katy TX Real Estate Attorney Near Me|https://realestatelawyerhouston.com/eviction-lawyer-near-me-katy-tx/|13|14|1|UP
Houston TX landlord dispute lawyer|https://realestatelawyerhouston.com/houston-tx-landlord-tenant-law-attorney/|13|14|1|UP
realty lawyers near me Katy, TX|https://realestatelawyerhouston.com/real-estate-lawyers-in-my-area-katy-tx/|13|15|2|UP
real estate attorneys in my area Katy, TX|https://realestatelawyerhouston.com/katy-tx-real-estate-lawyer/|14|15|1|UP
real estate attorneys in my area Richmond, TX|https://realestatelawyerhouston.com/real-estate-attorneys-in-my-area-richmond-tx/|13|14|1|UP
Houston TX landlord and tenant lawyer|https://realestatelawyerhouston.com/houston-tx-landlord-tenant-law-attorney/|13|17|4|UP
Houston TX Tenant Landlord Lawyer|https://realestatelawyerhouston.com/houston-tx-landlord-tenant-law-attorney/|14|25|11|UP
Katy TX Property Lawyers Near Me|https://realestatelawyerhouston.com/|14|15|1|UP
Houston TX lease lawyers|https://realestatelawyerhouston.com/houston-tx-landlord-tenant-law-attorney/|15|23|8|UP
Houston TX Landlord Tenant Lawyer Free Consultation Near Me|https://realestatelawyerhouston.com/houston-tx-landlord-tenant-law-attorney/|15|20|5|UP
real estate lawyers in my area Katy, TX|https://realestatelawyerhouston.com/katy-tx-real-estate-lawyer/|15|16|1|UP
Katy TX contract law attorneys|https://realestatelawyerhouston.com/real-estate-transaction-attorney-katy-tx/|16|18|2|UP
Houston TX tenant attorney near me|https://realestatelawyerhouston.com/houston-tx-landlord-tenant-law-attorney/|15|25|10|UP
Houston TX Tenant Lawyer Near Me|https://realestatelawyerhouston.com/houston-tx-landlord-tenant-law-attorney/|15|16|1|UP
Houston TX realtor attorney|https://realestatelawyerhouston.com/houston-tx-business-real-estate-attorney/|27|29|2|UP
Houston TX Tenant Attorney|https://realestatelawyerhouston.com/houston-tx-landlord-tenant-law-attorney/|16|24|8|UP
Houston TX tenant lawyer free consultation|https://realestatelawyerhouston.com/houston-tx-landlord-tenant-law-attorney/|16|29|13|UP
Houston TX Landlord Tenant Lawyer Free Consultation|https://realestatelawyerhouston.com/houston-tx-landlord-tenant-law-attorney/|15|26|11|UP
realestatelawyerhouston.com|https://realestatelawyerhouston.com/|1|30|29|NEW
Katy TX Real Estate Lawyer|https://realestatelawyerhouston.com/katy-tx-real-estate-lawyer/|16|14|2|DOWN
Houston TX landlord attorney|https://realestatelawyerhouston.com/houston-tx-landlord-tenant-law-attorney/|15|23|8|UP
Katy TX property attorney near me|https://realestatelawyerhouston.com/katy-tx-property-attorney/|16|11|5|DOWN
Houston TX landlord lawyer near me|https://realestatelawyerhouston.com/katy-tx-landlord-tenant-attorney/|19|21|2|UP
Houston TX apartment lawyer|https://realestatelawyerhouston.com/houston-tx-lease-lawyers/|18|14|4|DOWN
Houston TX land lawyers near me|https://realestatelawyerhouston.com/houston-tx-property-lawyers-near-me/|17|30|13|NEW
Houston TX tenant lawyer|https://realestatelawyerhouston.com/houston-tx-landlord-tenant-law-attorney/|17|23|6|UP
Houston TX Landlord Tenant Attorney Near Me|https://realestatelawyerhouston.com/houston-tx-landlord-tenant-law-attorney/|17|17|0|EQ
Katy TX real estate tax attorney near me|https://realestatelawyerhouston.com/real-estate-litigation-attorney-near-me-katy-tx/|17|15|2|DOWN
Katy TX litigation lawyer|https://realestatelawyerhouston.com/cinco-ranch-tx-civil-litigation-attorney/|17|19|2|UP
Houston TX property lawyers near me|https://realestatelawyerhouston.com/houston-tx-property-lawyers-near-me/|18|24|6|UP
home lawyers Katy, TX|https://realestatelawyerhouston.com/|20|14|6|DOWN
Houston TX land attorney near me|https://realestatelawyerhouston.com/practice-areas/|21|24|3|UP
Houston TX Mortgage Lawyer|https://realestatelawyerhouston.com/fantastic-katy-tx-mortgage-lawyer/|20|30|10|NEW
Houston TX business real estate attorney|https://realestatelawyerhouston.com/houston-tx-business-real-estate-attorney/|21|30|9|NEW
Houston TX rental lawyers|https://realestatelawyerhouston.com/houston-tx-lease-lawyers/|16|16|0|EQ
Houston TX property attorney near me|https://realestatelawyerhouston.com/houston-tx-property-lawyers-near-me/|23|25|2|UP
Katy TX litigation law firm|https://realestatelawyerhouston.com/|26|13|13|DOWN
Houston TX Foreclosure Lawyers|https://realestatelawyerhouston.com/foreclosure-lawyers-near-me-richmond-tx/|26|20|6|DOWN
Houston TX real estate attorney near me|https://realestatelawyerhouston.com/cinco-ranch-tx-real-estate-attorney-near-me/|27|22|5|DOWN
Houston TX Foreclosure Attorney|https://realestatelawyerhouston.com/powerful-foreclosure-attorney-for-lenders-katy-tx/|28|21|7|DOWN
Houston TX Real Estate Lawyer Near Me|https://realestatelawyerhouston.com/houston-tx-property-lawyers-near-me/|30|28|2|DOWN
Houston TX Residential Real Estate Attorney Near Me|https://realestatelawyerhouston.com/houston-tx-residential-real-estate-lawyer/|30|21|9|DOWN
