Cinco Ranch TX Real Estate Attorney|https://realestatelawyerhouston.com/cinco-ranch-tx-real-estate-attorney-near-me/|2|1|1|DOWN
Cinco Ranch TX Real Estate Lawyer|https://realestatelawyerhouston.com/cinco-ranch-tx-real-estate-attorney-near-me/|2|2|0|EQ
Cinco Ranch TX Real Estate Attorney Near Me|https://realestatelawyerhouston.com/cinco-ranch-tx-real-estate-attorney-near-me/|2|2|0|EQ
Cinco Ranch TX civil litigation attorney|https://realestatelawyerhouston.com/cinco-ranch-tx-civil-litigation-attorney/|2|2|0|EQ
Cinco Ranch TX civil litigation lawyer|https://realestatelawyerhouston.com/cinco-ranch-tx-civil-litigation-attorney/|2|2|0|EQ
Cinco Ranch TX civil litigation lawyer near me|https://realestatelawyerhouston.com/cinco-ranch-tx-civil-litigation-attorney/|2|2|0|EQ
Cinco Ranch TX real estate litigation attorney|https://realestatelawyerhouston.com/cinco-ranch-tx-real-estate-attorney-near-me/|2|2|0|EQ
Cinco Ranch TX litigation lawer|https://realestatelawyerhouston.com/cinco-ranch-tx-civil-litigation-attorney/|2|4|2|UP
Cinco Ranch TX litigation lawyer|https://realestatelawyerhouston.com/cinco-ranch-tx-civil-litigation-attorney/|2|4|2|UP
civil litigation attorney Fulshear TX|https://realestatelawyerhouston.com/civil-litigation-attorney-near-me-fulshear-tx/|4|5|1|UP
Katy TX civil litigation lawyer near me|https://realestatelawyerhouston.com/|11|5|6|DOWN
Katy TX civil litigation attorney|https://realestatelawyerhouston.com/cinco-ranch-tx-civil-litigation-attorney/|11|11|0|EQ
Katy TX civil litigation lawyer|https://realestatelawyerhouston.com/civil-litigation-lawyer-katy-tx/|11|11|0|EQ
Cinco Ranch TX civil litigation|https://realestatelawyerhouston.com/cinco-ranch-tx-civil-litigation-attorney/|2|1|1|DOWN
Cinco Ranch TX real estate lawyer near me|https://realestatelawyerhouston.com/cinco-ranch-tx-real-estate-attorney-near-me/|2|2|0|EQ
Cinco Ranch TX tenant lawyer|https://realestatelawyerhouston.com/expert-tenant-lawyer-cinco-ranch-tx/|2|2|0|EQ
Cinco Ranch TX property attorney|https://realestatelawyerhouston.com/cinco-ranch-tx-real-estate-attorney-near-me/|2|2|0|EQ
Cinco Ranch TX landlord tenant lawyer near me|https://realestatelawyerhouston.com/cinco-ranch-tx-landlord-tenant-lawyer-near-me/|2|1|1|DOWN
Cinco Ranch TX tenant attorney|https://realestatelawyerhouston.com/expert-tenant-lawyer-cinco-ranch-tx/|2|2|0|EQ
Cinco Ranch TX apartment lawyer|https://realestatelawyerhouston.com/cinco-ranch-tx-apartment-lawyer/|2|2|0|EQ
civil litigation attorney near me Cinco Ranch, TX|https://realestatelawyerhouston.com/cinco-ranch-tx-civil-litigation-attorney/|2|2|0|EQ
realty lawyers near me Cinco Ranch, TX|https://realestatelawyerhouston.com/cinco-ranch-tx-real-estate-attorney-near-me/|2|2|0|EQ
attorney for landlord tenant issues near me Cinco Ranch, TX|https://realestatelawyerhouston.com/cinco-ranch-tx-landlord-tenant-lawyer-near-me/|2|2|0|EQ
civil litigation attorney near me Fulshear, TX|https://realestatelawyerhouston.com/civil-litigation-attorney-near-me-fulshear-tx/|4|3|1|DOWN
civil litigation lawyer Fulshear TX|https://realestatelawyerhouston.com/civil-litigation-lawyer-fulshear-tx/|4|4|0|EQ
Fulshear TX civil litigation|https://realestatelawyerhouston.com/cinco-ranch-tx-civil-litigation-attorney/|8|3|5|DOWN
Cinco Ranch TX will attorney|https://realestatelawyerhouston.com/cinco-ranch-tx-real-estate-attorney-near-me/|4|5|1|UP
litigation lawyer Fulshear TX|https://realestatelawyerhouston.com/civil-litigation-lawyer-fulshear-tx/|8|10|2|UP
Katy TX rental property lawyers|https://realestatelawyerhouston.com/katy-tx-rental-lawyers/|7|6|1|DOWN
Fulshear TX litigation lawer|https://realestatelawyerhouston.com/civil-litigation-lawyer-fulshear-tx/|8|10|2|UP
civil litigation attorney near me Katy, TX|https://realestatelawyerhouston.com/|9|6|3|DOWN
Katy TX closing attorney|https://realestatelawyerhouston.com/katy-tx-closing-attorney/|11|9|2|DOWN
Katy TX civil litigation|https://realestatelawyerhouston.com/cinco-ranch-tx-civil-litigation-attorney/|13|12|1|DOWN
okonji law|https://realestatelawyerhouston.com/|1|2|1|UP
Katy TX real estate attorney fees for closing|https://realestatelawyerhouston.com/katy-tx-real-estate-attorney-fees-for-closing/|1|1|0|EQ
Katy TX real estate lawyer cost|https://realestatelawyerhouston.com/affordable-katy-tx-real-estate-lawyer-cost/|1|1|0|EQ
Katy TX closing attorney cost|https://realestatelawyerhouston.com/all-inclusive-katy-tx-closing-attorney-cost/|1|1|0|EQ
Cinco Ranch TX eviction lawyer|https://realestatelawyerhouston.com/eviction-lawyer-cinco-ranch-tx/|2|2|0|EQ
Cinco Ranch TX landlord tenant attorney|https://realestatelawyerhouston.com/landlord-tenant-attorney-near-me-2/|2|1|1|DOWN
Cinco Ranch TX rental lawyers|https://realestatelawyerhouston.com/cinco-ranch-tx-rental-lawyers/|2|2|0|EQ
Cinco Ranch TX eviction attorney|https://realestatelawyerhouston.com/eviction-lawyer-cinco-ranch-tx/|2|2|0|EQ
Cinco Ranch TX eviction lawyer near me|https://realestatelawyerhouston.com/eviction-attorney-near-me/|2|2|0|EQ
Cinco Ranch TX landlord attorney near me|https://realestatelawyerhouston.com/cinco-ranch-tx-landlord-tenant-lawyer-near-me/|2|2|0|EQ
Cinco Ranch TX hoa attorney|https://realestatelawyerhouston.com/|1|2|1|UP
Cinco Ranch TX foreclosure lawyers|https://realestatelawyerhouston.com/cinco-ranch-tx-foreclosure-attorney-near-me/|2|1|1|DOWN
Cinco Ranch TX property attorney near me|https://realestatelawyerhouston.com/cinco-ranch-tx-real-estate-attorney-near-me/|2|2|0|EQ
Cinco Ranch TX housing lawyers|https://realestatelawyerhouston.com/cinco-ranch-tx-housing-attorney/|2|2|0|EQ
Cinco Ranch TX foreclosure attorney|https://realestatelawyerhouston.com/cinco-ranch-tx-foreclosure-attorney-near-me/|1|2|1|UP
housing lawyers near me Cinco Ranch TX|https://realestatelawyerhouston.com/housing-lawyers-cinco-ranch-tx/|2|2|0|EQ
lawyer for rental issues Fulshear, TX|https://realestatelawyerhouston.com/lawyer-for-rental-issues-fulshear-tx/|2|3|1|UP
eviction attorney near me Fulshear, TX|https://realestatelawyerhouston.com/eviction-attorney-near-me-fulshear-tx/|2|2|0|EQ
lawyer for apartments Fulshear, TX|https://realestatelawyerhouston.com/lawyer-for-apartments-fulshear-tx/|2|2|0|EQ
eviction lawyer near me Fulshear TX|https://realestatelawyerhouston.com/eviction-attorney-near-me-fulshear-tx/|2|2|0|EQ
foreclosure lawyers Fulshear TX|https://realestatelawyerhouston.com/foreclosure-attorney-fulshear-tx/|2|2|0|EQ
Cinco Ranch TX tenant lawyer near me|https://realestatelawyerhouston.com/expert-tenant-lawyer-cinco-ranch-tx/|2|2|0|EQ
Cinco Ranch TX tenant rights lawyer|https://realestatelawyerhouston.com/expert-tenant-lawyer-cinco-ranch-tx/|2|1|1|DOWN
Cinco Ranch TX eviction attorney near me|https://realestatelawyerhouston.com/eviction-attorney-near-me/|2|2|0|EQ
Cinco Ranch TX closing attorney|https://realestatelawyerhouston.com/cinco-ranch-tx-closing-attorney/|2|2|0|EQ
Cinco Ranch TX eviction lawyers|https://realestatelawyerhouston.com/eviction-lawyer-cinco-ranch-tx/|2|2|0|EQ
Cinco Ranch TX landlord tenant attorney near me|https://realestatelawyerhouston.com/cinco-ranch-tx-landlord-tenant-lawyer-near-me/|2|2|0|EQ
Cinco Ranch TX tenant landlord lawyer|https://realestatelawyerhouston.com/expert-tenant-lawyer-cinco-ranch-tx/|2|2|0|EQ
Cinco Ranch TX landlord attorney|https://realestatelawyerhouston.com/cinco-ranch-tx-landlord-attorney-near-me/|2|2|0|EQ
Cinco Ranch TX tenant rights attorney|https://realestatelawyerhouston.com/expert-tenant-lawyer-cinco-ranch-tx/|2|1|1|DOWN
Cinco Ranch TX foreclosure attorney near me|https://realestatelawyerhouston.com/cinco-ranch-tx-foreclosure-attorney-near-me/|2|1|1|DOWN
lawyers for apartment issues Cinco Ranch, TX|https://realestatelawyerhouston.com/lawyers-for-apartment-issues-cinco-ranch-tx/|2|30|30|NEW
attorney for rental disputes Cinco Ranch, TX|https://realestatelawyerhouston.com/attorney-for-rental-disputes-cinco-ranch-tx/|2|30|30|NEW
best real estate lawyer Cinco Ranch, TX|https://realestatelawyerhouston.com/best-real-estate-lawyer-cinco-ranch-tx/|2|30|30|NEW
Cinco Ranch TX breach of contract lawyers|https://realestatelawyerhouston.com/cinco-ranch-tx-breach-of-contract-lawyers/|2|1|1|DOWN
Cinco Ranch TX rental lawyers near me|https://realestatelawyerhouston.com/cinco-ranch-tx-rental-lawyers/|2|2|0|EQ
Cinco Ranch TX landlord and tenant lawyer|https://realestatelawyerhouston.com/expert-tenant-lawyer-cinco-ranch-tx/|2|2|0|EQ
Cinco Ranch TX mortgage attorney near me|https://realestatelawyerhouston.com/cinco-ranch-tx-real-estate-attorney-near-me/|1|1|0|EQ
Cinco Ranch TX land attorney near me|https://realestatelawyerhouston.com/cinco-ranch-tx-real-estate-attorney-near-me/|2|1|1|DOWN
Cinco Ranch TX real estate closing attorney near me|https://realestatelawyerhouston.com/cinco-ranch-tx-real-estate-attorney-near-me/|2|1|1|DOWN
Cinco Ranch TX lease lawyers|https://realestatelawyerhouston.com/cinco-ranch-tx-lease-lawyers/|2|1|1|DOWN
Cinco Ranch TX mortgage lawyer|https://realestatelawyerhouston.com/cinco-ranch-tx-real-estate-attorney-near-me/|2|2|0|EQ
Cinco Ranch TX housing attorney|https://realestatelawyerhouston.com/|1|1|0|EQ
Cinco Ranch TX rental attorney|https://realestatelawyerhouston.com/cinco-ranch-tx-rental-lawyers/|2|2|0|EQ
Cinco Ranch TX landlord lawyer|https://realestatelawyerhouston.com/cinco-ranch-tx-landlord-tenant-lawyer-near-me/|2|2|0|EQ
Fulshear TX eviction lawyer|https://realestatelawyerhouston.com/eviction-attorney-near-me-fulshear-tx/|2|1|1|DOWN
Fulshear TX landlord tenant attorney|https://realestatelawyerhouston.com/landlord-and-tenant-lawyer-fulshear-tx/|2|1|1|DOWN
realtor lawyer Cinco Ranch TX|https://realestatelawyerhouston.com/cinco-ranch-tx-real-estate-attorney-near-me/|2|2|0|EQ
eviction attorney Fulshear TX|https://realestatelawyerhouston.com/eviction-attorney-near-me-fulshear-tx/|2|2|0|EQ
foreclosure lawyers near me Fulshear TX|https://realestatelawyerhouston.com/foreclosure-lawyers-near-me-fulshear-tx/|2|2|0|EQ
foreclosure attorney Fulshear TX|https://realestatelawyerhouston.com/foreclosure-attorney-fulshear-tx/|2|2|0|EQ
lawyer for rental issues Cinco Ranch, TX|https://realestatelawyerhouston.com/lawyer-for-rental-issues-cinco-ranch-tx/|2|1|1|DOWN
eviction lawyers Fulshear, TX|https://realestatelawyerhouston.com/eviction-lawyers-fulshear-tx/|2|2|0|EQ
lawyer for apartments Cinco Ranch, TX|https://realestatelawyerhouston.com/lawyer-for-apartments-cinco-ranch-texas/|2|2|0|EQ
real estate transaction attorney Cinco Ranch, TX|https://realestatelawyerhouston.com/cinco-ranch-tx-real-estate-attorney-near-me/|2|1|1|DOWN
lawyer for breaking lease Katy, TX|https://realestatelawyerhouston.com/lawyer-for-breaking-lease-katy-tx/|2|1|1|DOWN
lawyer for breaking lease Fulshear, TX|https://realestatelawyerhouston.com/lawyer-for-breaking-lease-fulshear-tx/|2|1|1|DOWN
lawyer for breaking lease Richmond, TX|https://realestatelawyerhouston.com/lawyer-for-breaking-lease-richmond-tx/|2|1|1|DOWN
lawyer for breaking lease Cinco Ranch, TX|https://realestatelawyerhouston.com/professional-lawyer-for-breaking-lease-cinco-ranch-tx/|2|1|1|DOWN
tenant lawyer near me Fulshear, TX|https://realestatelawyerhouston.com/landlord-and-tenant-lawyer-fulshear-tx/|3|3|0|EQ
Katy TX Eviction Lawyers|https://realestatelawyerhouston.com/katy-tx-eviction-attorney/|3|3|0|EQ
Houston TX Real Estate Power of Attorney|https://realestatelawyerhouston.com/houston-tx-real-estate-power-of-attorney/|3|2|1|DOWN
Katy TX lawyer to sue landlord|https://realestatelawyerhouston.com/find-a-confident-lawyer-to-sue-your-landlord-in-katy-tx/|3|2|1|DOWN
real estate transaction attorney Fulshear, TX|https://realestatelawyerhouston.com/real-estate-transaction-attorney-fulshear-tx/|3|4|1|UP
Katy TX renters advocate|https://realestatelawyerhouston.com/an-informative-katy-tx-renters-advocate/|2|2|0|EQ
Cinco Ranch TX property lawyers near me|https://realestatelawyerhouston.com/cinco-ranch-tx-real-estate-attorney-near-me/|2|2|0|EQ
Cinco Ranch TX housing attorney near me|https://realestatelawyerhouston.com/cinco-ranch-tx-real-estate-attorney-near-me/|2|2|0|EQ
attorney real estate near me Cinco Ranch, TX|https://realestatelawyerhouston.com/cinco-ranch-tx-real-estate-attorney-near-me/|2|30|30|NEW
attorney for rental disputes Richmond, TX|https://realestatelawyerhouston.com/attorney-for-rental-disputes-richmond-tx/|3|30|30|NEW
foreclosure lawyers Richmond TX|https://realestatelawyerhouston.com/foreclosure-lawyers-richmond-tx/|3|4|1|UP
lawyers for apartment issues Fulshear, TX|https://realestatelawyerhouston.com/lawyers-for-apartment-issues-fulshear-tx/|2|30|30|NEW
attorney for rental disputes Fulshear, TX|https://realestatelawyerhouston.com/attorney-for-rental-disputes-fulshear-tx/|3|30|30|NEW
real estate attorneys in my area Cinco Ranch, TX|https://realestatelawyerhouston.com/cinco-ranch-tx-real-estate-attorney-near-me/|2|2|0|EQ
Cinco Ranch TX foreclosure lawyers near me|https://realestatelawyerhouston.com/cinco-ranch-tx-foreclosure-attorney-near-me/|2|2|0|EQ
Fulshear TX tenant lawyer|https://realestatelawyerhouston.com/landlord-and-tenant-lawyer-fulshear-tx/|3|3|0|EQ
Houston TX property dispute lawyer|https://realestatelawyerhouston.com/houston-tx-property-dispute-lawyer/|2|7|5|UP
Houston TX lawyers condo management|https://realestatelawyerhouston.com/houston-tx-lawyers-condo-management/|3|1|2|DOWN
real estate litigation attorney near me Cinco Ranch, TX|https://realestatelawyerhouston.com/cinco-ranch-tx-real-estate-attorney-near-me/|2|2|0|EQ
Katy TX litigation lawer|https://realestatelawyerhouston.com/cinco-ranch-tx-civil-litigation-attorney/|16|26|10|UP
foreclosure lawyers near me Richmond TX|https://realestatelawyerhouston.com/foreclosure-lawyers-near-me-richmond-tx/|3|3|0|EQ
Cinco Ranch TX landlord lawyer near me|https://realestatelawyerhouston.com/cinco-ranch-tx-landlord-tenant-lawyer-near-me/|2|1|1|DOWN
landlord and tenant lawyer Fulshear TX|https://realestatelawyerhouston.com/landlord-and-tenant-lawyer-fulshear-tx/|2|2|0|EQ
landlord tenant attorney near me Fulshear, TX|https://realestatelawyerhouston.com/landlord-tenant-attorney-near-me-fulshear-tx/|3|3|0|EQ
rental lawyers Fulshear TX|https://realestatelawyerhouston.com/rental-lawyers-fulshear-tx/|3|3|0|EQ
property dispute lawyers near me Cinco Ranch TX|https://realestatelawyerhouston.com/property-dispute-lawyers-near-me-cinco-ranch-tx/|2|2|0|EQ
property law attorney Cinco Ranch, TX|https://realestatelawyerhouston.com/cinco-ranch-tx-real-estate-attorney-near-me/|2|4|2|UP
attorney for landlord tenant issues near me Fulshear, TX|https://realestatelawyerhouston.com/landlord-and-tenant-lawyer-fulshear-tx/|3|2|1|DOWN
Katy TX Eviction Attorney|https://realestatelawyerhouston.com/katy-tx-eviction-attorney/|5|4|1|DOWN
real estate litigation attorney near me Fulshear, TX|https://realestatelawyerhouston.com/real-estate-litigation-attorney-near-me-fulshear-tx/|3|30|30|NEW
apartment lawyer Fulshear TX|https://realestatelawyerhouston.com/landlord-and-tenant-lawyer-fulshear-tx/|3|2|1|DOWN
Katy TX Eviction Lawyer|https://realestatelawyerhouston.com/katy-tx-eviction-attorney/|5|4|1|DOWN
housing lawyers near me Fulshear TX|https://realestatelawyerhouston.com/housing-lawyers-near-me-fulshear-tx/|3|3|0|EQ
Katy TX foreclosure attorney near me|https://realestatelawyerhouston.com/katy-tx-foreclosure-attorney-near-me/|3|11|8|UP
Katy TX tenant attorney|https://realestatelawyerhouston.com/katy-tx-tenant-lawyer/|5|5|0|EQ
Katy TX rental attorneys near me|https://realestatelawyerhouston.com/katy-tx-rental-lawyers/|6|9|3|UP
Katy TX tenant rights attorney|https://realestatelawyerhouston.com/katy-tx-tenant-lawyer/|4|3|1|DOWN
landlord tenant lawyer near me Fulshear, TX|https://realestatelawyerhouston.com/landlord-and-tenant-lawyer-fulshear-tx/|3|3|0|EQ
Katy TX tenant rights lawyer|https://realestatelawyerhouston.com/katy-tx-tenant-lawyer/|6|4|2|DOWN
eviction attorney Richmond TX|https://realestatelawyerhouston.com/eviction-attorney-near-me-richmond-tx/|4|3|1|DOWN
eviction lawyer near me Richmond TX|https://realestatelawyerhouston.com/eviction-attorney-near-me-richmond-tx/|4|3|1|DOWN
eviction attorney near me Richmond, TX|https://realestatelawyerhouston.com/eviction-attorney-near-me-richmond-tx/|3|3|0|EQ
Richmond TX eviction lawyer|https://realestatelawyerhouston.com/eviction-attorney-near-me-richmond-tx/|4|2|2|DOWN
home lawyers Cinco Ranch, TX|https://realestatelawyerhouston.com/cinco-ranch-tx-real-estate-attorney-near-me/|3|3|0|EQ
realty lawyers near me Fulshear, TX|https://realestatelawyerhouston.com/attorney-real-estate-near-me-fulshear-tx/|4|4|0|EQ
Houston TX property dispute lawyers near me|https://realestatelawyerhouston.com/houston-tx-property-dispute-lawyers-near-me/|4|3|1|DOWN
Fulshear TX real estate attorney near me|https://realestatelawyerhouston.com/attorney-real-estate-near-me-fulshear-tx/|4|4|0|EQ
best real estate lawyer Fulshear, TX|https://realestatelawyerhouston.com/best-real-estate-lawyer-fulshear-tx/|4|30|30|NEW
Fulshear TX real estate lawyer near me|https://realestatelawyerhouston.com/fulshear-tx-real-estate-lawyer/|4|4|0|EQ
attorney real estate near me Fulshear, TX|https://realestatelawyerhouston.com/attorney-real-estate-near-me-fulshear-tx/|4|30|30|NEW
Katy TX Rental Lawyers|https://realestatelawyerhouston.com/katy-tx-rental-lawyers/|7|7|0|EQ
property lawyers near me Fulshear TX|https://realestatelawyerhouston.com/property-lawyers-near-me-fulshear-tx/|4|4|0|EQ
eviction lawyers Richmond, TX|https://realestatelawyerhouston.com/eviction-lawyers-richmond-tx/|5|3|2|DOWN
foreclosure attorney Richmond TX|https://realestatelawyerhouston.com/foreclosure-lawyers-richmond-tx/|4|4|0|EQ
lawyer for apartments Richmond, TX|https://realestatelawyerhouston.com/lawyer-for-apartments-richmond-tx/|4|4|0|EQ
Katy TX Tenant Lawyer|https://realestatelawyerhouston.com/katy-tx-tenant-lawyer/|7|8|1|UP
Katy TX Landlord Tenant Attorney|https://realestatelawyerhouston.com/katy-tx-landlord-tenant-attorney/|6|5|1|DOWN
Katy TX foreclosure lawyers near me|https://realestatelawyerhouston.com/katy-tx-foreclosure-attorney-near-me/|5|10|5|UP
lawyer for rental issues Richmond, TX|https://realestatelawyerhouston.com/attorney-for-rental-disputes-richmond-tx/|5|6|1|UP
Katy TX eviction attorney near me|https://realestatelawyerhouston.com/katy-tx-eviction-attorney/|6|2|4|DOWN
Katy TX landlord lawyer|https://realestatelawyerhouston.com/katy-tx-landlord-tenant-attorney/|8|8|0|EQ
realtor lawyer Richmond TX|https://realestatelawyerhouston.com/realtor-lawyer-richmond-tx/|5|5|0|EQ
housing lawyers Fulshear TX|https://realestatelawyerhouston.com/landlord-and-tenant-lawyer-fulshear-tx/|5|5|0|EQ
Katy TX foreclosure lawyers|https://realestatelawyerhouston.com/katy-tx-foreclosure-attorney-near-me/|5|17|12|UP
lawyer for apartments Katy, TX|https://realestatelawyerhouston.com/lawyer-for-apartments-katy-tx/|6|6|0|EQ
Katy TX landlord tenant attorney near me|https://realestatelawyerhouston.com/katy-tx-landlord-tenant-attorney/|6|9|3|UP
lawyers for apartment issues Richmond, TX|https://realestatelawyerhouston.com/lawyers-for-apartment-issues-richmond-tx/|5|30|30|NEW
civil litigation attorney near me Richmond, TX|https://realestatelawyerhouston.com/civil-litigation-lawyer-richmond-tx/|5|5|0|EQ
Houston TX property management lawyer|https://realestatelawyerhouston.com/houston-tx-property-management-lawyer/|5|4|1|DOWN
Katy TX rental lawyers near me|https://realestatelawyerhouston.com/katy-tx-rental-lawyers/|6|8|2|UP
Katy TX tenants law firm|https://realestatelawyerhouston.com/katy-tx-tenant-lawyer/|6|6|0|EQ
civil litigation attorney Richmond TX|https://realestatelawyerhouston.com/cinco-ranch-tx-civil-litigation-attorney/|6|6|0|EQ
attorney for landlord tenant issues near me Katy, TX|https://realestatelawyerhouston.com/katy-tx-landlord-tenant-attorney/|6|2|4|DOWN
Fulshear TX real estate lawyer|https://realestatelawyerhouston.com/fulshear-tx-real-estate-lawyer/|6|6|0|EQ
lawyer for rental issues Katy, TX|https://realestatelawyerhouston.com/katy-tx-landlord-tenant-attorney/|6|5|1|DOWN
Katy TX landlord and tenant lawyer|https://realestatelawyerhouston.com/katy-tx-eviction-attorney/|6|7|1|UP
Katy TX landlord attorney near me|https://realestatelawyerhouston.com/katy-tx-landlord-tenant-attorney/|6|8|2|UP
apartment lawyer Richmond TX|https://realestatelawyerhouston.com/apartment-lawyer-richmond-tx/|6|6|0|EQ
Katy TX renters rights attorney|https://realestatelawyerhouston.com/katy-tx-tenant-lawyer/|6|5|1|DOWN
attorney for landlord tenant issues near me Richmond, TX|https://realestatelawyerhouston.com/landlord-tenant-attorney-near-me-richmond-tx/|6|5|1|DOWN
Katy TX housing attorney|https://realestatelawyerhouston.com/|1|1|0|EQ
property dispute lawyers near me Katy TX|https://realestatelawyerhouston.com/property-dispute-lawyers-near-me-katy-tx/|6|6|0|EQ
civil litigation lawyer Richmond TX|https://realestatelawyerhouston.com/civil-litigation-lawyer-richmond-tx/|6|6|0|EQ
Katy TX foreclosure attorney|https://realestatelawyerhouston.com/katy-tx-foreclosure-attorney-near-me/|6|19|13|UP
Katy TX landlord attorney|https://realestatelawyerhouston.com/katy-tx-landlord-tenant-attorney/|8|8|0|EQ
Richmond TX landlord tenant attorney|https://realestatelawyerhouston.com/richmond-tx-landlord-tenant-attorney/|6|5|1|DOWN
real estate litigation attorney near me Richmond, TX|https://realestatelawyerhouston.com/real-estate-litigation-attorney-near-me-richmond-tx/|6|30|30|NEW
realtor lawyer Katy TX|https://realestatelawyerhouston.com/powerful-realtor-lawyer-katy-tx/|6|4|2|DOWN
lawyers for apartment issues Katy, TX|https://realestatelawyerhouston.com/lawyers-for-apartment-issues-katy-tx/|6|30|30|NEW
landlord tenant attorney near me Richmond, TX|https://realestatelawyerhouston.com/landlord-tenant-attorney-near-me-richmond-tx/|6|6|0|EQ
Katy TX rental attorney|https://realestatelawyerhouston.com/katy-tx-rental-lawyers/|7|7|0|EQ
Katy TX landlord lawyer near me|https://realestatelawyerhouston.com/katy-tx-landlord-tenant-attorney/|7|8|1|UP
Katy TX tenant landlord lawyer|https://realestatelawyerhouston.com/katy-tx-tenant-lawyer/|7|7|0|EQ
Houston TX eviction removal lawyer|https://realestatelawyerhouston.com/houston-tx-eviction-lawyer/|8|6|2|DOWN
Houston TX housing lawyers near me|https://realestatelawyerhouston.com/houston-tx-housing-lawyers-near-me/|7|7|0|EQ
home lawyers Fulshear, TX|https://realestatelawyerhouston.com/home-lawyers-fulshear-tx/|7|8|1|UP
attorney for rental disputes Katy, TX|https://realestatelawyerhouston.com/katy-tx-landlord-tenant-attorney/|7|30|30|NEW
Houston TX real estate closing attorney near me|https://realestatelawyerhouston.com/houston-tx-real-estate-closing-attorney-near-me/|6|30|24|NEW
Katy TX real estate closing attorney near me|https://realestatelawyerhouston.com/katy-tx-real-estate-attorney-fees-for-closing/|7|30|23|NEW
Katy TX housing attorney near me|https://realestatelawyerhouston.com/housing-lawyers-near-me-katy-tx/|10|10|0|EQ
Katy TX Landlord Tenant Lawyer Near Me|https://realestatelawyerhouston.com/katy-tx-landlord-tenant-attorney/|8|10|2|UP
Katy TX eviction lawyer near me|https://realestatelawyerhouston.com/katy-tx-eviction-attorney/|7|5|2|DOWN
Katy TX apartment lawyer|https://realestatelawyerhouston.com/katy-tx-tenant-lawyer/|7|7|0|EQ
Katy TX foreclosure defense attorney|https://realestatelawyerhouston.com/katy-tx-foreclosure-attorney-near-me/|7|30|23|NEW
housing lawyers near me Richmond TX|https://realestatelawyerhouston.com/housing-lawyers-richmond-tx/|7|7|0|EQ
Houston TX tenant eviction lawyer near me|https://realestatelawyerhouston.com/houston-tx-eviction-lawyer/|8|9|1|UP
Katy TX breach of contract lawyers|https://realestatelawyerhouston.com/cinco-ranch-tx-breach-of-contract-lawyers/|8|7|1|DOWN
Fulshear TX real estate attorney|https://realestatelawyerhouston.com/fulshear-tx-real-estate-lawyer/|8|7|1|DOWN
Richmond TX civil litigation|https://realestatelawyerhouston.com/civil-litigation-lawyer-richmond-tx/|8|6|2|DOWN
Katy TX realtor attorney near me|https://realestatelawyerhouston.com/powerful-realtor-lawyer-katy-tx/|7|7|0|EQ
property law attorney Fulshear, TX|https://realestatelawyerhouston.com/property-law-attorney-fulshear-tx/|8|10|2|UP
home lawyers Richmond, TX|https://realestatelawyerhouston.com/home-lawyers-richmond-tx/|8|16|8|UP
Katy TX tenant lawyer near me|https://realestatelawyerhouston.com/katy-tx-landlord-tenant-attorney/|9|9|0|EQ
Houston TX eviction attorney near me|https://realestatelawyerhouston.com/houston-tx-eviction-lawyer/|8|9|1|UP
Houston TX eviction lawyers for tenants near me|https://realestatelawyerhouston.com/houston-tx-eviction-lawyer/|8|15|7|UP
tenant lawyer near me Richmond, TX|https://realestatelawyerhouston.com/tenant-lawyer-near-me-richmond-tx/|8|8|0|EQ
Katy TX lease lawyers|https://realestatelawyerhouston.com/katy-tx-rental-lawyers/|8|7|1|DOWN
landlord tenant lawyer near me Richmond, TX|https://realestatelawyerhouston.com/tenant-lawyer-near-me-richmond-tx/|8|8|0|EQ
Houston TX Eviction Lawyer Near Me|https://realestatelawyerhouston.com/houston-tx-eviction-lawyer/|8|8|0|EQ
Katy TX lease attorney|https://realestatelawyerhouston.com/a-passionate-katy-tx-lease-attorney/|9|8|1|DOWN
Houston TX evicntion attorney|https://realestatelawyerhouston.com/houston-tx-eviction-lawyer/|9|9|0|EQ
Houston TX Housing Attorney|https://realestatelawyerhouston.com/houston-tx-housing-lawyers-near-me/|8|11|3|UP
Houston TX Eviction Lawyers for Tenants|https://realestatelawyerhouston.com/houston-tx-eviction-lawyer/|9|9|0|EQ
rental lawyers Richmond TX|https://realestatelawyerhouston.com/apartment-lawyer-richmond-tx/|8|9|1|UP
property law attorney Richmond, TX|https://realestatelawyerhouston.com/property-law-attorney-richmond-tx/|9|11|2|UP
Katy TX local real estate attorney|https://realestatelawyerhouston.com/expert-katy-tx-local-real-estate-attorney/|7|13|6|UP
Houston TX eviction lawyers for landlords|https://realestatelawyerhouston.com/houston-tx-eviction-lawyer/|9|10|1|UP
